filed_utc,kind,title,link,summary,pct_change,info_date
2026-04-09T12:30:00Z,pce_inflation,"Personal Income and Outlays, February 2026",https://www.bea.gov/news/2026/personal-income-and-outlays-february-2026,"Personal income decreased $18.2 billion (0.1 percent at a monthly rate) in February, according to estimates released today by the U.S. Bureau of Economic Analysis. Disposable personal income (DPI)-personal income less personal current taxes-decreased $18.3 billion (0.1 percent), and personal consumption expenditures (PCE) increased $103.2 billion (0.5 percent). Personal outlays-the sum of PCE, per",-0.1,February 2026
2026-04-09T12:30:00Z,corporate_profits,"GDP (Third Estimate), Industries, Corporate Profits, State GDP, and State Personal Income, 4th Quarter and Year 2025",https://www.bea.gov/news/2026/gdp-third-estimate-industries-corporate-profits-state-gdp-and-state-personal-income-4th,"Real gross domestic product (GDP) increased at an annual rate of 0.5 percent in the fourth quarter of 2025 (October, November, and December), according to the third estimate released today by the U.S. Bureau of Economic Analysis. In the third quarter of 2025, real GDP increased 4.4 percent. The contributors to the increase in real GDP in the fourth quarter were increases in consumer spending and i",+0.5,Q4 2025
2026-04-02T12:30:00Z,trade,"U.S. International Trade in Goods and Services, February 2026",https://www.bea.gov/news/2026/us-international-trade-goods-and-services-february-2026,"The U.S. monthly international trade deficit increased in February 2026 according to the U.S. Bureau of Economic Analysis and the U.S. Census Bureau. The deficit increased from $54.7 billion in January (revised) to $57.3 billion in February, as imports increased more than exports. The goods deficit increased $2.5 billion in February to $84.6 billion. The services surplus decreased $0.2 billion in ",-57.3,February 2026
2026-03-25T12:30:00Z,gdp,"U.S. International Transactions and Investment Position, 4th Quarter and Year 2025",https://www.bea.gov,"The U.S. current-account deficit resulting from international economic transactions narrowed by $48.4 billion, or 20.2 percent, to $190.7 billion in the fourth quarter of 2025, according to statistics released today by the U.S. Bureau of Economic Analysis. The revised third-quarter deficit was $239.1 billion. The fourth-quarter deficit was 2.4 percent of current-dollar gross domestic product, down",-$190.7 B,Q4 2025
2026-03-13T12:31:00Z,pce_inflation,"Personal Income and Outlays, January 2026",https://www.bea.gov/news/2026/personal-income-and-outlays-january-2026,"Personal income increased $113.8 billion (0.4 percent at a monthly rate) in January, according to estimates released today by the U.S. Bureau of Economic Analysis. Disposable personal income (DPI)-personal income less personal current taxes-increased $219.9 billion (0.9 percent), and personal consumption expenditures (PCE) increased $81.1 billion (0.4 percent). Personal outlays-the sum of PCE, per",+0.4,January 2026
2026-03-05T15:00:00Z,gdp,"Outdoor Recreation Economic Statistics, U.S. and States, 2024",https://www.bea.gov/news/2026/outdoor-recreation-economic-statistics-us-and-states-2024,"The value added of the outdoor recreation economy accounted for 2.4 percent ($696.7 billion) of current-dollar gross domestic product (GDP) for the nation in 2024. Across states and the District of Columbia, value added for outdoor recreation as a share of state GDP ranged from 6.1 percent in Hawaii to 1.0 percent in the District of Columbia. <!--Full Text Link--><a href='https://www.bea.gov/news/",,"U.S. and States, 2024"
2026-02-20T13:30:00Z,pce_inflation,"Personal Income and Outlays, December 2025",https://www.bea.gov/news/2026/personal-income-and-outlays-december-2025,"Personal income increased $86.2 billion (0.3 percent at a monthly rate) in December, according to estimates released today by the U.S. Bureau of Economic Analysis. Disposable personal income (DPI)-personal income less personal current taxes-increased $75.7 billion (0.3 percent), and personal consumption expenditures (PCE) increased $91.0 billion (0.4 percent). Personal outlays-the sum of PCE, pers",+0.3,December 2025
2026-02-20T13:30:00Z,gdp,"GDP (Advance Estimate), 4th Quarter and Year 2025",www.bea.gov/news/2026/gdp-advance-estimate-4th-quarter-and-year-2025,"Real gross domestic product (GDP) increased at an annual rate of 1.4 percent in the fourth quarter of 2025 (October, November, and December), according to the advance estimate released today by the U.S. Bureau of Economic Analysis. In the third quarter, real GDP increased 4.4 percent. The contributors to the increase in real GDP in the fourth quarter were increases in consumer spending and investm",+1.4,Q4 2025
2026-02-19T13:30:00Z,pce_inflation,"Real Personal Consumption Expenditures by State and Real Personal Income by State, 2024",https://www.bea.gov/news/2026/real-personal-consumption-expenditures-state-and-real-personal-income-state-2024,"Real personal consumption expenditures (PCE) by state increased in 48 states and the District of Columbia in 2024, with the percent change ranging from 5.3 percent in Massachusetts to -0.2 percent in Montana. Real PCE for the nation increased 2.9 percent in 2024. Real personal income increased in 46 states and the District of Columbia in 2024, with the percent change ranging from 5.5 percent in Ca",,2024
2026-02-05T13:30:00Z,gdp,"Gross Domestic Product by County and Personal Income by County, 2024",https://www.bea.gov/news/2026/gross-domestic-product-county-and-personal-income-county-2024,"Real gross domestic product (GDP) increased in 2,273 counties, decreased in 809 counties, and was unchanged in 24 counties in 2024. County-level changes ranged from a 76.6 percent increase in Carter County, MT, to a 46.3 percent decline in Baca County, CO. Personal income, in current dollars, increased in 2,768 counties, decreased in 331, and was unchanged in 7 counties in 2024. County-level chang",,2024
2026-01-23T13:30:00Z,gdp,"Gross Domestic Product by State and Personal Income by State, 3rd Quarter 2025",https://www.bea.gov/news/2026/gross-domestic-product-state-and-personal-income-state-3rd-quarter-2025,Real gross domestic product (GDP) increased in all 50 states and the District of Columbia in the third quarter of 2025. State-level changes ranged from a 6.5 percent increase in Kansas to a 0.4 percent increase in North Dakota. Personal income increased in all 50 states and the District of Columbia in the third quarter of 2025. State-level changes ranged from a 6.3 percent increase in Kansas to a ,,3rd Quarter 2025
2026-01-16T15:00:00Z,press,"U.S. International Investment Position, 3rd Quarter 2025",https://www.bea.gov/news/2026/us-international-investment-position-3rd-quarter-2025,"The U.S. net international investment position, the difference between U.S. residents' foreign financial assets and liabilities, was -$27.61 trillion at the end of the third quarter of 2025, according to statistics released today by the U.S. Bureau of Economic Analysis. Assets totaled $41.27 trillion, and liabilities were $68.89 trillion. At the end of the second quarter, the net investment positi",-$27.61 trillion,3rd Quarter 2025
2026-01-14T13:30:00Z,gdp,"U.S. International Transactions, 3rd Quarter 2025",https://www.bea.gov/news/2026/us-international-transactions-3rd-quarter-2025,"The U.S. current-account deficit narrowed by $22.8 billion, or 9.2 percent, to $226.4 billion in the third quarter of 2025, according to statistics released today by BEA. The revised second-quarter deficit was $249.2 billion. The third-quarter deficit was 2.9 percent of current-dollar gross domestic product, down from 3.3 percent in the second quarter. <!--Full Text Link--><a href='https://www.bea",-226.4,3rd quarter 2025
2025-12-05T13:30:00Z,direct_investment,"Activities of U.S. Affiliates of Foreign Multinational Enterprises, 2023",https://www.bea.gov/news/2025/activities-us-affiliates-foreign-multinational-enterprises-2023,"Majority-owned U.S. affiliates of foreign multinational enterprises employed 8.66 million workers in the United States in 2023, a 1.9 percent increase from 8.5 million workers in 2022, according to the U.S. Bureau of Economic Analysis. These affiliates accounted for 6.2 percent of total private-industry employment in the United States in 2023. <!--Full Text Link--><a href='https://www.bea.gov/news",,2023
2025-09-16T14:00:00Z,gdp,"Gross Domestic Product for Puerto Rico, 2023",https://www.bea.gov/news/2025/gross-domestic-product-puerto-rico-2023,"Real gross domestic product for Puerto Rico increased 3.0 percent in 2023 after decreasing 2.1 percent in 2022. The increase in real gross domestic product (GDP) in 2023 primarily reflected an increase in exports. Personal consumption expenditures, government spending, and private fixed investment also increased. These increases were partly offset by a decrease in private inventory investment. Imp",,2023
2025-08-22T12:30:00Z,press,"Activities of U.S. Multinational Enterprises, 2023",https://www.bea.gov/news/2025/activities-us-multinational-enterprises-2023,"Worldwide employment by U.S. multinational enterprises decreased 0.4 percent to 43.9 million workers in 2023 (preliminary) from 44.1 million workers in 2022 (revised), according to statistics released today by the U.S. Bureau of Economic Analysis on the operations and finances of U.S. parent companies and their foreign affiliates. <!--Full Text Link--><a href='https://www.bea.gov/news/2025/activit",,2023
2025-07-22T12:30:00Z,direct_investment,"Direct Investment by Country and Industry, 2024",https://www.bea.gov/news/2025/direct-investment-country-and-industry-2024,"The U.S. direct investment abroad position, or cumulative level of investment, increased $206.3 billion to $6.83 trillion at the end of 2024, according to statistics released today by the U.S. Bureau of Economic Analysis. The increase was led by an $88.4 billion increase in the position in Europe, primarily in Luxembourg and Germany. By industry, manufacturing affiliates had the largest increase, ",,2024
2025-07-11T12:30:00Z,direct_investment,"New Foreign Direct Investment in the United States, 2024",https://www.bea.gov/news/2025/new-foreign-direct-investment-united-states-2024,"Expenditures by foreign direct investors to acquire, establish, or expand U.S. businesses totaled $151.0 billion in 2024, according to preliminary statistics released today by the U.S. Bureau of Economic Analysis. Expenditures decreased $24.9 billion, or 14.2 percent, from $176.0 billion (revised) in 2023 and were below the annual average of $277.2 billion for 2014-2023. As in previous years, acqu",,2024
2025-06-05T14:00:00Z,gdp,"Marine Economy Satellite Account, 2023",https://www.bea.gov/news/2025/marine-economy-satellite-account-2023,"The Marine Economy Satellite Account statistics released today by the U.S. Bureau of Economic Analysis show the marine economy accounted for $511.0 billion, or 1.8 percent, of current-dollar U.S. gross domestic product in 2023, an increase from $482.4 billion in 2022. The marine economy accounted for $826.6 billion, or 1.7 percent, of current-dollar gross output in 2023. <!--Full Text Link--><a hr",,2023
2025-04-02T14:00:00Z,gdp,"Arts and Cultural Production Satellite Account, U.S. and States, 2023",https://www.bea.gov/news/2025/arts-and-cultural-production-satellite-account-us-and-states-2023,"The Arts and Cultural Production Satellite Account released by the U.S. Bureau of Economic Analysis shows that arts and cultural economic activity, adjusted for inflation, increased 6.6 percent in 2023 after increasing 3.8 percent in 2022. By comparison, the broader economy, as measured by real gross domestic product (GDP), increased 2.9 percent in 2023 after increasing 2.5 percent in 2022. Arts a",,"U.S. and States, 2023"
2024-12-12T13:30:00Z,pce_inflation,"Real Personal Consumption Expenditures by State and Real Personal Income by State and Metropolitan Area, 2023",https://www.bea.gov/news/2024/real-personal-consumption-expenditures-state-and-real-personal-income-state-and,"Real personal consumption expenditures (PCE) by state increased in 48 states and the District of Columbia in 2023, with the percent change ranging from 7.3 percent in Maine to -0.6 percent in Alabama. Real PCE for the nation increased 2.5 percent in 2023. <!--Full Text Link--><a href='https://www.bea.gov/news/2024/real-personal-consumption-expenditures-state-and-real-personal-income-state-and'>Ful",,
2024-12-04T13:30:00Z,gdp,"Gross Domestic Product by County and Metropolitan Area, 2023",https://www.bea.gov/news/2024/gross-domestic-product-county-and-metropolitan-area-2023,"In 2023, real gross domestic product (GDP) increased in 2,357 counties, decreased in 734 counties, and was unchanged in 23 counties. The percent change in real GDP ranged from 125.8 percent in Throckmorton County, TX, to -39.6 percent in Lincoln County, WA. <!--Full Text Link--><a href='https://www.bea.gov/news/2024/gross-domestic-product-county-and-metropolitan-area-2023'>Full Text</a><!--Full Te",,
2024-11-21T23:00:00Z,gdp,"Gross Domestic Product for the Commonwealth of the Northern Mariana Islands, 2021 and 2022",https://www.bea.gov/news/2024/gross-domestic-product-commonwealth-northern-mariana-islands-2021-and-2022,"Real gross domestic product (GDP) for the Commonwealth of the Northern Mariana Islands increased 16.7 percent in 2022 and 5.1 percent in 2021 after decreasing 29.1 percent in 2020. The growth in real GDP from 2021 to 2022 reflected increases in exports, government spending, and private fixed investment. These increases were partly offset by a decrease in personal consumption expenditures. Imports,",,
2024-11-20T15:00:00Z,gdp,"Outdoor Recreation Satellite Account, U.S. and States, 2023",https://www.bea.gov/news/2024/outdoor-recreation-satellite-account-us-and-states-2023,"The U.S. Bureau of Economic Analysis released statistics today measuring the outdoor recreation economy for the nation, all 50 states, and the District of Columbia. The new U.S. data show that the value added of the outdoor recreation economy accounted for 2.3 percent ($639.5 billion) of current-dollar gross domestic product (GDP) for the nation in 2023. At the state level, value added for outdoor",,
2024-11-14T13:30:00Z,regional,"Personal Income by County and Metropolitan Area, 2023",https://www.bea.gov/news/2024/personal-income-county-and-metropolitan-area-2023,"In 2023, personal income, in current dollars, increased in 2,814 counties, decreased in 295, and was unchanged in five counties in 2023. Personal income increased 6.0 percent in the metropolitan portion of the United States and 4.7 percent in the nonmetropolitan portion. <!--Full Text Link--><a href='https://www.bea.gov/news/2024/personal-income-county-and-metropolitan-area-2023'>Full Text</a><!--",,
2024-10-03T12:30:00Z,pce_inflation,"Personal Consumption Expenditures by State, 2023",https://www.bea.gov/news/2024/personal-consumption-expenditures-state-2023,"Personal consumption expenditures (PCE) increased in all 50 states and the District of Columbia in 2023. The percent change ranged from 8.1 percent in Florida to 4.7 percent in Iowa. Nationally, current-dollar PCE increased 6.4 percent in 2023 after increasing 9.8 percent in 2022. <!--Full Text Link--><a href='https://www.bea.gov/news/2024/personal-consumption-expenditures-state-2023'>Full Text</a",,
2024-06-17T14:00:00Z,gdp,"Gross Domestic Product for the U.S. Virgin Islands, 2022",https://www.bea.gov/news/2024/gross-domestic-product-us-virgin-islands-2022,"Real gross domestic product (GDP) for the U.S. Virgin Islands decreased 1.3 percent in 2022 after increasing 3.7 percent in 2021. The decrease in real GDP reflected declines in exports, private fixed investment, government spending, and personal consumption expenditures that were partly offset by an increase in inventory investment. Imports, a subtraction item in the calculation of GDP, decreased.",,
2024-04-15T23:00:00Z,gdp,"Gross Domestic Product for Guam, 2022",https://www.bea.gov/news/2024/gross-domestic-product-guam-2022,"Real gross domestic product (GDP) for Guam increased 5.1 percent in 2022 after increasing 2.1 percent in 2021. The increase in real GDP reflected increases in exports, private fixed investment, government spending, and personal consumption expenditures. Imports, a subtraction item in the calculation of GDP, increased. <!--Full Text Link--><a href='https://www.bea.gov/news/2024/gross-domestic-produ",,
2023-12-05T15:00:00Z,gdp,"Gross Domestic Product by State, 2nd Quarter 2023 and Comprehensive Update",https://www.bea.gov/news/2023/gross-domestic-product-state-2nd-quarter-2023-and-comprehensive-update,"Real gross domestic product (GDP) increased in 44 states and the District of Columbia in the second quarter of 2023, with the percent change ranging from 8.7 percent in Wyoming to -1.9 percent in Vermont. <!--Full Text Link--><a href='https://www.bea.gov/news/2023/gross-domestic-product-state-2nd-quarter-2023-and-comprehensive-update'>Full Text</a><!--Full Text Link-->",,
2023-12-05T13:30:00Z,gdp,"Gross Domestic Product by Industry, 2nd Quarter 2023 and Comprehensive Update",https://www.bea.gov/news/2023/gross-domestic-product-industry-2nd-quarter-2023-and-comprehensive-update,"In the second quarter, the value added of private goods-producing industries increased 7.7 percent, private services-producing industries increased 1.0 percent, and government increased 1.0 percent. Overall, 13 of 22 industry groups contributed to the 2.1 percent increase in second-quarter real GDP. <!--Full Text Link--><a href='https://www.bea.gov/news/2023/gross-domestic-product-industry-2nd-qua",,
2023-10-20T19:30:00Z,gdp,"Gross Domestic Product for American Samoa, 2022",https://www.bea.gov/news/2023/gross-domestic-product-american-samoa-2022,"Real gross domestic product (GDP) for American Samoa increased 1.8 percent in 2022 after decreasing 0.8 percent in 2021. The increase in real GDP reflected increases in government spending and exports. Personal consumption expenditures, private fixed investment, and private inventory investment subtracted from growth. Imports, a subtraction item in the calculation of GDP, also decreased. <!--Full ",,
2023-09-29T14:00:00Z,press,"Personal Income by State, 2nd Quarter 2023",https://www.bea.gov/news/2023/personal-income-state-2nd-quarter-2023,"Personal income, in current dollars, increased in 49 states and the District of Columbia in the second quarter of 2023, with the percent change ranging from 6.1 percent in New York and the District of Columbia to -2.7 percent in Maine. <!--Full Text Link--><a href='https://www.bea.gov/news/2023/personal-income-state-2nd-quarter-2023'>Full Text</a><!--Full Text Link-->",,
2022-12-08T13:30:00Z,gdp,"Gross Domestic Product by County, 2021",https://www.bea.gov/news/2022/gross-domestic-product-county-2021,"Real gross domestic product (GDP) increased in 2,404 counties, decreased in 691 counties, and was unchanged in 17 counties in 2021. The percent change in real GDP ranged from 81.8 percent in Coke County, TX, to -34.8 percent in Chouteau County, MT. <!--Full Text Link--><a href='https://www.bea.gov/news/2022/gross-domestic-product-county-2021'>Full Text</a><!--Full Text Link-->",,
2021-12-14T13:30:00Z,pce_inflation,"Real Personal Consumption Expenditures and Personal Income by State, 2020",https://www.bea.gov/news/2021/real-personal-consumption-expenditures-state-and-real-personal-income-state-and,"Today, the U.S Bureau of Economic Analysis (BEA) released official statistics of real state personal consumption expenditures (PCE) for the first time. Real PCE decreased 3.8 percent in 2020 for the nation. Across states, the percent change ranged from 2.2 percent in Utah to -7.0 percent in Hawaii, Maryland, and New York; the percent change was -8.9 percent in the District of Columbia. Real state ",,
2021-04-06T23:00:00Z,gdp,"Gross Domestic Product for the CNMI, 2019",https://www.bea.gov/news/2021/gross-domestic-product-cnmi-2019,The estimates of GDP for the CNMI show that real GDP-GDP adjusted to remove price changes-decreased 11.2 percent in 2019 after decreasing 19.3 percent in 2018. This release also includes the results of a comprehensive update of the territorial economic accounts. <!--Full Text Link--><a href='https://www.bea.gov/news/2021/gross-domestic-product-cnmi-2019'>Full Text</a><!--Full Text Link-->,,
2020-12-15T13:30:00Z,regional,"Real Personal Income by State and Metropolitan Area, 2019",https://www.bea.gov/news/2020/real-personal-income-state-and-metropolitan-area-2019,"Real state personal income grew 2.4 percent in 2019 after increasing 3.1 percent in 2018, according to estimates released today by the Bureau of Economic Analysis (BEA). Real state personal income is a state's current-dollar personal income adjusted by the state's regional price parity and the national personal consumption expenditures price index. The percent change in real state personal income ",,
2019-12-18T13:30:00Z,regional,"State Quarterly Personal Income, 3rd quarter 2019",https://www.bea.gov/news/2019/state-personal-income-third-quarter-2019,"State personal income increased 3.8 percent at an annual rate in the third quarter of 2019, a deceleration from the 4.4 percent increase in the second quarter. The percent change in personal income across all states ranged from 15.2 percent in South Dakota to 1.9 percent in West Virginia and Wyoming. <!--Full Text Link--><a href='https://www.bea.gov/news/2019/state-personal-income-third-quarter-20",,
2019-12-12T13:30:00Z,gdp,"Local Area Gross Domestic Product, 2018",https://www.bea.gov/news/2019/local-area-gross-domestic-product-2018,"Real gross domestic product (GDP) increased in 2,375 counties, decreased in 717, and was unchanged in 21 in 2018, according to estimates released today by the U.S. Bureau of Economic Analysis (BEA). The percentage change in real GDP ranged from 86.5 percent in Jackson County, WV, to -44.0 percent in Grant County, ND. <!--Full Text Link--><a href='https://www.bea.gov/news/2019/local-area-gross-dome",,
2019-11-07T00:00:00Z,gdp,"Gross Domestic Product for the Commonwealth of the Northern Mariana Islands (CNMI), 2018",https://www.bea.gov/news/2019/gross-domestic-product-commonwealth-northern-mariana-islands-cnmi-2018,"The estimates of GDP for the CNMI show that real GDP-GDP adjusted to remove price changes-decreased 19.6 percent in 2018 after increasing 25.5 percent in 2017 (see Table 1.3). For comparison, real GDP for the United States (excluding the territories) increased 2.9 percent in 2018 after increasing 2.4 percent in 2017. <!--Full Text Link--><a href='https://www.bea.gov/news/2019/gross-domestic-produc",,
2018-12-17T13:30:00Z,gdp,"Gross Domestic Product for U.S. Virgin Islands (USVI), 2017",https://www.bea.gov/news/2018/us-virgin-islands-gdp-decreases-2017,"The estimates of GDP for the USVI show that real GDP - GDP adjusted to remove price changes - decreased 1.7 percent in 2017 after increasing 0.9 percent in 2016. For comparison, real GDP for the United States (excluding the territories) increased 2.2 percent in 2017 after increasing 1.6 percent in 2016. <!--Full Text Link--><a href='https://www.bea.gov/news/2018/us-virgin-islands-gdp-decreases-201",,
2018-07-30T12:30:00Z,direct_investment,"Foreign Direct Investment by Country and Industry, 2017",https://apps.bea.gov/newsreleases/international/fdici/2018/fdici0718.htm,"In 2017, the U.S. direct investment abroad position increased to $6,013.3 billion and the foreign direct investment in the United States position increased to $4,025.5 billion, according to statistics released by the Bureau of Economic Analysis (BEA). The increases were mainly due to increased investment with countries in Europe. <!--Full Text Link--><a href='https://apps.bea.gov/newsreleases/inte",,
2017-12-13T13:30:00Z,gdp,"Travel and Tourism Satellite Accounts, 3rd quarter 2017",https://apps.bea.gov/newsreleases/industry/tourism/2017/tour317.htm,"Real spending (output) on travel and tourism accelerated in the third quarter of 2017, growing at an annual rate of 6.6 percent after increasing 6.0 percent (revised) in the second quarter, according to new statistics released by the Bureau of Economic Analysis. Real gross domestic product (GDP) for the nation also accelerated, increasing 3.3 percent in the third quarter (second estimate) after in",,
2017-09-20T12:30:00Z,gdp,"Gross Domestic Product by Metropolitan Area, 2016",https://apps.bea.gov/newsreleases/regional/gdp_metro/2017/gdp_metro0917.htm,"Real gross domestic product (GDP) increased in 267 out of 382 metropolitan areas in 2016. Real GDP by metropolitan area growth ranged from 8.1 percent in Lake Charles, LA and Bend-Redmond, OR to -13.3 percent in Odessa, TX. Real GDP for U.S. metropolitan areas grew 1.7 percent in 2016, led by growth in professional and business services; information services; and finance, insurance, real estate, r",,
2013-12-18T15:30:00Z,gdp,"Benchmark Input-Output Account of the U.S. Economy, 2007",https://apps.bea.gov/newsreleases/industry/io/2013/io1213.htm,"The Bureau of Economic Analysis (BEA) today released its 2007 Benchmark Input-Output (I-O) Account of the U.S. Economy. This widely used account--which provided the foundation for BEA's 2013 comprehensive revision of its gross domestic product (GDP) statistics--offers a comprehensive picture of the inner workings of the U.S. economy, showing production relationships among nearly 400 industries and",,
