cve_id,vendor,product,vulnerability,date_added,due_date,known_ransomware,tickers_affected,short_desc,captured_at
CVE-2025-61882,Oracle,E-Business Suite,Oracle E-Business Suite Unspecified Vulnerability,2025-10-06,2025-10-27,Known,ORCL,Oracle E-Business Suite contains an unspecified vulnerability in the BI Publisher Integration component. The vulnerability allows unauthenticated attacker with network access via HTTP to compromise Or,2026-04-27T23:12:22Z
CVE-2014-6278,GNU,GNU Bash,GNU Bash OS Command Injection Vulnerability,2025-10-02,2025-10-23,Unknown,,GNU Bash contains an OS command injection vulnerability which allows remote attackers to execute arbitrary commands via a crafted environment.,2026-04-27T23:12:22Z
CVE-2017-1000353,Jenkins,Jenkins,Jenkins Remote Code Execution Vulnerability,2025-10-02,2025-10-23,Unknown,,"Jenkins contains a remote code execution vulnerability. This vulnerability that could allowed attackers to transfer a serialized Java SignedObject object to the remoting-based Jenkins CLI, that would ",2026-04-27T23:12:22Z
CVE-2015-7755,Juniper,ScreenOS,Juniper ScreenOS Improper Authentication Vulnerability,2025-10-02,2025-10-23,Unknown,JNPR,Juniper ScreenOS contains an improper authentication vulnerability that could allow unauthorized remote administrative access to the device.,2026-04-27T23:12:22Z
CVE-2025-21043,Samsung,Mobile Devices,Samsung Mobile Devices Out-of-Bounds Write Vulnerability,2025-10-02,2025-10-23,Unknown,,Samsung mobile devices contain an out-of-bounds write vulnerability in libimagecodec.quram.so which allows remote attackers to execute arbitrary code.,2026-04-27T23:12:22Z
CVE-2025-4008,Smartbedded,Meteobridge,Smartbedded Meteobridge Command Injection Vulnerability,2025-10-02,2025-10-23,Unknown,,Smartbedded Meteobridge contains a command injection vulnerability that could allow remote unauthenticated attackers to gain arbitrary command execution with elevated privileges (root) on affected dev,2026-04-27T23:12:22Z
CVE-2025-32463,Sudo,Sudo,Sudo Inclusion of Functionality from Untrusted Control Sphere Vulnerability,2025-09-29,2025-10-20,Unknown,,Sudo contains an inclusion of functionality from untrusted control sphere vulnerability. This vulnerability could allow local attacker to leverage sudo’s -R (--chroot) option to run arbitrary commands,2026-04-27T23:12:22Z
CVE-2025-59689,Libraesva,Email Security Gateway,Libraesva Email Security Gateway Command Injection Vulnerability,2025-09-29,2025-10-20,Unknown,,Libraesva Email Security Gateway (ESG) contains a command injection vulnerability which allows command injection via a compressed e-mail attachment.,2026-04-27T23:12:22Z
CVE-2025-10035,Fortra,GoAnywhere MFT,Fortra GoAnywhere MFT Deserialization of Untrusted Data Vulnerability,2025-09-29,2025-10-20,Known,,"Fortra GoAnywhere MFT contains a deserialization of untrusted data vulnerability allows an actor with a validly forged license response signature to deserialize an arbitrary actor-controlled object, p",2026-04-27T23:12:22Z
CVE-2025-20352,Cisco,IOS and IOS XE,Cisco IOS and IOS XE Software SNMP Denial of Service and Remote Code Execution Vulnerability,2025-09-29,2025-10-20,Unknown,CSCO,Cisco IOS and IOS XE contains a stack-based buffer overflow vulnerability in the Simple Network Management Protocol (SNMP) subsystem that could allow for denial of service or remote code execution. A ,2026-04-27T23:12:22Z
CVE-2021-21311,Adminer,Adminer,Adminer Server-Side Request Forgery Vulnerability,2025-09-29,2025-10-20,Unknown,,"Adminer contains a server-side request forgery vulnerability that, when exploited, allows a remote attacker to obtain potentially sensitive information.",2026-04-27T23:12:22Z
CVE-2025-20362,Cisco,Secure Firewall Adaptive Security Appliance and Secure Firewall Threat Defense,Cisco Secure Firewall Adaptive Security (ASA) Appliance and Secure Firewall Threat Defense (FTD) Missing Authorization V,2025-09-25,2025-09-26,Unknown,CSCO,Cisco Secure Firewall Adaptive Security (ASA) Appliance and Secure Firewall Threat Defense (FTD) Software VPN Web Server contain a missing authorization vulnerability. This vulnerability could be chai,2026-04-27T23:12:22Z
CVE-2025-20333,Cisco,Secure Firewall Adaptive Security Appliance and Secure Firewall Threat Defense,Cisco Secure Firewall Adaptive Security Appliance (ASA) and Secure Firewall Threat Defense (FTD) Buffer Overflow Vulnera,2025-09-25,2025-09-26,Unknown,CSCO,Cisco Secure Firewall Adaptive Security (ASA) Appliance and Secure Firewall Threat Defense (FTD) Software VPN Web Server contain a buffer overflow vulnerability that allows for remote code execution. ,2026-04-27T23:12:22Z
CVE-2025-10585,Google,Chromium V8,Google Chromium V8 Type Confusion Vulnerability,2025-09-23,2025-10-14,Unknown,GOOGL,Google Chromium contains a type confusion vulnerability in the V8 JavaScript and WebAssembly engine.,2026-04-27T23:12:22Z
CVE-2025-5086,Dassault Systèmes,DELMIA Apriso,Dassault Systèmes DELMIA Apriso Deserialization of Untrusted Data Vulnerability,2025-09-11,2025-10-02,Unknown,,Dassault Systèmes DELMIA Apriso contains a deserialization of untrusted data vulnerability that could lead to a remote code execution.,2026-04-27T23:12:22Z
CVE-2025-38352,Linux,Kernel,Linux Kernel Time-of-Check Time-of-Use (TOCTOU) Race Condition Vulnerability,2025-09-04,2025-09-25,Unknown,,"Linux kernel contains a time-of-check time-of-use (TOCTOU) race condition vulnerability that has a high impact on confidentiality, integrity, and availability.",2026-04-27T23:12:22Z
CVE-2025-48543,Android,Runtime,Android Runtime Use-After-Free Vulnerability,2025-09-04,2025-09-25,Unknown,,Android Runtime contains a use-after-free vulnerability potentially allowing a chrome sandbox escape leading to local privilege escalation.,2026-04-27T23:12:22Z
CVE-2025-53690,Sitecore,Multiple Products,Sitecore Multiple Products Deserialization of Untrusted Data Vulnerability,2025-09-04,2025-09-25,Unknown,,"Sitecore Experience Manager (XM), Experience Platform (XP), Experience Commerce (XC), and Managed Cloud contain a deserialization of untrusted data vulnerability involving the use of default machine k",2026-04-27T23:12:22Z
CVE-2023-50224,TP-Link,TL-WR841N,TP-Link TL-WR841N Authentication Bypass by Spoofing Vulnerability,2025-09-03,2025-09-24,Unknown,,"TP-Link TL-WR841N contains an authentication bypass by spoofing vulnerability within the httpd service, which listens on TCP port 80 by default, leading to the disclose of stored credentials. The impa",2026-04-27T23:12:22Z
CVE-2025-9377,TP-Link,Multiple Routers,TP-Link Archer C7(EU) and TL-WR841N/ND(MS) OS Command Injection Vulnerability,2025-09-03,2025-09-24,Unknown,,TP-Link Archer C7(EU) and TL-WR841N/ND(MS) contain an OS command injection vulnerability that exists in the Parental Control page. The impacted products could be end-of-life (EoL) and/or end-of-servic,2026-04-27T23:12:22Z
CVE-2020-24363,TP-Link,TL-WA855RE,TP-link TL-WA855RE Missing Authentication for Critical Function Vulnerability,2025-09-02,2025-09-23,Unknown,,TP-link TL-WA855RE contains a missing authentication for critical function vulnerability. This vulnerability could allow an unauthenticated attacker (on the same network) to submit a TDDP_RESET POST r,2026-04-27T23:12:22Z
CVE-2025-55177,Meta Platforms,WhatsApp,Meta Platforms WhatsApp Incorrect Authorization Vulnerability,2025-09-02,2025-09-23,Unknown,,Meta Platforms WhatsApp contains an incorrect authorization vulnerability due to an incomplete authorization of linked device synchronization messages. This vulnerability could allow an unrelated user,2026-04-27T23:12:22Z
CVE-2025-57819,Sangoma,FreePBX,Sangoma FreePBX Authentication Bypass Vulnerability,2025-08-29,2025-09-19,Unknown,,Sangoma FreePBX contains an authentication bypass vulnerability due to insufficiently sanitized user-supplied data allows unauthenticated access to FreePBX Administrator leading to arbitrary database ,2026-04-27T23:12:22Z
CVE-2025-7775,Citrix,NetScaler,Citrix NetScaler Memory Overflow Vulnerability,2025-08-26,2025-08-28,Unknown,CTXS,Citrix NetScaler ADC and NetScaler Gateway contain a memory overflow vulnerability that could allow for remote code execution and/or denial of service.,2026-04-27T23:12:22Z
CVE-2025-48384,Git,Git,Git Link Following Vulnerability,2025-08-25,2025-09-15,Unknown,,Git contains a link following vulnerability that stems from Git’s inconsistent handling of carriage return characters in configuration files.,2026-04-27T23:12:22Z
CVE-2024-8068,Citrix,Session Recording,Citrix Session Recording Improper Privilege Management Vulnerability,2025-08-25,2025-09-15,Unknown,CTXS,Citrix Session Recording contains an improper privilege management vulnerability that could allow for privilege escalation to NetworkService Account access. An attacker must be an authenticated user i,2026-04-27T23:12:22Z
CVE-2024-8069,Citrix,Session Recording,Citrix Session Recording Deserialization of Untrusted Data Vulnerability,2025-08-25,2025-09-15,Unknown,CTXS,Citrix Session Recording contains a deserialization of untrusted data vulnerability that allows limited remote code execution with privilege of a NetworkService Account access. Attacker must be an aut,2026-04-27T23:12:22Z
CVE-2025-43300,Apple,"iOS, iPadOS, and macOS","Apple iOS, iPadOS, and macOS Out-of-Bounds Write Vulnerability",2025-08-21,2025-09-11,Unknown,AAPL,"Apple iOS, iPadOS, and macOS contain an out-of-bounds write vulnerability in the Image I/O framework.",2026-04-27T23:12:22Z
CVE-2025-54948,Trend Micro,Apex One,Trend Micro Apex One OS Command Injection Vulnerability,2025-08-18,2025-09-08,Unknown,TMICY,Trend Micro Apex One Management Console (on-premise) contains an OS command injection vulnerability that could allow a pre-authenticated remote attacker to upload malicious code and execute commands o,2026-04-27T23:12:22Z
CVE-2025-8876,N-able,N-Central,N-able N-Central Command Injection Vulnerability,2025-08-13,2025-08-20,Unknown,,N-able N-Central contains a command injection vulnerability via improper sanitization of user input.,2026-04-27T23:12:22Z
CVE-2025-8875,N-able,N-Central,N-able N-Central Insecure Deserialization Vulnerability,2025-08-13,2025-08-20,Unknown,,N-able N-Central contains an insecure deserialization vulnerability that could lead to command execution.,2026-04-27T23:12:22Z
CVE-2025-8088,RARLAB,WinRAR,RARLAB WinRAR Path Traversal Vulnerability,2025-08-12,2025-09-02,Unknown,,RARLAB WinRAR contains a path traversal vulnerability affecting the Windows version of WinRAR. This vulnerability could allow an attacker to execute arbitrary code by crafting malicious archive files.,2026-04-27T23:12:22Z
CVE-2007-0671,Microsoft,Office,Microsoft Office Excel Remote Code Execution Vulnerability,2025-08-12,2025-09-02,Unknown,MSFT,Microsoft Office Excel contains a remote code execution vulnerability that can be exploited when a specially crafted Excel file is opened. This malicious file could be delivered as an email attachment,2026-04-27T23:12:22Z
CVE-2013-3893,Microsoft,Internet Explorer,Microsoft Internet Explorer Resource Management Errors Vulnerability,2025-08-12,2025-09-02,Unknown,MSFT,Microsoft Internet Explorer contains a memory corruption vulnerability that allows for remote code execution. The impacted products could be end-of-life (EoL) and/or end-of-service (EoS). Users should,2026-04-27T23:12:22Z
CVE-2020-25078,D-Link,DCS-2530L and DCS-2670L Devices,D-Link DCS-2530L and DCS-2670L Devices Unspecified Vulnerability,2025-08-05,2025-08-26,Unknown,,D-Link DCS-2530L and DCS-2670L devices contains an unspecified vulnerability that could allow for remote administrator password disclosure. The impacted products could be end-of-life (EoL) and/or end-,2026-04-27T23:12:22Z
CVE-2020-25079,D-Link,DCS-2530L and DCS-2670L Devices,D-Link DCS-2530L and DCS-2670L Command Injection Vulnerability,2025-08-05,2025-08-26,Unknown,,D-Link DCS-2530L and DCS-2670L devices contains a command injection vulnerability in the cgi-bin/ddns_enc.cgi. The impacted products could be end-of-life (EoL) and/or end-of-service (EoS). Users shoul,2026-04-27T23:12:22Z
CVE-2022-40799,D-Link,DNR-322L,D-Link DNR-322L Download of Code Without Integrity Check Vulnerability,2025-08-05,2025-08-26,Unknown,,D-Link DNR-322L contains a download of code without integrity check vulnerability that could allow an authenticated attacker to execute OS level commands on the device. The impacted products could be ,2026-04-27T23:12:22Z
CVE-2023-2533,PaperCut,NG/MF,PaperCut NG/MF Cross-Site Request Forgery (CSRF) Vulnerability,2025-07-28,2025-08-18,Unknown,,"PaperCut NG/MF contains a cross-site request forgery (CSRF) vulnerability, which, under specific conditions, could potentially enable an attacker to alter security settings or execute arbitrary code. ",2026-04-27T23:12:22Z
CVE-2025-20337,Cisco,Identity Services Engine,Cisco Identity Services Engine Injection Vulnerability,2025-07-28,2025-08-18,Unknown,CSCO,Cisco Identity Services Engine contains an injection vulnerability in a specific API of Cisco ISE and Cisco ISE-PIC due to insufficient validation of user-supplied input allowing an attacker to exploi,2026-04-27T23:12:22Z
CVE-2025-20281,Cisco,Identity Services Engine,Cisco Identity Services Engine Injection Vulnerability,2025-07-28,2025-08-18,Unknown,CSCO,Cisco Identity Services Engine contains an injection vulnerability in a specific API of Cisco ISE and Cisco ISE-PIC due to insufficient validation of user-supplied input allowing an attacker to exploi,2026-04-27T23:12:22Z
CVE-2025-2775,SysAid,SysAid On-Prem,SysAid On-Prem Improper Restriction of XML External Entity Reference Vulnerability,2025-07-22,2025-08-12,Unknown,,"SysAid On-Prem contains an improper restriction of XML external entity reference vulnerability in the Checkin processing functionality, allowing for administrator account takeover and file read primit",2026-04-27T23:12:22Z
CVE-2025-2776,SysAid,SysAid On-Prem,SysAid On-Prem Improper Restriction of XML External Entity Reference Vulnerability,2025-07-22,2025-08-12,Unknown,,"SysAid On-Prem contains an improper restriction of XML external entity reference vulnerability in the Server URL processing functionality, allowing for administrator account takeover and file read pri",2026-04-27T23:12:22Z
CVE-2025-6558,Google,Chromium,Google Chromium ANGLE and GPU Improper Input Validation Vulnerability,2025-07-22,2025-08-12,Unknown,GOOGL,Google Chromium contains an improper input validation vulnerability in ANGLE and GPU. This vulnerability could allow a remote attacker to potentially perform a sandbox escape via a crafted HTML page. ,2026-04-27T23:12:22Z
CVE-2025-54309,CrushFTP,CrushFTP, CrushFTP Unprotected Alternate Channel Vulnerability,2025-07-22,2025-08-12,Unknown,,"CrushFTP contains an unprotected alternate channel vulnerability. When the DMZ proxy feature is not used, mishandles AS2 validation and consequently allows remote attackers to obtain admin access via ",2026-04-27T23:12:22Z
CVE-2025-49704,Microsoft,SharePoint,Microsoft SharePoint Code Injection Vulnerability,2025-07-22,2025-07-23,Known,MSFT,Microsoft SharePoint contains a code injection vulnerability that could allow an authorized attacker to execute code over a network. This vulnerability could be chained with CVE-2025-49706. CVE-2025-5,2026-04-27T23:12:22Z
