cve_id,vendor,product,vulnerability,date_added,due_date,known_ransomware,tickers_affected,short_desc,captured_at
CVE-2025-29635,D-Link,DIR-823X,D-Link DIR-823X Command Injection Vulnerability,2026-04-24,2026-05-08,Unknown,,D-Link DIR-823X contains a command injection vulnerability that allows an authorized attacker to execute arbitrary commands on remote devices by sending a POST request to /goform/set_prohibiting via t,2026-04-27T23:12:22Z
CVE-2024-7399,Samsung,MagicINFO 9 Server,Samsung MagicINFO 9 Server Path Traversal Vulnerability,2026-04-24,2026-05-08,Unknown,,Samsung MagicINFO 9 Server contains a path traversal vulnerability that could allow an attacker to write arbitrary files as system authority.,2026-04-27T23:12:22Z
CVE-2024-57728,SimpleHelp ,SimpleHelp,SimpleHelp Path Traversal Vulnerability,2026-04-24,2026-05-08,Unknown,,SimpleHelp contains a path traversal vulnerability that allows admin users to upload arbitrary files anywhere on the file system by uploading a crafted zip file (i.e. zip slip). This can be exploited ,2026-04-27T23:12:22Z
CVE-2024-57726,SimpleHelp ,SimpleHelp,SimpleHelp Missing Authorization Vulnerability,2026-04-24,2026-05-08,Unknown,,SimpleHelp contains a missing authorization vulnerability that could allow low-privileged technicians to create API keys with excessive permissions. These API keys can be used to escalate privileges t,2026-04-27T23:12:22Z
CVE-2026-39987,Marimo,Marimo,Marimo Remote Code Execution Vulnerability,2026-04-23,2026-05-07,Unknown,,"Marimo contains an pre-authorization remote code execution vulnerability, allowing an unauthenticated attacked to shell access and execute arbitrary system commands.",2026-04-27T23:12:22Z
CVE-2026-33825,Microsoft,Defender,Microsoft Defender Insufficient Granularity of Access Control Vulnerability,2026-04-22,2026-05-06,Unknown,MSFT,Microsoft Defender contains an insufficient granularity of access control vulnerability that could allow an authorized attacker to escalate privileges locally.,2026-04-27T23:12:22Z
CVE-2026-20122,Cisco,Catalyst SD-WAN Manger,Cisco Catalyst SD-WAN Manager Incorrect Use of Privileged APIs Vulnerability,2026-04-20,2026-04-23,Unknown,CSCO,Cisco Catalyst SD-WAN Manager contains an incorrect use of privileged APIs vulnerability due to improper file handling on the API interface of an affected system. An attacker could exploit this vulner,2026-04-27T23:12:22Z
CVE-2026-20133,Cisco,Catalyst SD-WAN Manager,Cisco Catalyst SD-WAN Manager Exposure of Sensitive Information to an Unauthorized Actor Vulnerability,2026-04-20,2026-04-23,Unknown,CSCO,Cisco Catalyst SD-WAN Manager contains an exposure of sensitive information to an unauthorized actor vulnerability that could allow remote attackers to view sensitive information on affected systems.,2026-04-27T23:12:22Z
CVE-2025-2749,Kentico,Kentico Xperience,Kentico Xperience Path Traversal Vulnerability,2026-04-20,2026-05-04,Unknown,,Kentico Xperience contains a path traversal vulnerability that could allow an authenticated user's Staging Sync Server to upload arbitrary data to path relative locations.,2026-04-27T23:12:22Z
CVE-2023-27351,PaperCut,NG/MF,PaperCut NG/MF Improper Authentication Vulnerability,2026-04-20,2026-05-04,Known,,PaperCut NG/MF contains an improper authentication vulnerability that could allow remote attackers to bypass authentication on affected installations via the SecurityRequestFilter class.,2026-04-27T23:12:22Z
CVE-2025-48700,Synacor,Zimbra Collaboration Suite (ZCS),Synacor Zimbra Collaboration Suite (ZCS) Cross-site Scripting Vulnerability,2026-04-20,2026-04-23,Unknown,,"Synacor Zimbra Collaboration Suite (ZCS) contains a cross-site scripting vulnerability that could allow attackers to execute arbitrary JavaScript within the user's session, potentially leading to unau",2026-04-27T23:12:22Z
CVE-2026-20128,Cisco,Catalyst SD-WAN Manager,Cisco Catalyst SD-WAN Manager Storing Passwords in a Recoverable Format Vulnerability,2026-04-20,2026-04-23,Unknown,CSCO,"Cisco Catalyst SD-WAN Manager contains a storing passwords in a recoverable format vulnerability that allows an authenticated, local attacker to gain DCA user privileges by accessing a credential file",2026-04-27T23:12:22Z
CVE-2025-32975,Quest,KACE Systems Management Appliance (SMA),Quest KACE Systems Management Appliance (SMA) Improper Authentication Vulnerability,2026-04-20,2026-05-04,Unknown,,Quest KACE Systems Management Appliance (SMA) contains an improper authentication vulnerability that could allow attackers to impersonate legitimate users without valid credentials.,2026-04-27T23:12:22Z
CVE-2024-27199,JetBrains,TeamCity,JetBrains TeamCity Relative Path Traversal Vulnerability,2026-04-20,2026-05-04,Known,,JetBrains TeamCity contains a relative path traversal vulnerability that could allow limited admin actions to be performed.,2026-04-27T23:12:22Z
CVE-2026-34197,Apache,ActiveMQ,Apache ActiveMQ Improper Input Validation Vulnerability,2026-04-16,2026-04-30,Unknown,,Apache ActiveMQ contains an improper input validation vulnerability that allows for code injection.,2026-04-27T23:12:22Z
CVE-2009-0238,Microsoft,Office,Microsoft Office Remote Code Execution,2026-04-14,2026-04-28,Unknown,MSFT,Microsoft Office Excel contains a remote code execution vulnerability that could allow an attacker to take complete control of an affected system if a user opens a specially crafted Excel file that in,2026-04-27T23:12:22Z
CVE-2026-32201,Microsoft,SharePoint Server,Microsoft SharePoint Server Improper Input Validation Vulnerability,2026-04-14,2026-04-28,Unknown,MSFT,Microsoft SharePoint Server contains an improper input validation vulnerability that allows an unauthorized attacker to perform spoofing over a network.,2026-04-27T23:12:22Z
CVE-2012-1854,Microsoft,Visual Basic for Applications (VBA),Microsoft Visual Basic for Applications Insecure Library Loading Vulnerability,2026-04-13,2026-04-27,Unknown,MSFT,Microsoft Visual Basic for Applications (VBA) contains an insecure library loading vulnerability that could allow for remote code execution.,2026-04-27T23:12:22Z
CVE-2025-60710,Microsoft,Windows,Microsoft Windows Link Following Vulnerability,2026-04-13,2026-04-27,Unknown,MSFT,Microsoft Windows contains a link following vulnerability that allows for privilege escalation,2026-04-27T23:12:22Z
CVE-2023-21529,Microsoft,Exchange Server,Microsoft Exchange Server Deserialization of Untrusted Data Vulnerability,2026-04-13,2026-04-27,Known,MSFT,Microsoft Exchange Server contains a deserialization of untrusted data that allows an authenticated attacker to achieve remote code execution.,2026-04-27T23:12:22Z
CVE-2023-36424,Microsoft,Windows,Microsoft Windows Out-of-Bounds Read Vulnerability,2026-04-13,2026-04-27,Unknown,MSFT,Microsoft Windows Common Log File System Driver contains an out-of-bounds read vulnerability that could allow a threat actor for privileges escalation,2026-04-27T23:12:22Z
CVE-2020-9715,Adobe,Acrobat,Adobe Acrobat Use-After-Free Vulnerability,2026-04-13,2026-04-27,Unknown,ADBE,Adobe Acrobat contains a use-after-free vulnerability that allows for code execution,2026-04-27T23:12:22Z
CVE-2026-21643,Fortinet,FortiClient EMS,Fortinet FortiClient EMS SQL Injection Vulnerability,2026-04-13,2026-04-16,Unknown,FTNT,Fortinet FortiClient EMS contains a SQL injection vulnerability that may allow an unauthenticated attacker to execute unauthorized code or commands via specifically crafted HTTP requests.,2026-04-27T23:12:22Z
CVE-2026-34621,Adobe,Acrobat and Reader,Adobe Acrobat and Reader Prototype Pollution Vulnerability,2026-04-13,2026-04-27,Unknown,ADBE,Adobe Acrobat and Reader contain a prototype pollution vulnerability that allows for arbitrary code execution.,2026-04-27T23:12:22Z
CVE-2026-1340,Ivanti,Endpoint Manager Mobile (EPMM),Ivanti Endpoint Manager Mobile (EPMM) Code Injection Vulnerability,2026-04-08,2026-04-11,Unknown,,Ivanti Endpoint Manager Mobile (EPMM) contains a code injection vulnerability that could allow attackers to achieve unauthenticated remote code execution.,2026-04-27T23:12:22Z
CVE-2026-35616,Fortinet,FortiClient EMS,Fortinet FortiClient EMS Improper Access Control Vulnerability,2026-04-06,2026-04-09,Unknown,FTNT,Fortinet FortiClient EMS contains an improper access control vulnerability that may allow an unauthenticated attacker to execute unauthorized code or commands via crafted requests.,2026-04-27T23:12:22Z
CVE-2026-3502,TrueConf,Client,TrueConf Client Download of Code Without Integrity Check Vulnerability,2026-04-02,2026-04-16,Unknown,,TrueConf Client contains a download of code without integrity check vulnerability. An attacker who is able to influence the update delivery path can substitute a tampered update payload. If the payloa,2026-04-27T23:12:22Z
CVE-2026-5281,Google,Dawn,Google Dawn Use-After-Free Vulnerability,2026-04-01,2026-04-15,Unknown,GOOGL,Google Dawn contains an use-after-free vulnerability that could allow a remote attacker who had compromised the renderer process to execute arbitrary code via a crafted HTML page. This vulnerability c,2026-04-27T23:12:22Z
CVE-2026-3055,Citrix,NetScaler,Citrix NetScaler Out-of-Bounds Read Vulnerability,2026-03-30,2026-04-02,Unknown,CTXS,"Citrix NetScaler ADC (formerly Citrix ADC), NetScaler Gateway (formerly Citrix Gateway) and NetScaler ADC FIPS and NDcPP contain an out-of-bounds reads vulnerability when configured as a SAML IDP lead",2026-04-27T23:12:22Z
CVE-2025-53521,F5,BIG-IP,F5 BIG-IP Stack-Based Buffer Overflow Vulnerability,2026-03-27,2026-03-30,Unknown,,F5 BIG-IP APM contains a stack-based buffer overflow vulnerability that could allow a threat actor to achieve remote code execution.,2026-04-27T23:12:22Z
CVE-2026-33634,Aquasecurity,Trivy,Aquasecurity Trivy Embedded Malicious Code Vulnerability,2026-03-26,2026-04-09,Unknown,,"Aquasecurity Trivy contains an embedded malicious code vulnerability that could allow an attacker to gain access to everything in the CI/CD environment, including all tokens, SSH keys, cloud credentia",2026-04-27T23:12:22Z
CVE-2026-33017,Langflow,Langflow,Langflow Code Injection Vulnerability,2026-03-25,2026-04-08,Unknown,,Langflow contains a code injection vulnerability that could allow building public flows without requiring authentication.,2026-04-27T23:12:22Z
CVE-2025-32432,Craft CMS,Craft CMS,Craft CMS Code Injection Vulnerability,2026-03-20,2026-04-03,Unknown,,Craft CMS contains a code injection vulnerability that allows a remote attacker to execute arbitrary code.,2026-04-27T23:12:22Z
CVE-2025-54068,Laravel,Livewire,Laravel Livewire Code Injection Vulnerability,2026-03-20,2026-04-03,Unknown,,Laravel Livewire contain a code injection vulnerability that could allow unauthenticated attackers to achieve remote command execution in specific scenarios.,2026-04-27T23:12:22Z
CVE-2025-43510,Apple,Multiple Products,Apple Multiple Products Improper Locking Vulnerability,2026-03-20,2026-04-03,Unknown,AAPL,"Apple watchOS, iOS, iPadOS, macOS, visionOS, and tvOS contain an improper locking vulnerability that could allow a malicious application to cause unexpected changes in memory shared between processes.",2026-04-27T23:12:22Z
CVE-2025-43520,Apple,Multiple Products,Apple Multiple Products Classic Buffer Overflow Vulnerability,2026-03-20,2026-04-03,Unknown,AAPL,"Apple watchOS, iOS, iPadOS, macOS, visionOS, and tvOS contain a classic buffer overflow vulnerability which could allow a malicious application to cause unexpected system termination or write kernel m",2026-04-27T23:12:22Z
CVE-2025-31277,Apple,Multiple Products,Apple Multiple Products Buffer Overflow Vulnerability,2026-03-20,2026-04-03,Unknown,AAPL,"Apple Safari, iOS, watchOS, visionOS, iPadOS, macOS, and tvOS contain a buffer overflow vulnerability that could allow the processing of maliciously crafted web content which may lead to memory corrup",2026-04-27T23:12:22Z
CVE-2026-20131,Cisco,Secure Firewall Management Center (FMC),Cisco Secure Firewall Management Center (FMC) Software and Cisco Security Cloud Control (SCC) Firewall Management Deseri,2026-03-19,2026-03-22,Known,CSCO,Cisco Secure Firewall Management Center (FMC) Software and Cisco Security Cloud Control (SCC) Firewall Management contain a deserialization of untrusted data vulnerability in the web-based management ,2026-04-27T23:12:22Z
CVE-2025-66376,Synacor,Zimbra Collaboration Suite (ZCS),Synacor Zimbra Collaboration Suite (ZCS) Cross-Site Scripting Vulnerability,2026-03-18,2026-04-01,Unknown,,Synacor Zimbra Collaboration Suite (ZCS) contains a cross-site scripting vulnerability in the Classic UI where attackers could abuse Cascading Style Sheets (CSS) @import directives in email HTML.,2026-04-27T23:12:22Z
CVE-2026-20963,Microsoft,SharePoint,Microsoft SharePoint Deserialization of Untrusted Data Vulnerability,2026-03-18,2026-03-21,Unknown,MSFT,Microsoft SharePoint contains a deserialization of untrusted data vulnerability that allows an unauthorized attacker to execute code over a network.,2026-04-27T23:12:22Z
CVE-2025-47813,Wing FTP Server,Wing FTP Server,Wing FTP Server Information Disclosure Vulnerability,2026-03-16,2026-03-30,Unknown,,Wing FTP Server contains a generation of error message containing sensitive information vulnerability when using a long value in the UID cookie.,2026-04-27T23:12:22Z
CVE-2026-3910,Google,Chromium V8,Google Chromium V8 Improper Restriction of Operations Within the Bounds of a Memory Buffer Vulnerability,2026-03-13,2026-03-27,Unknown,GOOGL,Google Chromium V8 contains an improper restriction of operations within the bounds of a memory buffer vulnerability that could allow a remote attacker to execute arbitrary code inside a sandbox via a,2026-04-27T23:12:22Z
CVE-2026-3909,Google,Skia,Google Skia Out-of-Bounds Write Vulnerability,2026-03-13,2026-03-27,Unknown,GOOGL,Google Skia contains an out-of-bounds write vulnerability that could allow a remote attacker to perform out of bounds memory access via a crafted HTML page. This vulnerability affects Google Chrome an,2026-04-27T23:12:22Z
CVE-2025-68613,n8n,n8n,n8n Improper Control of Dynamically-Managed Code Resources Vulnerability,2026-03-11,2026-03-25,Unknown,,n8n contains an improper control of dynamically managed code resources vulnerability in its workflow expression evaluation system that allows for remote code execution.,2026-04-27T23:12:22Z
CVE-2021-22054,Omnissa,Workspace One UEM,Omnissa Workspace ONE Server-Side Request Forgery,2026-03-09,2026-03-23,Unknown,,Omnissa Workspace One UEM formerly known as VMware Workspace One UEM contains a server-side request forgery (SSRF) vulnerability that could allow a malicious actor with network access to UEM to send t,2026-04-27T23:12:22Z
CVE-2025-26399,SolarWinds,Web Help Desk,SolarWinds Web Help Desk Deserialization of Untrusted Data Vulnerability,2026-03-09,2026-03-12,Unknown,,SolarWinds Web Help Desk contain a deserialization of untrusted data vulnerability in AjaxProxy that could allow an attacker to run commands on the host machine.,2026-04-27T23:12:22Z
CVE-2026-1603,Ivanti, Endpoint Manager (EPM),Ivanti Endpoint Manager (EPM) Authentication Bypass Vulnerability,2026-03-09,2026-03-23,Unknown,,Ivanti Endpoint Manager (EPM) contains an authentication bypass using an alternate path or channel vulnerability that could allow a remote unauthenticated attacker to leak specific stored credential d,2026-04-27T23:12:22Z
CVE-2017-7921,Hikvision,Multiple Products,Hikvision Multiple Products Improper Authentication Vulnerability,2026-03-05,2026-03-26,Unknown,,Multiple Hikvision products contain an improper authentication vulnerability that could allow a malicious user to escalate privileges on the system and gain access to sensitive information.,2026-04-27T23:12:22Z
CVE-2021-22681,Rockwell,Multiple Products,Rockwell Multiple Products Insufficient Protected Credentials Vulnerability,2026-03-05,2026-03-26,Unknown,,Multiple Rockwell products contain an insufficient protected credentials vulnerability. Studio 5000 Logix Designer software may allow a key to be discovered. This key is used to verify Logix controlle,2026-04-27T23:12:22Z
CVE-2023-43000,Apple,Multiple Products,Apple Multiple products Use-After-Free Vulnerability,2026-03-05,2026-03-26,Unknown,AAPL,"Apple macOS, iOS, iPadOS, and Safari 16.6 contain a use-after-free vulnerability due to the processing of maliciously crafted web content that may lead to memory corruption.",2026-04-27T23:12:22Z
CVE-2021-30952,Apple,Multiple Products,Apple Multiple Products Integer Overflow or Wraparound Vulnerability,2026-03-05,2026-03-26,Unknown,AAPL,"Apple tvOS, macOS, Safari, iPadOS and watchOS contain an integer overflow or wraparound vulnerability due to the processing of maliciously crafted web content that may lead to arbitrary code execution",2026-04-27T23:12:22Z
CVE-2023-41974,Apple,iOS and iPadOS,Apple iOS and iPadOS Use-After-Free Vulnerability,2026-03-05,2026-03-26,Unknown,AAPL,Apple iOS and iPadOS contain a use-after-free vulnerability. An app may be able to execute arbitrary code with kernel privileges.,2026-04-27T23:12:22Z
CVE-2026-22719,Broadcom,VMware Aria Operations,Broadcom VMware Aria Operations Command Injection Vulnerability,2026-03-03,2026-03-24,Unknown,,"Broadcom VMware Aria Operations formerly known as vRealize Operations (vROps) contains a command injection vulnerability that allows an unauthenticated attacker to execute arbitrary commands, potentia",2026-04-27T23:12:22Z
CVE-2026-21385,Qualcomm,Multiple Chipsets,Qualcomm Multiple Chipsets Memory Corruption Vulnerability,2026-03-03,2026-03-24,Unknown,,Multiple Qualcomm chipsets contain a memory corruption vulnerability while using alignments for memory allocation. ,2026-04-27T23:12:22Z
CVE-2022-20775,Cisco,SD-WAN,Cisco SD-WAN Path Traversal Vulnerability,2026-02-25,2026-02-27,Unknown,CSCO,Cisco SD-WAN CLI contains a path traversal vulnerability that could allow an authenticated local attacker to gain elevated privileges via improper access controls on commands within the application CL,2026-04-27T23:12:22Z
CVE-2026-20127,Cisco,Catalyst SD-WAN Controller and Manager,Cisco Catalyst SD-WAN Controller and Manager Authentication Bypass Vulnerability,2026-02-25,2026-02-27,Unknown,CSCO,"Cisco Catalyst SD-WAN Controller, formerly SD-WAN vSmart, and Cisco Catalyst SD-WAN Manager, formerly SD-WAN vManage, contain an authentication bypass vulnerability could allow an unauthenticated, rem",2026-04-27T23:12:22Z
CVE-2026-25108,Soliton Systems K.K,FileZen,Soliton Systems K.K FileZen OS Command Injection Vulnerability,2026-02-24,2026-03-17,Unknown,,Soliton Systems K.K FileZen contains an OS command injection vulnerability when an user logs-in to the affected product and sends a specially crafted HTTP request.,2026-04-27T23:12:22Z
CVE-2025-49113,Roundcube,Webmail,RoundCube Webmail Deserialization of Untrusted Data Vulnerability,2026-02-20,2026-03-13,Unknown,,RoundCube Webmail contains a deserialization of untrusted data vulnerability that allows remote code execution by authenticated users because the _from parameter in a URL is not validated in program/a,2026-04-27T23:12:22Z
CVE-2025-68461,Roundcube,Webmail,RoundCube Webmail Cross-site Scripting Vulnerability,2026-02-20,2026-03-13,Unknown,,RoundCube Webmail contains a cross-site scripting vulnerability via the animate tag in an SVG document.,2026-04-27T23:12:22Z
CVE-2021-22175,GitLab,GitLab,GitLab Server-Side Request Forgery (SSRF) Vulnerability,2026-02-18,2026-03-11,Unknown,,GitLab contains a server-side request forgery (SSRF) vulnerability when requests to the internal network for webhooks are enabled.,2026-04-27T23:12:22Z
CVE-2026-22769,Dell,RecoverPoint for Virtual Machines (RP4VMs),Dell RecoverPoint for Virtual Machines (RP4VMs) Use of Hard-coded Credentials Vulnerability,2026-02-18,2026-02-21,Unknown,,Dell RecoverPoint for Virtual Machines (RP4VMs) contains an use of hard-coded credentials vulnerability that could allow an unauthenticated remote attacker to gain unauthorized access to the underlyin,2026-04-27T23:12:22Z
CVE-2020-7796,Synacor,Zimbra Collaboration Suite,Synacor Zimbra Collaboration Suite (ZCS) Server-Side Request Forgery Vulnerability,2026-02-17,2026-03-10,Unknown,,Synacor Zimbra Collaboration Suite (ZCS) contains a server-side request forgery vulnerability if WebEx zimlet installed and zimlet JSP is enabled.,2026-04-27T23:12:22Z
CVE-2024-7694,TeamT5,ThreatSonar Anti-Ransomware,TeamT5 ThreatSonar Anti-Ransomware Unrestricted Upload of File with Dangerous Type Vulnerability,2026-02-17,2026-03-10,Unknown,,TeamT5 ThreatSonar Anti-Ransomware contains an unrestricted upload of file with dangerous type vulnerability. ThreatSonar Anti-Ransomware does not properly validate the content of uploaded files. Remo,2026-04-27T23:12:22Z
CVE-2008-0015,Microsoft,Windows, Microsoft Windows Video ActiveX Control Remote Code Execution Vulnerability,2026-02-17,2026-03-10,Unknown,MSFT,Microsoft Windows Video ActiveX Control contains a remote code execution vulnerability. An attacker could exploit the vulnerability by constructing a specially crafted Web page. When a user views the ,2026-04-27T23:12:22Z
CVE-2026-2441,Google,Chromium,Google Chromium CSS Use-After-Free Vulnerability,2026-02-17,2026-03-10,Unknown,GOOGL,Google Chromium CSS contains a use-after-free vulnerability that could allow a remote attacker to potentially exploit heap corruption via a crafted HTML page. This vulnerability could affect multiple ,2026-04-27T23:12:22Z
CVE-2026-1731,BeyondTrust,Remote Support (RS) and Privileged Remote Access (PRA),BeyondTrust Remote Support (RS) and Privileged Remote Access (PRA) OS Command Injection Vulnerability,2026-02-13,2026-02-16,Known,,BeyondTrust Remote Support (RS) and Privileged Remote Access (PRA)contain an OS command injection vulnerability. Successful exploitation could allow an unauthenticated remote attacker to execute opera,2026-04-27T23:12:22Z
CVE-2026-20700,Apple,Multiple Products,Apple Multiple Buffer Overflow Vulnerability,2026-02-12,2026-03-05,Unknown,AAPL,"Apple iOS, macOS, tvOS, watchOS, and visionOS contain an improper restriction of operations within the bounds of a memory buffer vulnerability that could allow an attacker with memory write the capabi",2026-04-27T23:12:22Z
CVE-2024-43468,Microsoft,Configuration Manager,Microsoft Configuration Manager SQL Injection Vulnerability,2026-02-12,2026-03-05,Unknown,MSFT,Microsoft Configuration Manager contains an SQL injection vulnerability. An unauthenticated attacker could exploit this vulnerability by sending specially crafted requests to the target environment wh,2026-04-27T23:12:22Z
CVE-2025-15556,Notepad++,Notepad++,Notepad++ Download of Code Without Integrity Check Vulnerability,2026-02-12,2026-03-05,Unknown,,"Notepad++ when using the WinGUp updater, contains a download of code without integrity check vulnerability that could allow an attacker to intercept or redirect update traffic to download and execute ",2026-04-27T23:12:22Z
CVE-2025-40536,SolarWinds,Web Help Desk,SolarWinds Web Help Desk Security Control Bypass Vulnerability,2026-02-12,2026-02-15,Unknown,,SolarWinds Web Help Desk contains a security control bypass vulnerability that could allow an unauthenticated attacker to gain access to certain restricted functionality.,2026-04-27T23:12:22Z
CVE-2026-21513,Microsoft,Windows,Microsoft MSHTML Framework Protection Mechanism Failure Vulnerability,2026-02-10,2026-03-03,Unknown,MSFT,Microsoft MSHTML Framework contains a protection mechanism failure vulnerability that could allow an unauthorized attacker to bypass a security feature over a network.,2026-04-27T23:12:22Z
CVE-2026-21525,Microsoft,Windows,Microsoft Windows NULL Pointer Dereference Vulnerability,2026-02-10,2026-03-03,Unknown,MSFT,Microsoft Windows Remote Access Connection Manager contains a NULL pointer dereference that could allow an unauthorized attacker to deny service locally.,2026-04-27T23:12:22Z
CVE-2026-21510,Microsoft,Windows,Microsoft Windows Shell Protection Mechanism Failure Vulnerability,2026-02-10,2026-03-03,Unknown,MSFT,Microsoft Windows Shell contains a protection mechanism failure vulnerability that could allow an unauthorized attacker to bypass a security feature over a network. ,2026-04-27T23:12:22Z
CVE-2026-21533,Microsoft,Windows,Microsoft Windows Improper Privilege Management Vulnerability,2026-02-10,2026-03-03,Unknown,MSFT,Microsoft Windows Remote Desktop Services contains an improper privilege management vulnerability that could allow an authorized attacker to elevate privileges locally.,2026-04-27T23:12:22Z
CVE-2026-21519,Microsoft,Windows,Microsoft Windows Type Confusion Vulnerability,2026-02-10,2026-03-03,Unknown,MSFT,Microsoft Desktop Windows Manager contains a type confusion vulnerability that could allow an authorized attacker to elevate privileges locally.,2026-04-27T23:12:22Z
CVE-2026-21514,Microsoft,Office,Microsoft Office Word Reliance on Untrusted Inputs in a Security Decision Vulnerability,2026-02-10,2026-03-03,Unknown,MSFT,Microsoft Office Word contains a reliance on untrusted inputs in a security decision vulnerability that could allow an authorized attacker to elevate privileges locally.,2026-04-27T23:12:22Z
CVE-2025-11953,React Native Community,CLI,React Native Community CLI OS Command Injection Vulnerability,2026-02-05,2026-02-26,Unknown,,React Native Community CLI contains an OS command injection vulnerability which could allow unauthenticated network attackers to send POST requests to the Metro Development Server and run arbitrary ex,2026-04-27T23:12:22Z
CVE-2026-24423,SmarterTools,SmarterMail,SmarterTools SmarterMail Missing Authentication for Critical Function Vulnerability,2026-02-05,2026-02-26,Known,,SmarterTools SmarterMail contains a missing authentication for critical function vulnerability in the ConnectToHub API method. This could allow the attacker to point the SmarterMail instance to a mali,2026-04-27T23:12:22Z
