cve_id,vendor,product,vulnerability,date_added,due_date,known_ransomware,tickers_affected,short_desc,captured_at
CVE-2021-39935,GitLab,Community and Enterprise Editions,GitLab Community and Enterprise Editions Server-Side Request Forgery (SSRF) Vulnerability,2026-02-03,2026-02-24,Unknown,,GitLab Community and Enterprise Editions contain a server-side request forgery vulnerability which could allow unauthorized external users to perform Server Side Requests via the CI Lint API. ,2026-04-27T23:12:22Z
CVE-2025-64328,Sangoma,FreePBX ,Sangoma FreePBX OS Command Injection Vulnerability,2026-02-03,2026-02-24,Unknown,,Sangoma FreePBX Endpoint Manager contains an OS command injection vulnerability that could allow for a post-authentication command injection by an authenticated known user via the testconnection -> ch,2026-04-27T23:12:22Z
CVE-2019-19006,Sangoma,FreePBX, Sangoma FreePBX Improper Authentication Vulnerability,2026-02-03,2026-02-24,Unknown,,Sangoma FreePBX contains an improper authentication vulnerability that potentially allows unauthorized users to bypass password authentication and access services provided by the FreePBX admin.,2026-04-27T23:12:22Z
CVE-2025-40551,SolarWinds,Web Help Desk,SolarWinds Web Help Desk Deserialization of Untrusted Data Vulnerability,2026-02-03,2026-02-06,Unknown,,"SolarWinds Web Help Desk contains a deserialization of untrusted data vulnerability that could lead to remote code execution, which would allow an attacker to run commands on the host machine. This co",2026-04-27T23:12:22Z
CVE-2026-1281,Ivanti,Endpoint Manager Mobile (EPMM),Ivanti Endpoint Manager Mobile (EPMM) Code Injection Vulnerability,2026-01-29,2026-02-01,Unknown,,Ivanti Endpoint Manager Mobile (EPMM) contains a code injection vulnerability that could allow attackers to achieve unauthenticated remote code execution.,2026-04-27T23:12:22Z
CVE-2026-24858,Fortinet,Multiple Products,Fortinet Multiple Products Authentication Bypass Using an Alternate Path or Channel Vulnerability,2026-01-27,2026-01-30,Unknown,FTNT,"Fortinet FortiAnalyzer, FortiManager, FortiOS, and FortiProxy contain an authentication bypass using an alternate path or channel that could allow an attacker with a FortiCloud account and a registere",2026-04-27T23:12:22Z
CVE-2018-14634,Linux,Kernel,Linux Kernel Integer Overflow Vulnerability,2026-01-26,2026-02-16,Unknown,,Linux Kernel contains an integer overflow vulnerability in the create_elf_tables() function which could allow an unprivileged local user with access to SUID (or otherwise privileged) binary to escalat,2026-04-27T23:12:22Z
CVE-2025-52691,SmarterTools,SmarterMail,SmarterTools SmarterMail Unrestricted Upload of File with Dangerous Type Vulnerability,2026-01-26,2026-02-16,Known,,SmarterTools SmarterMail contains an unrestricted upload of file with dangerous type vulnerability that could allow an unauthenticated attacker to upload arbitrary files to any location on the mail se,2026-04-27T23:12:22Z
CVE-2026-23760,SmarterTools,SmarterMail,SmarterTools SmarterMail Authentication Bypass Using an Alternate Path or Channel Vulnerability,2026-01-26,2026-02-16,Known,,SmarterTools SmarterMail contains an authentication bypass using an alternate path or channel vulnerability in the password reset API. The force-reset-password endpoint permits anonymous requests and ,2026-04-27T23:12:22Z
CVE-2026-24061,GNU,InetUtils,GNU InetUtils Argument Injection Vulnerability,2026-01-26,2026-02-16,Unknown,,"GNU InetUtils contains an argument injection vulnerability in telnetd that could allow for remote authentication bypass via a ""-f root"" value for the USER environment variable.",2026-04-27T23:12:22Z
CVE-2026-21509,Microsoft,Office,Microsoft Office Security Feature Bypass Vulnerability,2026-01-26,2026-02-16,Unknown,MSFT,Microsoft Office contains a security feature bypass vulnerability in which reliance on untrusted inputs in a security decision in Microsoft Office could allow an unauthorized attacker to bypass a secu,2026-04-27T23:12:22Z
CVE-2024-37079,Broadcom,VMware vCenter Server,Broadcom VMware vCenter Server Out-of-bounds Write Vulnerability,2026-01-23,2026-02-13,Unknown,,Broadcom VMware vCenter Server contains an out-of-bounds write vulnerability in the implementation of the DCERPC protocol. This could allow a malicious actor with network access to vCenter Server to s,2026-04-27T23:12:22Z
CVE-2025-68645,Synacor, Zimbra Collaboration Suite (ZCS),Synacor Zimbra Collaboration Suite (ZCS) PHP Remote File Inclusion Vulnerability,2026-01-22,2026-02-12,Unknown,,Synacor Zimbra Collaboration Suite (ZCS) contains a PHP remote file inclusion vulnerability that could allow for remote attackers to craft requests to the /h/rest endpoint to influence internal reques,2026-04-27T23:12:22Z
CVE-2025-34026,Versa,Concerto,Versa Concerto Improper Authentication Vulnerability,2026-01-22,2026-02-12,Unknown,,"Versa Concerto SD-WAN orchestration platform contains an improper authentication vulnerability in the Traefik reverse proxy configuration, allowing at attacker to access administrative endpoints. The ",2026-04-27T23:12:22Z
CVE-2025-31125,Vite,Vitejs,Vite Vitejs Improper Access Control Vulnerability,2026-01-22,2026-02-12,Unknown,,Vite Vitejs contains an improper access control vulnerability that exposes content of non-allowed files using ?inline&import or ?raw?import. Only apps explicitly exposing the Vite dev server to the ne,2026-04-27T23:12:22Z
CVE-2025-54313,Prettier,eslint-config-prettier,Prettier eslint-config-prettier Embedded Malicious Code Vulnerability,2026-01-22,2026-02-12,Unknown,,Prettier eslint-config-prettier contains an embedded malicious code vulnerability. Installing an affected package executes an install.js file that launches the node-gyp.dll malware on Windows.,2026-04-27T23:12:22Z
CVE-2026-20045,Cisco,Unified Communications Manager,Cisco Unified Communications Products Code Injection Vulnerability,2026-01-21,2026-02-11,Unknown,CSCO,"Cisco Unified Communications Manager (Unified CM), Cisco Unified Communications Manager Session Management Edition (Unified CM SME), Cisco Unified Communications Manager IM & Presence Service (Unified",2026-04-27T23:12:22Z
CVE-2026-20805,Microsoft,Windows,Microsoft Windows Information Disclosure Vulnerability,2026-01-13,2026-02-03,Unknown,MSFT,Microsoft Windows Desktop Windows Manager contains an information disclosure vulnerability that allows an authorized attacker to disclose information locally.,2026-04-27T23:12:22Z
CVE-2025-8110,Gogs,Gogs,Gogs Path Traversal Vulnerability,2026-01-12,2026-02-02,Unknown,,Gogs contains a path traversal vulnerability affecting improper Symbolic link handling in the PutContents API that could allow for code execution.,2026-04-27T23:12:22Z
CVE-2009-0556,Microsoft,Office,Microsoft Office PowerPoint Code Injection Vulnerability,2026-01-07,2026-01-28,Unknown,MSFT,Microsoft Office PowerPoint contains a code injection vulnerability that allows remote attackers to execute arbitrary code via a PowerPoint file with an OutlineTextRefAtom containing an invalid index ,2026-04-27T23:12:22Z
CVE-2025-37164,Hewlett Packard Enterprise (HPE),OneView,Hewlett Packard Enterprise (HPE) OneView Code Injection Vulnerability,2026-01-07,2026-01-28,Unknown,,Hewlett Packard Enterprise (HPE) OneView contains a code injection vulnerability that allows a remote unauthenticated user to perform remote code execution.,2026-04-27T23:12:22Z
CVE-2025-14847,MongoDB,MongoDB and MongoDB Server,MongoDB and MongoDB Server Improper Handling of Length Parameter Inconsistency Vulnerability,2025-12-29,2026-01-19,Unknown,MDB,MongoDB Server contains an improper handling of length parameter inconsistency vulnerability in Zlib compressed protocol headers. This vulnerability may allow a read of uninitialized heap memory by an,2026-04-27T23:12:22Z
CVE-2023-52163,Digiever,DS-2105 Pro,Digiever DS-2105 Pro Missing Authorization Vulnerability,2025-12-22,2026-01-12,Unknown,,Digiever DS-2105 Pro contains a missing authorization vulnerability which could allow for command injection via time_tzsetup.cgi.,2026-04-27T23:12:22Z
CVE-2025-14733,WatchGuard,Firebox,WatchGuard Firebox Out of Bounds Write Vulnerability,2025-12-19,2025-12-26,Unknown,,WatchGuard Fireware OS iked process contains an out of bounds write vulnerability in the OS iked process. This vulnerability may allow a remote unauthenticated attacker to execute arbitrary code and a,2026-04-27T23:12:22Z
CVE-2025-59374,ASUS,Live Update,ASUS Live Update Embedded Malicious Code Vulnerability,2025-12-17,2026-01-07,Unknown,,ASUS Live Update contains an embedded malicious code vulnerability client were distributed with unauthorized modifications introduced through a supply chain compromise. The modified builds could cause,2026-04-27T23:12:22Z
CVE-2025-40602,SonicWall,SMA1000 appliance,SonicWall SMA1000 Missing Authorization Vulnerability,2025-12-17,2025-12-24,Unknown,,SonicWall SMA1000 contains a missing authorization vulnerability that could allow for privilege escalation appliance management console (AMC) of affected devices.,2026-04-27T23:12:22Z
CVE-2025-20393,Cisco,Multiple Products,Cisco Multiple Products Improper Input Validation Vulnerability,2025-12-17,2025-12-24,Unknown,CSCO,"Cisco Secure Email Gateway, Secure Email, AsyncOS Software, and Web Manager appliances contains an improper input validation vulnerability that allows threat actors to execute arbitrary commands with ",2026-04-27T23:12:22Z
CVE-2025-59718,Fortinet,Multiple Products,Fortinet Multiple Products Improper Verification of Cryptographic Signature Vulnerability,2025-12-16,2025-12-23,Unknown,FTNT,"Fortinet FortiOS, FortiSwitchMaster, FortiProxy, and FortiWeb contain an improper verification of cryptographic signature vulnerability that may allow an unauthenticated attacker to bypass the FortiCl",2026-04-27T23:12:22Z
CVE-2025-14611,Gladinet,CentreStack and Triofox,Gladinet CentreStack and Triofox Hard Coded Cryptographic Vulnerability,2025-12-15,2026-01-05,Unknown,,Gladinet CentreStack and TrioFox contain a hardcoded cryptographic keys vulnerability for their implementation of the AES cryptoscheme. This vulnerability degrades security for public exposed endpoint,2026-04-27T23:12:22Z
CVE-2025-43529,Apple,Multiple Products,Apple Multiple Products Use-After-Free WebKit Vulnerability,2025-12-15,2026-01-05,Unknown,AAPL,"Apple iOS, iPadOS, macOS, and other Apple products contain a use-after-free vulnerability in WebKit. Processing maliciously crafted web content may lead to memory corruption. This vulnerability could ",2026-04-27T23:12:22Z
CVE-2018-4063,Sierra Wireless,AirLink ALEOS,Sierra Wireless AirLink ALEOS Unrestricted Upload of File with Dangerous Type Vulnerability,2025-12-12,2026-01-02,Unknown,,"Sierra Wireless AirLink ALEOS contains an unrestricted upload of file with dangerous type vulnerability. A specially crafted HTTP request can upload a file, resulting in executable code being uploaded",2026-04-27T23:12:22Z
CVE-2025-14174,Google,Chromium,Google Chromium Out of Bounds Memory Access Vulnerability,2025-12-12,2026-01-02,Unknown,GOOGL,Google Chromium contains an out of bounds memory access vulnerability in ANGLE that could allow a remote attacker to perform out of bounds memory access via a crafted HTML page. This vulnerability cou,2026-04-27T23:12:22Z
CVE-2025-58360,OSGeo,GeoServer,OSGeo GeoServer Improper Restriction of XML External Entity Reference Vulnerability,2025-12-11,2026-01-01,Unknown,,OSGeo GeoServer contains an improper restriction of XML external entity reference vulnerability that occurs when the application accepts XML input through a specific endpoint /geoserver/wms operation ,2026-04-27T23:12:22Z
CVE-2025-6218,RARLAB,WinRAR,RARLAB WinRAR Path Traversal Vulnerability,2025-12-09,2025-12-30,Unknown,,RARLAB WinRAR contains a path traversal vulnerability allowing an attacker to execute code in the context of the current user.,2026-04-27T23:12:22Z
CVE-2025-62221,Microsoft,Windows,Microsoft Windows Use After Free Vulnerability,2025-12-09,2025-12-30,Unknown,MSFT,Microsoft Windows Cloud Files Mini Filter Driver contains a use after free vulnerability that can allow an authorized attacker to elevate privileges locally.,2026-04-27T23:12:22Z
CVE-2022-37055,D-Link,Routers,D-Link Routers Buffer Overflow Vulnerability,2025-12-08,2025-12-29,Unknown,,"D-Link Routers contains a buffer overflow vulnerability that has a high impact on confidentiality, integrity, and availability. The impacted products could be end-of-life (EoL) and/or end-of-service (",2026-04-27T23:12:22Z
CVE-2025-66644,Array Networks ,ArrayOS AG,Array Networks ArrayOS AG OS Command Injection Vulnerability,2025-12-08,2025-12-29,Unknown,,Array Networks ArrayOS AG contains an OS command injection vulnerability that could allow an attacker to execute arbitrary commands.,2026-04-27T23:12:22Z
CVE-2025-55182,Meta,React Server Components,Meta React Server Components Remote Code Execution Vulnerability,2025-12-05,2025-12-12,Known,,Meta React Server Components contains a remote code execution vulnerability that could allow unauthenticated remote code execution by exploiting a flaw in how React decodes payloads sent to React Serv,2026-04-27T23:12:22Z
CVE-2021-26828,OpenPLC,ScadaBR,OpenPLC ScadaBR Unrestricted Upload of File with Dangerous Type Vulnerability,2025-12-03,2025-12-24,Unknown,,OpenPLC ScadaBR contains an unrestricted upload of file with dangerous type vulnerability that allows remote authenticated users to upload and execute arbitrary JSP files via view_edit.shtm.,2026-04-27T23:12:22Z
CVE-2025-48633,Android,Framework,Android Framework Information Disclosure Vulnerability,2025-12-02,2025-12-23,Unknown,,Android Framework contains an unspecified vulnerability that allows for information disclosure.,2026-04-27T23:12:22Z
CVE-2025-48572,Android,Framework,Android Framework Privilege Escalation Vulnerability,2025-12-02,2025-12-23,Unknown,,Android Framework contains an unspecified vulnerability that allows for privilege escalation.,2026-04-27T23:12:22Z
CVE-2021-26829,OpenPLC,ScadaBR,OpenPLC ScadaBR Cross-site Scripting Vulnerability,2025-11-28,2025-12-19,Unknown,,OpenPLC ScadaBR contains a cross-site scripting vulnerability via system_settings.shtm.,2026-04-27T23:12:22Z
CVE-2025-61757,Oracle,Fusion Middleware,Oracle Fusion Middleware Missing Authentication for Critical Function Vulnerability,2025-11-21,2025-12-12,Unknown,ORCL,"Oracle Fusion Middleware contains a missing authentication for critical function vulnerability, allowing unauthenticated remote attackers to take over Identity Manager.",2026-04-27T23:12:22Z
CVE-2025-13223,Google,Chromium V8,Google Chromium V8 Type Confusion Vulnerability,2025-11-19,2025-12-10,Unknown,GOOGL,Google Chromium V8 contains a type confusion vulnerability that allows for heap corruption.,2026-04-27T23:12:22Z
CVE-2025-58034,Fortinet,FortiWeb,Fortinet FortiWeb OS Command Injection Vulnerability,2025-11-18,2025-11-25,Unknown,FTNT,Fortinet FortiWeb contains an OS command Injection vulnerability that may allow an authenticated attacker to execute unauthorized code on the underlying system via crafted HTTP requests or CLI command,2026-04-27T23:12:22Z
CVE-2025-64446,Fortinet,FortiWeb,Fortinet FortiWeb Path Traversal Vulnerability,2025-11-14,2025-11-21,Unknown,FTNT,Fortinet FortiWeb contains a relative path traversal vulnerability that may allow an unauthenticated attacker to execute administrative commands on the system via crafted HTTP or HTTPS requests.,2026-04-27T23:12:22Z
CVE-2025-12480,Gladinet,Triofox,Gladinet Triofox Improper Access Control Vulnerability,2025-11-12,2025-12-03,Unknown,,Gladinet Triofox contains an improper access control vulnerability that allows access to initial setup pages even after setup is complete.,2026-04-27T23:12:22Z
CVE-2025-62215,Microsoft,Windows,Microsoft Windows Race Condition Vulnerability,2025-11-12,2025-12-03,Unknown,MSFT,Microsoft Windows Kernel contains a race condition vulnerability that allows a local attacker with low-level privileges to escalate privileges. Successful exploitation of this vulnerability could enab,2026-04-27T23:12:22Z
CVE-2025-9242,WatchGuard,Firebox,WatchGuard Firebox Out-of-Bounds Write Vulnerability,2025-11-12,2025-12-03,Unknown,,WatchGuard Firebox contains an out-of-bounds write vulnerability in the OS iked process that may allow a remote unauthenticated attacker to execute arbitrary code.,2026-04-27T23:12:22Z
CVE-2025-21042,Samsung,Mobile Devices,Samsung Mobile Devices Out-of-Bounds Write Vulnerability,2025-11-10,2025-12-01,Unknown,,Samsung mobile devices contain an out-of-bounds write vulnerability in libimagecodec.quram.so. This vulnerability could allow remote attackers to execute arbitrary code.,2026-04-27T23:12:22Z
CVE-2025-48703,CWP,Control Web Panel,CWP Control Web Panel OS Command Injection Vulnerability,2025-11-04,2025-11-25,Unknown,,CWP Control Web Panel (formerly CentOS Web Panel) contains an OS command Injection vulnerability that allows unauthenticated remote code execution via shell metacharacters in the t_total parameter in ,2026-04-27T23:12:22Z
CVE-2025-11371,Gladinet,CentreStack and Triofox,Gladinet CentreStack and Triofox Files or Directories Accessible to External Parties Vulnerability,2025-11-04,2025-11-25,Unknown,,Gladinet CentreStack and Triofox contains a files or directories accessible to external parties vulnerability that allows unintended disclosure of system files.,2026-04-27T23:12:22Z
CVE-2025-41244,Broadcom,VMware Aria Operations and VMware Tools,Broadcom VMware Aria Operations and VMware Tools Privilege Defined with Unsafe Actions Vulnerability,2025-10-30,2025-11-20,Unknown,,Broadcom VMware Aria Operations and VMware Tools contain a privilege defined with unsafe actions vulnerability. A malicious local actor with non-administrative privileges having access to a VM with VM,2026-04-27T23:12:22Z
CVE-2025-24893,XWiki,Platform,XWiki Platform Eval Injection Vulnerability,2025-10-30,2025-11-20,Unknown,,XWiki Platform contains an eval injection vulnerability that could allow any guest to perform arbitrary remote code execution through a request to SolrSearch.,2026-04-27T23:12:22Z
CVE-2025-6204,Dassault Systèmes,DELMIA Apriso,Dassault Systèmes DELMIA Apriso Code Injection Vulnerability,2025-10-28,2025-11-18,Unknown,,Dassault Systèmes DELMIA Apriso contains a code injection vulnerability that could allow an attacker to execute arbitrary code.,2026-04-27T23:12:22Z
CVE-2025-6205,Dassault Systèmes,DELMIA Apriso,Dassault Systèmes DELMIA Apriso Missing Authorization Vulnerability,2025-10-28,2025-11-18,Unknown,,Dassault Systèmes DELMIA Apriso contains a missing authorization vulnerability that could allow an attacker to gain privileged access to the application.,2026-04-27T23:12:22Z
CVE-2025-54236,Adobe,Commerce and Magento,Adobe Commerce and Magento Improper Input Validation Vulnerability,2025-10-24,2025-11-14,Unknown,ADBE,Adobe Commerce and Magento Open Source contain an improper input validation vulnerability that could allow an attacker to take over customer accounts through the Commerce REST API.,2026-04-27T23:12:22Z
CVE-2025-59287,Microsoft,Windows,Microsoft Windows Server Update Service (WSUS) Deserialization of Untrusted Data Vulnerability,2025-10-24,2025-11-14,Unknown,MSFT,Microsoft Windows Server Update Service (WSUS) contains a deserialization of untrusted data vulnerability that allows for remote code execution.,2026-04-27T23:12:22Z
CVE-2025-61932,Motex,LANSCOPE Endpoint Manager,Motex LANSCOPE Endpoint Manager Improper Verification of Source of a Communication Channel Vulnerability,2025-10-22,2025-11-12,Unknown,,Motex LANSCOPE Endpoint Manager contains an improper verification of source of a communication channel vulnerability allowing an attacker to execute arbitrary code by sending specially crafted packets,2026-04-27T23:12:22Z
CVE-2022-48503,Apple,Multiple Products,Apple Multiple Products Unspecified Vulnerability,2025-10-20,2025-11-10,Unknown,AAPL,"Apple macOS, iOS, tvOS, Safari, and watchOS contain an unspecified vulnerability in JavaScriptCore that when processing web content may lead to arbitrary code execution. The impacted product could be ",2026-04-27T23:12:22Z
CVE-2025-2746,Kentico,Xperience CMS,Kentico Xperience CMS Authentication Bypass Using an Alternate Path or Channel Vulnerability,2025-10-20,2025-11-10,Unknown,,Kentico Xperience CMS contains an authentication bypass using an alternate path or channel vulnerability that could allow an attacker to control administrative objects.,2026-04-27T23:12:22Z
CVE-2025-2747,Kentico,Xperience CMS,Kentico Xperience CMS Authentication Bypass Using an Alternate Path or Channel Vulnerability,2025-10-20,2025-11-10,Unknown,,Kentico Xperience CMS contains an authentication bypass using an alternate path or channel vulnerability that could allow an attacker to control administrative objects.,2026-04-27T23:12:22Z
CVE-2025-33073,Microsoft,Windows,Microsoft Windows SMB Client Improper Access Control Vulnerability,2025-10-20,2025-11-10,Unknown,MSFT,Microsoft Windows SMB Client contains an improper access control vulnerability that could allow for privilege escalation. An attacker could execute a specially crafted malicious script to coerce the v,2026-04-27T23:12:22Z
CVE-2025-61884,Oracle,E-Business Suite,Oracle E-Business Suite Server-Side Request Forgery (SSRF) Vulnerability,2025-10-20,2025-11-10,Known,ORCL,Oracle E-Business Suite contains a server-side request forgery (SSRF) vulnerability in the Runtime component of Oracle Configurator. This vulnerability is remotely exploitable without authentication.,2026-04-27T23:12:22Z
CVE-2025-54253,Adobe,Experience Manager (AEM) Forms,Adobe Experience Manager Forms Code Execution Vulnerability,2025-10-15,2025-11-05,Unknown,ADBE,Adobe Experience Manager Forms in JEE contains an unspecified vulnerability that allows for arbitrary code execution.,2026-04-27T23:12:22Z
CVE-2025-47827,IGEL,IGEL OS,IGEL OS Use of a Key Past its Expiration Date Vulnerability,2025-10-14,2025-11-04,Unknown,,"IGEL OS contains a use of a key past its expiration date vulnerability that allows for Secure Boot bypass. The igel-flash-driver module improperly verifies a cryptographic signature. Ultimately, a cra",2026-04-27T23:12:22Z
CVE-2025-24990,Microsoft,Windows,Microsoft Windows Untrusted Pointer Dereference Vulnerability,2025-10-14,2025-11-04,Unknown,MSFT,Microsoft Windows Agere Modem Driver contains an untrusted pointer dereference vulnerability that allows for privilege escalation. An attacker who successfully exploited this vulnerability could gain ,2026-04-27T23:12:22Z
CVE-2025-59230,Microsoft,Windows,Microsoft Windows Improper Access Control Vulnerability,2025-10-14,2025-11-04,Unknown,MSFT,Microsoft Windows contains an improper access control vulnerability in Windows Remote Access Connection Manager which could allow an authorized attacker to elevate privileges locally.,2026-04-27T23:12:22Z
CVE-2016-7836,SKYSEA,Client View,SKYSEA Client View Improper Authentication Vulnerability,2025-10-14,2025-11-04,Unknown,,SKYSEA Client View contains an improper authentication vulnerability that allows remote code execution via a flaw in processing authentication on the TCP connection with the management console program,2026-04-27T23:12:22Z
CVE-2021-43798,Grafana Labs,Grafana,Grafana Path Traversal Vulnerability,2025-10-09,2025-10-30,Unknown,,Grafana contains a path traversal vulnerability that could allow access to local files.,2026-04-27T23:12:22Z
CVE-2025-27915,Synacor,Zimbra Collaboration Suite (ZCS),Synacor Zimbra Collaboration Suite (ZCS) Cross-site Scripting Vulnerability,2025-10-07,2025-10-28,Unknown,,Synacor Zimbra Collaboration Suite (ZCS) contains a cross-site scripting vulnerability that exists in the Classic Web Client due to insufficient sanitization of HTML content in ICS files. When a user ,2026-04-27T23:12:22Z
CVE-2021-22555,Linux,Kernel,Linux Kernel Heap Out-of-Bounds Write Vulnerability,2025-10-06,2025-10-27,Unknown,,Linux Kernel contains a heap out-of-bounds write vulnerability that could allow an attacker to gain privileges or cause a DoS (via heap memory corruption) through user name space.,2026-04-27T23:12:22Z
CVE-2010-3962,Microsoft,Internet Explorer,Microsoft Internet Explorer Uninitialized Memory Corruption Vulnerability,2025-10-06,2025-10-27,Unknown,MSFT,Microsoft Internet Explorer contains an uninitialized memory corruption vulnerability that could allow for remote code execution. The impacted product could be end-of-life (EoL) and/or end-of-service ,2026-04-27T23:12:22Z
CVE-2021-43226,Microsoft,Windows,Microsoft Windows Privilege Escalation Vulnerability,2025-10-06,2025-10-27,Unknown,MSFT,"Microsoft Windows Common Log File System Driver contains a privilege escalation vulnerability that could allow a local, privileged attacker to bypass certain security mechanisms.",2026-04-27T23:12:22Z
CVE-2013-3918,Microsoft,Windows,Microsoft Windows Out-of-Bounds Write Vulnerability,2025-10-06,2025-10-27,Unknown,MSFT,"Microsoft Windows contains an out-of-bounds write vulnerability in the InformationCardSigninHelper Class ActiveX control, icardie.dll. An attacker could exploit the vulnerability by constructing a spe",2026-04-27T23:12:22Z
CVE-2011-3402,Microsoft,Windows,Microsoft Windows Remote Code Execution Vulnerability,2025-10-06,2025-10-27,Unknown,MSFT,Microsoft Windows Kernel contains an unspecified vulnerability in the TrueType font parsing engine in win32k.sys in the kernel-mode drivers that allows remote attackers to execute arbitrary code via c,2026-04-27T23:12:22Z
CVE-2010-3765,Mozilla,Multiple Products,Mozilla Multiple Products Remote Code Execution Vulnerability,2025-10-06,2025-10-27,Unknown,,"Mozilla Firefox, SeaMonkey, and Thunderbird contain an unspecified vulnerability when JavaScript is enabled. This allows remote attackers to execute arbitrary code via vectors related to nsCSSFrameCon",2026-04-27T23:12:22Z
