kind,ticker,name,form,filed,accession,captured_at
work_stoppage,,"XOMA Royalty Corp  (XOMA, XOMAO, XOMAP)  (CIK 0000791908)",8-K,2026-04-27,0001193125-26-179085:d139894dex21.htm,2026-04-27T22:52:38Z
work_stoppage,,"LIGAND PHARMACEUTICALS INC  (LGND, LGNDZ, LGNXZ, LGNYZ, LGNZZ)  (CIK 0000886163)",8-K,2026-04-27,0001193125-26-179529:d143046dex21.htm,2026-04-27T22:52:38Z
work_stoppage,,"Miluna Acquisition Corp  (MMTX, MMTXU, MMTXW)  (CIK 0002077033)",8-K,2026-04-27,0001493152-26-019055:ex2-1.htm,2026-04-27T22:52:38Z
collective_bargaining,SSD,"Simpson Manufacturing Co., Inc.  (SSD)  (CIK 0000920371)",8-K,2026-04-27,0001628280-26-027513:q12026ex991pressrelease.htm,2026-04-27T22:52:38Z
collective_bargaining,SSD,"Simpson Manufacturing Co., Inc.  (SSD)  (CIK 0000920371)",8-K,2026-04-27,0001628280-26-027513:exhibit992ssdinvestorpre.htm,2026-04-27T22:52:38Z
collective_bargaining,ELSE,ELECTRO SENSORS INC  (ELSE)  (CIK 0000351789),8-K/A,2026-04-27,0000897101-26-000148:a04242026_ex2-1.htm,2026-04-27T22:52:38Z
work_stoppage,PALX,Palomino Laboratories Inc.  (PALX)  (CIK 0001938569),8-K,2026-04-24,0001493152-26-018963:ex4-1.htm,2026-04-27T22:52:38Z
work_stoppage,PEBO,PEOPLES BANCORP INC  (PEBO)  (CIK 0000318300),8-K,2026-04-24,0000318300-26-000145:exhibit21.htm,2026-04-27T22:52:38Z
labor_strike,ALTS,ALT5 Sigma Corp  (ALTS)  (CIK 0000862861),8-K,2026-04-24,0001493152-26-018994:ex10-138.htm,2026-04-27T22:52:38Z
collective_bargaining,PEBO,PEOPLES BANCORP INC  (PEBO)  (CIK 0000318300),8-K,2026-04-24,0000318300-26-000145:exhibit21.htm,2026-04-27T22:52:38Z
work_stoppage,,"Athena Technology Acquisition Corp. II  (ATEK, ATEKU, ATEKW)  (CIK 0001882198)",8-K,2026-04-23,0001213900-26-047101:ea028748701ex10-1.htm,2026-04-27T22:52:38Z
labor_strike,,"GCI Liberty, Inc.  (GLIBA, GLIBB, GLIBK)  (CIK 0002057463)",8-K,2026-04-23,0001104659-26-047805:tm2612513d1_ex2-1.htm,2026-04-27T22:52:38Z
collective_bargaining,WKC,WORLD KINECT CORP  (WKC)  (CIK 0000789460),8-K,2026-04-23,0000789460-26-000023:a2026q18-kexx991earnings.htm,2026-04-27T22:52:38Z
collective_bargaining,,"GCI Liberty, Inc.  (GLIBA, GLIBB, GLIBK)  (CIK 0002057463)",8-K,2026-04-23,0001104659-26-047805:tm2612513d1_ex2-1.htm,2026-04-27T22:52:38Z
collective_bargaining,,"Rexford Industrial Realty, Inc.  (REXR, REXR-PB, REXR-PC)  (CIK 0001571283)",8-K,2026-04-23,0001571283-26-000017:ex141codeofbusinessconduct.htm,2026-04-27T22:52:38Z
work_stoppage,TH,Target Hospitality Corp.  (TH)  (CIK 0001712189),8-K,2026-04-22,0001104659-26-046359:tm269315d1_ex1-1.htm,2026-04-27T22:52:38Z
work_stoppage,,"Iron Horse Acquisition II Corp.  (IRHO, IRHOR, IRHOU)  (CIK 0002051985)",8-K,2026-04-22,0001213900-26-046611:ea028718501ex2-1.htm,2026-04-27T22:52:38Z
labor_strike,,"Iron Horse Acquisition II Corp.  (IRHO, IRHOR, IRHOU)  (CIK 0002051985)",8-K,2026-04-22,0001213900-26-046611:ea028718501ex2-1.htm,2026-04-27T22:52:38Z
collective_bargaining,GNVR,Genvor Inc  (GNVR)  (CIK 0001792941),8-K,2026-04-22,0001903596-26-000160:ex10_1.htm,2026-04-27T22:52:38Z
collective_bargaining,OTIS,Otis Worldwide Corp  (OTIS)  (CIK 0001781335),8-K,2026-04-22,0001781335-26-000072:a2026-03x318xkerexhibit99.htm,2026-04-27T22:52:38Z
collective_bargaining,SKIN,SkinHealth Systems Inc.  (SKIN)  (CIK 0001818093),8-K,2026-04-22,0001628280-26-026555:ex33-secondamendedandresta.htm,2026-04-27T22:52:38Z
collective_bargaining,AMRX,"Amneal Pharmaceuticals, Inc.  (AMRX)  (CIK 0001723128)",8-K,2026-04-22,0001193125-26-168231:d126526dex21.htm,2026-04-27T22:52:38Z
collective_bargaining,,"Iron Horse Acquisition II Corp.  (IRHO, IRHOR, IRHOU)  (CIK 0002051985)",8-K,2026-04-22,0001213900-26-046611:ea028718501ex2-1.htm,2026-04-27T22:52:38Z
collective_bargaining,,"SPIRE INC  (SR, SRJN)  (CIK 0001126956)",8-K,2026-04-22,0001193125-26-168301:sr-ex10_1.htm,2026-04-27T22:52:38Z
work_stoppage,ONTO,ONTO INNOVATION INC.  (ONTO)  (CIK 0000704532),8-K,2026-04-21,0001193125-26-164529:d75499dex21.htm,2026-04-27T22:52:38Z
labor_strike,ONTO,ONTO INNOVATION INC.  (ONTO)  (CIK 0000704532),8-K,2026-04-21,0001193125-26-164529:d75499dex21.htm,2026-04-27T22:52:38Z
labor_strike,,"SOUNDHOUND AI, INC.  (SOUN, SOUNW)  (CIK 0001840856)",8-K,2026-04-21,0001213900-26-045987:ea028711701ex2-1.htm,2026-04-27T22:52:38Z
labor_strike,BRC,BRADY CORP  (BRC)  (CIK 0000746598),8-K,2026-04-21,0000746598-26-000014:exhibit21equitypurchaseagr.htm,2026-04-27T22:52:38Z
collective_bargaining,,"SOUNDHOUND AI, INC.  (SOUN, SOUNW)  (CIK 0001840856)",8-K,2026-04-21,0001213900-26-045987:ea028711701ex2-1.htm,2026-04-27T22:52:38Z
work_stoppage,,"Piermont Valley Acquisition Corp  (CMCAF, CMCUF, CMCWF)  (CIK 0001865248)",8-K,2026-04-20,0001477932-26-002395:cmca_ex21.htm,2026-04-27T22:52:38Z
work_stoppage,,Bridgecrest Auto Funding LLC  (CIK 0001974820),8-K,2026-04-20,0001104659-26-045464:tm2611397d10_ex4-1.htm,2026-04-27T22:52:38Z
labor_strike,BLD,TopBuild Corp  (BLD)  (CIK 0001633931),8-K,2026-04-20,0001104659-26-045245:bld-20260418xex2d1.htm,2026-04-27T22:52:38Z
labor_strike,,"QXO, Inc.  (QXO, QXO-PB)  (CIK 0001236275)",8-K,2026-04-20,0001104659-26-045111:tm2612209d1_ex2-1.htm,2026-04-27T22:52:38Z
collective_bargaining,ALK,"ALASKA AIR GROUP, INC.  (ALK)  (CIK 0000766421)",8-K,2026-04-20,0000766421-26-000015:alksupplemental1q26.htm,2026-04-27T22:52:38Z
collective_bargaining,ALK,"ALASKA AIR GROUP, INC.  (ALK)  (CIK 0000766421)",8-K,2026-04-20,0000766421-26-000015:ex9914202026earningsrelease.htm,2026-04-27T22:52:38Z
collective_bargaining,,"Piermont Valley Acquisition Corp  (CMCAF, CMCUF, CMCWF)  (CIK 0001865248)",8-K,2026-04-20,0001477932-26-002395:cmca_8k.htm,2026-04-27T22:52:38Z
collective_bargaining,USAR,"USA Rare Earth, Inc.  (USAR)  (CIK 0001970622)",8-K,2026-04-20,0001213900-26-045706:ea028694001ex2-1.htm,2026-04-27T22:52:38Z
work_stoppage,YORW,YORK WATER CO  (YORW)  (CIK 0000108985),8-K,2026-04-17,0001140361-26-015308:ef20070803_ex1-1.htm,2026-04-27T22:52:38Z
collective_bargaining,ROCK,"GIBRALTAR INDUSTRIES, INC.  (ROCK)  (CIK 0000912562)",8-K/A,2026-04-17,0001140361-26-015303:ef20070062_ex99-1.htm,2026-04-27T22:52:38Z
collective_bargaining,,"AleAnna, Inc.  (ANNA, ANNAW)  (CIK 0001845123)",8-K,2026-04-17,0001213900-26-045158:ea0286704-8k_aleanna.htm,2026-04-27T22:52:38Z
collective_bargaining,ARXS,"Arxis, Inc.  (ARXS)  (CIK 0002093536)",8-K,2026-04-17,0001193125-26-161805:d15141dex32.htm,2026-04-27T22:52:38Z
work_stoppage,ACHV,"ACHIEVE LIFE SCIENCES, INC.  (ACHV)  (CIK 0000949858)",8-K,2026-04-16,0001193125-26-159189:achv-ex10_1.htm,2026-04-27T22:52:38Z
work_stoppage,,Ionetix Corp / DE /  (CIK 0002108121),8-K,2026-04-16,0001213900-26-044239:ea028609201ex10-3.htm,2026-04-27T22:52:38Z
work_stoppage,,BMW AUTO LEASING LLC  (CIK 0001126530),8-K,2026-04-16,0000929638-26-001523:exhibit4-1.htm,2026-04-27T22:52:38Z
collective_bargaining,CDNA,"CareDx, Inc.  (CDNA)  (CIK 0001217234)",8-K,2026-04-16,0001104659-26-043970:tm2611749d1_ex2-1.htm,2026-04-27T22:52:38Z
collective_bargaining,AIXC,"AIxCrypto Holdings, Inc.  (AIXC)  (CIK 0001460702)",8-K,2026-04-16,0001493152-26-017084:ex10-3.htm,2026-04-27T22:52:38Z
collective_bargaining,,"FARADAY FUTURE INTELLIGENT ELECTRIC INC.  (FFAI, FFAIW)  (CIK 0001805521)",8-K,2026-04-16,0001213900-26-044633:ea028657901ex10-1.htm,2026-04-27T22:52:38Z
collective_bargaining,ESE,ESCO TECHNOLOGIES INC  (ESE)  (CIK 0000866706),8-K,2026-04-16,0001104659-26-044425:tm2611835d1_ex10-1.htm,2026-04-27T22:52:38Z
work_stoppage,GHM,GRAHAM CORP  (GHM)  (CIK 0000716314),8-K,2026-04-15,0001193125-26-155977:d147885dex101.htm,2026-04-27T22:52:38Z
work_stoppage,TRAW,"Traws Pharma, Inc.  (TRAW)  (CIK 0001130598)",8-K,2026-04-15,0001104659-26-043497:tm2611843d1_ex10-1.htm,2026-04-27T22:52:38Z
work_stoppage,YHC,LQR House Inc.  (YHC)  (CIK 0001843165),8-K,2026-04-15,0001213900-26-044043:ea028644801ex10-1.htm,2026-04-27T22:52:38Z
work_stoppage,TLRY,"Tilray Brands, Inc.  (TLRY)  (CIK 0001731348)",8-K,2026-04-15,0001140361-26-014692:ny20066669x2_ex1-1.htm,2026-04-27T22:52:38Z
work_stoppage,LDOS,"Leidos Holdings, Inc.  (LDOS)  (CIK 0001336920)",8-K,2026-04-15,0001193125-26-155884:d148240dex21.htm,2026-04-27T22:52:38Z
work_stoppage,,"SPIRE INC  (SR, SRJN)  (CIK 0001126956)",8-K,2026-04-15,0001193125-26-155936:sr-ex10_1.htm,2026-04-27T22:52:38Z
labor_strike,TLRY,"Tilray Brands, Inc.  (TLRY)  (CIK 0001731348)",8-K,2026-04-15,0001140361-26-014692:ny20066669x2_ex1-1.htm,2026-04-27T22:52:38Z
labor_strike,,"SPIRE INC  (SR, SRJN)  (CIK 0001126956)",8-K,2026-04-15,0001193125-26-155936:sr-ex10_1.htm,2026-04-27T22:52:38Z
collective_bargaining,YHC,LQR House Inc.  (YHC)  (CIK 0001843165),8-K,2026-04-15,0001213900-26-044043:ea028644801ex10-1.htm,2026-04-27T22:52:38Z
collective_bargaining,PNW,PINNACLE WEST CAPITAL CORP  (PNW)  (CIK 0000764622),8-K,2026-04-15,0000764622-26-000018:aprilinvestordeck.htm,2026-04-27T22:52:38Z
collective_bargaining,,"SPIRE INC  (SR, SRJN)  (CIK 0001126956)",8-K,2026-04-15,0001193125-26-155936:sr-ex10_1.htm,2026-04-27T22:52:38Z
work_stoppage,GRTX,"Galera Therapeutics, Inc.  (GRTX)  (CIK 0001563577)",8-K,2026-04-14,0001193125-26-154009:d124753dex104.htm,2026-04-27T22:52:38Z
work_stoppage,GRTX,"Galera Therapeutics, Inc.  (GRTX)  (CIK 0001563577)",8-K,2026-04-14,0001193125-26-154009:d124753dex21.htm,2026-04-27T22:52:38Z
labor_strike,WERN,WERNER ENTERPRISES INC  (WERN)  (CIK 0000793074),8-K/A,2026-04-14,0000793074-26-000090:wern-20260127ex101.htm,2026-04-27T22:52:38Z
collective_bargaining,GSAT,"Globalstar, Inc.  (GSAT)  (CIK 0001366868)",8-K,2026-04-14,0001140361-26-014528:ef20070409_ex2-1.htm,2026-04-27T22:52:38Z
collective_bargaining,,"Haymaker Acquisition Corp. 4  (HYAC, HYAC-UN, HYAC-WT)  (CIK 0001970509)",8-K,2026-04-14,0001104659-26-043241:tm2611641d1_ex3-2.htm,2026-04-27T22:52:38Z
collective_bargaining,RMIX,"Suncrete, Inc.  (RMIX)  (CIK 0002094433)",8-K,2026-04-14,0001104659-26-043237:tm2611641d1_ex3-2.htm,2026-04-27T22:52:38Z
collective_bargaining,GRTX,"Galera Therapeutics, Inc.  (GRTX)  (CIK 0001563577)",8-K,2026-04-14,0001193125-26-154009:d124753dex21.htm,2026-04-27T22:52:38Z
collective_bargaining,WERN,WERNER ENTERPRISES INC  (WERN)  (CIK 0000793074),8-K/A,2026-04-14,0000793074-26-000090:wern-20260127ex101.htm,2026-04-27T22:52:38Z
work_stoppage,IMA,"ImageneBio, Inc.  (IMA)  (CIK 0001835579)",8-K,2026-04-13,0001193125-26-151942:d143873dex101.htm,2026-04-27T22:52:38Z
labor_strike,LEG,LEGGETT & PLATT INC  (LEG)  (CIK 0000058492),8-K,2026-04-13,0001193125-26-151966:d38467dex21.htm,2026-04-27T22:52:38Z
labor_strike,SGI,SOMNIGROUP INTERNATIONAL INC.  (SGI)  (CIK 0001206264),8-K,2026-04-13,0001206264-26-000048:exhibit21-agreementandplan.htm,2026-04-27T22:52:38Z
collective_bargaining,SGI,SOMNIGROUP INTERNATIONAL INC.  (SGI)  (CIK 0001206264),8-K,2026-04-13,0001206264-26-000048:exhibit21-agreementandplan.htm,2026-04-27T22:52:38Z
collective_bargaining,LEG,LEGGETT & PLATT INC  (LEG)  (CIK 0000058492),8-K,2026-04-13,0001193125-26-151966:d38467dex21.htm,2026-04-27T22:52:38Z
collective_bargaining,NXXT,"NEXTNRG, INC.  (NXXT)  (CIK 0001817004)",8-K,2026-04-10,0001493152-26-016197:ex10-1.htm,2026-04-27T22:52:38Z
work_stoppage,ASRT,"Assertio Holdings, Inc.  (ASRT)  (CIK 0001808665)",8-K,2026-04-09,0001104659-26-041236:tm2611405d1_ex10-1.htm,2026-04-27T22:52:38Z
work_stoppage,ASRT,"Assertio Holdings, Inc.  (ASRT)  (CIK 0001808665)",8-K/A,2026-04-09,0001104659-26-041569:tm2611405d4_ex10-1.htm,2026-04-27T22:52:38Z
labor_strike,ASRT,"Assertio Holdings, Inc.  (ASRT)  (CIK 0001808665)",8-K,2026-04-09,0001104659-26-041236:tm2611405d1_ex10-1.htm,2026-04-27T22:52:38Z
labor_strike,ASRT,"Assertio Holdings, Inc.  (ASRT)  (CIK 0001808665)",8-K/A,2026-04-09,0001104659-26-041569:tm2611405d4_ex10-1.htm,2026-04-27T22:52:38Z
collective_bargaining,,"Constellation Acquisition Corp I  (CSTAF, CSTUF, CSTWF)  (CIK 0001834032)",8-K,2026-04-09,0001213900-26-042083:ea028571401ex2-1.htm,2026-04-27T22:52:38Z
work_stoppage,FRMM,FORUM MARKETS Inc  (FRMM)  (CIK 0001690080),8-K,2026-04-08,0001213900-26-041270:ea028526801ex10-1.htm,2026-04-27T22:52:38Z
work_stoppage,CLST,"Catalyst Bancorp, Inc.  (CLST)  (CIK 0001849867)",8-K,2026-04-08,0001849867-26-000005:clst-20260407xex2d1.htm,2026-04-27T22:52:38Z
collective_bargaining,,"VORNADO REALTY TRUST  (VNO, VNORP, VNO-PL, VNO-PM, VNO-PN, VNO-PO)  (CIK 0000899",8-K,2026-04-08,0000899689-26-000021:vnosustainability2025rep.htm,2026-04-27T22:52:38Z
work_stoppage,GTBP,"GT Biopharma, Inc.  (GTBP)  (CIK 0000109657)",8-K,2026-04-07,0001493152-26-015413:ex10-1.htm,2026-04-27T22:52:38Z
work_stoppage,,"Aptiv PLC  (APTV, APTV-WI)  (CIK 0001521332)",8-K,2026-04-06,0000950103-26-005345:dp244900_ex9901.htm,2026-04-27T22:52:38Z
work_stoppage,,"Aptiv PLC  (APTV, APTV-WI)  (CIK 0001521332)",8-K,2026-04-06,0000950103-26-005345:dp244900_8k.htm,2026-04-27T22:52:38Z
work_stoppage,,"MCCORMICK & CO INC  (MKC, MKC-V)  (CIK 0000063754)",8-K/A,2026-04-06,0001999371-26-007671:ex2-1.htm,2026-04-27T22:52:38Z
labor_strike,SLNO,SOLENO THERAPEUTICS INC  (SLNO)  (CIK 0001484565),8-K,2026-04-06,0001193125-26-142911:d142985dex21.htm,2026-04-27T22:52:38Z
labor_strike,NBIX,NEUROCRINE BIOSCIENCES INC  (NBIX)  (CIK 0000914475),8-K,2026-04-06,0001193125-26-142904:d110123dex21.htm,2026-04-27T22:52:38Z
collective_bargaining,,"Owlet, Inc.  (OWLT, OWLTW)  (CIK 0001816708)",8-K,2026-04-06,0001816708-26-000023:a101separationandrelease.htm,2026-04-27T22:52:38Z
collective_bargaining,,"MCCORMICK & CO INC  (MKC, MKC-V)  (CIK 0000063754)",8-K/A,2026-04-06,0001999371-26-007671:ex2-1.htm,2026-04-27T22:52:38Z
work_stoppage,FORA,Forian Inc.  (FORA)  (CIK 0001829280),8-K,2026-04-03,0001140361-26-013124:ef20069813_ex2-1.htm,2026-04-27T22:52:38Z
labor_strike,FORA,Forian Inc.  (FORA)  (CIK 0001829280),8-K,2026-04-03,0001140361-26-013124:ef20069813_ex2-1.htm,2026-04-27T22:52:38Z
collective_bargaining,HCAT,"Health Catalyst, Inc.  (HCAT)  (CIK 0001636422)",8-K,2026-04-03,0001636422-26-000042:exhibit101-danburtontransi.htm,2026-04-27T22:52:38Z
work_stoppage,AGIG,"ABUNDIA GLOBAL IMPACT GROUP, INC.  (AGIG)  (CIK 0001156041)",8-K,2026-04-02,0001493152-26-014820:ex10-1.htm,2026-04-27T22:52:38Z
collective_bargaining,AGIG,"ABUNDIA GLOBAL IMPACT GROUP, INC.  (AGIG)  (CIK 0001156041)",8-K,2026-04-02,0001493152-26-014820:ex10-1.htm,2026-04-27T22:52:38Z
collective_bargaining,TYGO,"TIGO ENERGY, INC.  (TYGO)  (CIK 0001855447)",8-K,2026-04-02,0001213900-26-039446:ea028455601ex10-1.htm,2026-04-27T22:52:38Z
work_stoppage,CYCN,"Cyclerion Therapeutics, Inc.  (CYCN)  (CIK 0001755237)",8-K,2026-04-01,0001193125-26-137909:d128275dex103.htm,2026-04-27T22:52:38Z
work_stoppage,CYCN,"Cyclerion Therapeutics, Inc.  (CYCN)  (CIK 0001755237)",8-K,2026-04-01,0001193125-26-137909:d128275dex21.htm,2026-04-27T22:52:38Z
work_stoppage,CWBHF,"Charlotte's Web Holdings, Inc.  (CWBHF)  (CIK 0001750155)",8-K,2026-04-01,0001750155-26-000036:exhibit101-subscriptionagr.htm,2026-04-27T22:52:38Z
collective_bargaining,VGNT,Versigent PLC  (VGNT)  (CIK 0002078008),8-K,2026-04-01,0001193125-26-138219:d52176dex103.htm,2026-04-27T22:52:38Z
collective_bargaining,,"MOVADO GROUP INC  (MOV, MOVAA)  (CIK 0000072573)",8-K,2026-04-01,0000950142-26-001010:eh260757984_ex1001.htm,2026-04-27T22:52:38Z
work_stoppage,SCYX,SCYNEXIS INC  (SCYX)  (CIK 0001178253),8-K,2026-03-31,0001193125-26-133259:d122408dex101.htm,2026-04-27T22:52:38Z
work_stoppage,AFBI,"Affinity Bancshares, Inc.  (AFBI)  (CIK 0001823406)",8-K,2026-03-31,0001193125-26-134773:d138375dex21.htm,2026-04-27T22:52:38Z
collective_bargaining,AFBI,"Affinity Bancshares, Inc.  (AFBI)  (CIK 0001823406)",8-K,2026-03-31,0001193125-26-134773:d138375dex21.htm,2026-04-27T22:52:38Z
work_stoppage,OKUR,"OnKure Therapeutics, Inc.  (OKUR)  (CIK 0001637715)",8-K,2026-03-30,0001193125-26-130283:d910791dex101.htm,2026-04-27T22:52:38Z
work_stoppage,CGEH,"Capstone Green Energy Holdings, Inc.  (CGEH)  (CIK 0001009759)",8-K,2026-03-30,0001104659-26-036455:tm2610121d1_ex10-1.htm,2026-04-27T22:52:38Z
work_stoppage,,"SPIRE INC  (SR, SRJN)  (CIK 0001126956)",8-K,2026-03-30,0001193125-26-130379:sr-ex10_1.htm,2026-04-27T22:52:38Z
labor_strike,,"Compass Diversified Holdings  (CODI, CODI-PA, CODI-PB, CODI-PC)  (CIK 0001345126",8-K,2026-03-30,0001345126-26-000030:ex21sternoagreementandplan.htm,2026-04-27T22:52:38Z
collective_bargaining,SYY,SYSCO CORP  (SYY)  (CIK 0000096021),8-K,2026-03-30,0000950142-26-000922:eh260755710_ex0201.htm,2026-04-27T22:52:38Z
collective_bargaining,CGEH,"Capstone Green Energy Holdings, Inc.  (CGEH)  (CIK 0001009759)",8-K,2026-03-30,0001104659-26-036455:tm2610121d1_ex10-1.htm,2026-04-27T22:52:38Z
work_stoppage,VOR,Vor Biopharma Inc.  (VOR)  (CIK 0001817229),8-K,2026-03-27,0001193125-26-127609:vor-ex10_1.htm,2026-04-27T22:52:38Z
work_stoppage,ANAB,"ANAPTYSBIO, INC  (ANAB)  (CIK 0001370053)",8-K,2026-03-27,0001193125-26-127783:d122216dex101.htm,2026-04-27T22:52:38Z
work_stoppage,PULM,"Pulmatrix, Inc.  (PULM)  (CIK 0001574235)",8-K,2026-03-27,0001493152-26-013266:ex2-1.htm,2026-04-27T22:52:38Z
work_stoppage,FRMM,FORUM MARKETS Inc  (FRMM)  (CIK 0001690080),8-K,2026-03-27,0001213900-26-035601:ea028375501ex10-3.htm,2026-04-27T22:52:38Z
work_stoppage,CTGO,"Contango ORE, Inc.  (CTGO)  (CIK 0001502377)",8-K,2026-03-27,0001193125-26-129496:d124597dex21.htm,2026-04-27T22:52:38Z
work_stoppage,,"TWO HARBORS INVESTMENT CORP.  (TWO, TWOD, TWO-PA, TWO-PB, TWO-PC)  (CIK 00014657",8-K,2026-03-27,0001104659-26-035663:tm269980d1_ex2-1.htm,2026-04-27T22:52:38Z
labor_strike,OLPX,"OLAPLEX HOLDINGS, INC.  (OLPX)  (CIK 0001868726)",8-K,2026-03-26,0001193125-26-126362:d119132dex21.htm,2026-04-27T22:52:38Z
collective_bargaining,PGC,PEAPACK GLADSTONE FINANCIAL CORP  (PGC)  (CIK 0001050743),8-K,2026-03-26,0001193125-26-125298:d124437dex101.htm,2026-04-27T22:52:38Z
work_stoppage,VREOF,Vireo Growth Inc.  (VREOF)  (CIK 0001771706),8-K,2026-03-25,0001104659-26-034509:tm269781d1_ex2-3.htm,2026-04-27T22:52:38Z
work_stoppage,VREOF,Vireo Growth Inc.  (VREOF)  (CIK 0001771706),8-K,2026-03-25,0001104659-26-034509:tm269781d1_ex2-1.htm,2026-04-27T22:52:38Z
work_stoppage,TERN,"Terns Pharmaceuticals, Inc.  (TERN)  (CIK 0001831363)",8-K,2026-03-25,0001193125-26-122785:d86253dex21.htm,2026-04-27T22:52:38Z
work_stoppage,KPTI,Karyopharm Therapeutics Inc.  (KPTI)  (CIK 0001503802),8-K,2026-03-24,0001193125-26-120770:d125009dex101.htm,2026-04-27T22:52:38Z
work_stoppage,FNGR,"FingerMotion, Inc.  (FNGR)  (CIK 0001602409)",8-K,2026-03-24,0001520138-26-000083:fngr-20260318_8kex10z1.htm,2026-04-27T22:52:38Z
collective_bargaining,GAMG,"Global Asset Management Group, Inc.  (GAMG)  (CIK 0000055234)",8-K,2026-03-24,0001477932-26-001558:gamg_ex102.htm,2026-04-27T22:52:38Z
work_stoppage,,"STARTENGINE CROWDFUNDING, INC.  (CIK 0001661779)",8-K,2026-03-23,0001104659-26-033376:tm269376d1_ex10-1.htm,2026-04-27T22:52:38Z
labor_strike,HLIT,HARMONIC INC.  (HLIT)  (CIK 0000851310),8-K,2026-03-23,0001193125-26-119977:hlit-ex2_1.htm,2026-04-27T22:52:38Z
collective_bargaining,,"DTE ENERGY CO  (DTB, DTE, DTG, DTK, DTW)  (CIK 0000936340)",8-K,2026-03-23,0000936340-26-000071:presentationfinal8k32326.htm,2026-04-27T22:52:38Z
collective_bargaining,,"STARTENGINE CROWDFUNDING, INC.  (CIK 0001661779)",8-K,2026-03-23,0001104659-26-033376:tm269376d1_ex10-1.htm,2026-04-27T22:52:38Z
work_stoppage,APTV,Aptiv PLC  (APTV)  (CIK 0001521332),8-K,2026-03-20,0000950103-26-004474:dp243887_8k.htm,2026-04-27T22:52:38Z
work_stoppage,APTV,Aptiv PLC  (APTV)  (CIK 0001521332),8-K,2026-03-20,0000950103-26-004474:dp243887_ex9901.htm,2026-04-27T22:52:38Z
work_stoppage,APTV,Aptiv PLC  (APTV)  (CIK 0001521332),8-K,2026-03-20,0000950103-26-004474:dp243887_ex9902.htm,2026-04-27T22:52:38Z
work_stoppage,,ONCOR ELECTRIC DELIVERY CO LLC  (CIK 0001193311),8-K,2026-03-20,0001193125-26-117626:d127318dex42.htm,2026-04-27T22:52:38Z
work_stoppage,CV,"CapsoVision, Inc  (CV)  (CIK 0001378325)",8-K,2026-03-20,0001378325-26-000004:cv-20260320xex101.htm,2026-04-27T22:52:38Z
work_stoppage,SEI,"Solaris Energy Infrastructure, Inc.  (SEI)  (CIK 0001697500)",8-K,2026-03-20,0001193125-26-117930:d69360dex21.htm,2026-04-27T22:52:38Z
work_stoppage,EMBC,Embecta Corp.  (EMBC)  (CIK 0001872789),8-K,2026-03-20,0000947871-26-000310:ss6090062_ex0201.htm,2026-04-27T22:52:38Z
collective_bargaining,,"Aeries Technology, Inc.  (AERT, AERTW)  (CIK 0001853044)",8-K,2026-03-20,0001829126-26-002572:aeriestech_ex10-1.htm,2026-04-27T22:52:38Z
work_stoppage,MOVE,Movano Inc.  (MOVE)  (CIK 0001734750),8-K,2026-03-19,0001213900-26-031846:ea028203201ex2-1.htm,2026-04-27T22:52:38Z
work_stoppage,CBL,CBL & ASSOCIATES PROPERTIES INC  (CBL)  (CIK 0000910612),8-K,2026-03-19,0001193125-26-115610:cbl-ex10_1.htm,2026-04-27T22:52:38Z
work_stoppage,DVLT,Datavault AI Inc.  (DVLT)  (CIK 0001682149),8-K,2026-03-19,0001104659-26-031770:tm269288d1_ex2-1.htm,2026-04-27T22:52:38Z
labor_strike,DVLT,Datavault AI Inc.  (DVLT)  (CIK 0001682149),8-K,2026-03-19,0001104659-26-031770:tm269288d1_ex2-1.htm,2026-04-27T22:52:38Z
labor_strike,COLL,"COLLEGIUM PHARMACEUTICAL, INC  (COLL)  (CIK 0001267565)",8-K,2026-03-19,0001104659-26-032166:tm269336d1_ex2-1.htm,2026-04-27T22:52:38Z
labor_strike,CBL,CBL & ASSOCIATES PROPERTIES INC  (CBL)  (CIK 0000910612),8-K,2026-03-19,0001193125-26-115610:cbl-ex10_1.htm,2026-04-27T22:52:38Z
collective_bargaining,LGN,Legence Corp.  (LGN)  (CIK 0002052568),8-K/A,2026-03-19,0001193125-26-114802:d122671dex991.htm,2026-04-27T22:52:38Z
collective_bargaining,SIG,SIGNET JEWELERS LTD  (SIG)  (CIK 0000832988),8-K,2026-03-19,0000832988-26-000054:fy27ex9913x19x26pressrelea.htm,2026-04-27T22:52:38Z
collective_bargaining,COLL,"COLLEGIUM PHARMACEUTICAL, INC  (COLL)  (CIK 0001267565)",8-K,2026-03-19,0001104659-26-032166:tm269336d1_ex2-1.htm,2026-04-27T22:52:38Z
work_stoppage,OVID,Ovid Therapeutics Inc.  (OVID)  (CIK 0001636651),8-K,2026-03-18,0001628280-26-019045:a101.htm,2026-04-27T22:52:38Z
work_stoppage,IBCP,INDEPENDENT BANK CORP /MI/  (IBCP)  (CIK 0000039311),8-K,2026-03-18,0000039311-26-000020:ibcp-20260318ex21agreement.htm,2026-04-27T22:52:38Z
labor_strike,IBCP,INDEPENDENT BANK CORP /MI/  (IBCP)  (CIK 0000039311),8-K,2026-03-18,0000039311-26-000020:ibcp-20260318ex21agreement.htm,2026-04-27T22:52:38Z
work_stoppage,VRSSF,Verses AI Inc.  (VRSSF)  (CIK 0001879001),8-K,2026-03-17,0001493152-26-010465:ex4-1.htm,2026-04-27T22:52:38Z
collective_bargaining,,"Longevity Health Holdings, Inc.  (XAGE, XAGEW)  (CIK 0001842939)",8-K,2026-03-17,0001193125-26-109472:xage-ex10_1.htm,2026-04-27T22:52:38Z
work_stoppage,AP,AMPCO PITTSBURGH CORP  (AP)  (CIK 0000006176),8-K,2026-03-16,0001193125-26-108519:ap-ex99_1.htm,2026-04-27T22:52:38Z
work_stoppage,ABOS,"Acumen Pharmaceuticals, Inc.  (ABOS)  (CIK 0001576885)",8-K,2026-03-16,0001628280-26-017885:active_169066101x1xex101to.htm,2026-04-27T22:52:38Z
work_stoppage,ATXG,ADDENTAX GROUP CORP.  (ATXG)  (CIK 0001650101),8-K/A,2026-03-16,0001493152-26-010154:ex10-1.htm,2026-04-27T22:52:38Z
work_stoppage,KMFG,KEEMO Fashion Group Ltd  (KMFG)  (CIK 0001935033),8-K/A,2026-03-16,0001493152-26-010146:ex10-1.htm,2026-04-27T22:52:38Z
work_stoppage,,"New Providence Acquisition Corp. III/Cayman  (NPAC, NPACU, NPACW)  (CIK 00020489",8-K,2026-03-16,0001213900-26-027989:ea028033901ex2-1.htm,2026-04-27T22:52:38Z
labor_strike,,"IB Acquisition Corp.  (IBAC, IBACR)  (CIK 0001998781)",8-K,2026-03-16,0001493152-26-010261:ex2-1.htm,2026-04-27T22:52:38Z
collective_bargaining,WT,"WisdomTree, Inc.  (WT)  (CIK 0000880631)",8-K,2026-03-16,0001214659-26-003292:ex2_2.htm,2026-04-27T22:52:38Z
collective_bargaining,ATXG,ADDENTAX GROUP CORP.  (ATXG)  (CIK 0001650101),8-K/A,2026-03-16,0001493152-26-010154:ex10-1.htm,2026-04-27T22:52:38Z
work_stoppage,ADTX,"Aditxt, Inc.  (ADTX)  (CIK 0001726711)",8-K,2026-03-13,0001213900-26-027281:ea027944301ex10-1.htm,2026-04-27T22:52:38Z
work_stoppage,IRIX,IRIDEX CORP  (IRIX)  (CIK 0001006045),8-K,2026-03-13,0001193125-26-106190:irix-ex10_1.htm,2026-04-27T22:52:38Z
work_stoppage,LGVN,Longeveron Inc.  (LGVN)  (CIK 0001721484),8-K,2026-03-12,0001213900-26-026930:ea028110001ex10-1.htm,2026-04-27T22:52:38Z
collective_bargaining,NIMU,NON INVASIVE MONITORING SYSTEMS INC /FL/  (NIMU)  (CIK 0000720762),8-K,2026-03-12,0001493152-26-009883:ex2-1.htm,2026-04-27T22:52:38Z
collective_bargaining,,"Plum Acquisition Corp, IV  (PLMK, PLMKU, PLMKW)  (CIK 0002030482)",8-K,2026-03-12,0001213900-26-026265:ea028077001ex2-1.htm,2026-04-27T22:52:38Z
work_stoppage,ANTX,"AN2 Therapeutics, Inc.  (ANTX)  (CIK 0001880438)",8-K,2026-03-10,0001193125-26-099169:d14366dex101.htm,2026-04-27T22:52:38Z
collective_bargaining,DY,DYCOM INDUSTRIES INC  (DY)  (CIK 0000067215),8-K/A,2026-03-10,0001193125-26-099470:d72789dex992.htm,2026-04-27T22:52:38Z
collective_bargaining,DY,DYCOM INDUSTRIES INC  (DY)  (CIK 0000067215),8-K/A,2026-03-10,0001193125-26-099470:d72789dex991.htm,2026-04-27T22:52:38Z
collective_bargaining,HWM,Howmet Aerospace Inc.  (HWM)  (CIK 0000004281),8-K,2026-03-10,0001104659-26-025539:tm268347d1_ex99-1.htm,2026-04-27T22:52:38Z
collective_bargaining,ABM,ABM INDUSTRIES INC /DE/  (ABM)  (CIK 0000771497),8-K,2026-03-10,0001193125-26-099334:abm-ex99_1.htm,2026-04-27T22:52:38Z
collective_bargaining,SAVA,"FILANA THERAPEUTICS, INC.  (SAVA)  (CIK 0001069530)",8-K,2026-03-10,0001437749-26-007422:ex_929960.htm,2026-04-27T22:52:38Z
work_stoppage,RLMD,"RELMADA THERAPEUTICS, INC.  (RLMD)  (CIK 0001553643)",8-K,2026-03-09,0001213900-26-024918:ea028043601ex10-1.htm,2026-04-27T22:52:38Z
work_stoppage,VTAK,"Catheter Precision, Inc.  (VTAK)  (CIK 0001716621)",8-K,2026-03-09,0001437749-26-007380:ex_929497.htm,2026-04-27T22:52:38Z
work_stoppage,GBCS,"SELECTIS HEALTH, INC.  (GBCS)  (CIK 0000727346)",8-K,2026-03-09,0001493152-26-009320:ex10-2.htm,2026-04-27T22:52:38Z
work_stoppage,AGH,Aureus Greenway Holdings Inc  (AGH)  (CIK 0002009312),8-K,2026-03-09,0001493152-26-009265:ex2-1.htm,2026-04-27T22:52:38Z
