kind,ticker,name,form,filed,accession,captured_at
adverse_opinion,ATXG,ADDENTAX GROUP CORP.  (ATXG)  (CIK 0001650101),8-K,2026-03-25,0001493152-26-012675:form8-k.htm,2026-04-27T22:53:26Z
adverse_opinion,,BRILLIANT N.E.V. CORP.  (CIK 0001681769),8-K,2026-03-25,0001520138-26-000085:bnev-20260324_8k.htm,2026-04-27T22:53:26Z
substantial_doubt,KPTI,Karyopharm Therapeutics Inc.  (KPTI)  (CIK 0001503802),8-K,2026-03-24,0001193125-26-120770:d125009dex993.htm,2026-04-27T22:53:26Z
substantial_doubt,WKHS,Workhorse Group Inc.  (WKHS)  (CIK 0001425287),8-K/A,2026-03-24,0001213900-26-033661:ea027828901ex99-1.htm,2026-04-27T22:53:26Z
restatement,HUBG,"Hub Group, Inc.  (HUBG)  (CIK 0000940942)",8-K,2026-03-24,0001193125-26-121851:d92097dex991.htm,2026-04-27T22:53:26Z
restatement,,"AXIS CAPITAL HOLDINGS LTD  (AXS, AXS-PE)  (CIK 0001214816)",8-K,2026-03-24,0001214816-26-000120:citi_axisxamendmentagreeme.htm,2026-04-27T22:53:26Z
restatement,WKHS,Workhorse Group Inc.  (WKHS)  (CIK 0001425287),8-K/A,2026-03-24,0001213900-26-033661:ea028114701ex23-1.htm,2026-04-27T22:53:26Z
non_reliance,STI,Solidion Technology Inc.  (STI)  (CIK 0001881551),8-K,2026-03-24,0001213900-26-033616:ea0283074-8k_solidion.htm,2026-04-27T22:53:26Z
non_reliance,,"Horizon Space Acquisition II Corp.  (HSPT, HSPTR, HSPTU)  (CIK 0002032950)",8-K,2026-03-24,0001213900-26-033581:ea028319401ex10-1.htm,2026-04-27T22:53:26Z
going_concern,ASPI,ASP Isotopes Inc.  (ASPI)  (CIK 0001921865),8-K/A,2026-03-24,0001477932-26-001559:aspi_ex992.htm,2026-04-27T22:53:26Z
going_concern,WKHS,Workhorse Group Inc.  (WKHS)  (CIK 0001425287),8-K/A,2026-03-24,0001213900-26-033661:ea027828901ex99-1.htm,2026-04-27T22:53:26Z
substantial_doubt,,"Volato Group, Inc.  (SOAR, SOARW)  (CIK 0001853070)",8-K,2026-03-23,0001628280-26-020276:a2026-03x20xreceiptofconti.htm,2026-04-27T22:53:26Z
substantial_doubt,,"Crane Harbor Acquisition Corp.  (CHAC, CHACR, CHACU)  (CIK 0002054174)",8-K,2026-03-23,0001213900-26-032904:ea028273201ex99-1.htm,2026-04-27T22:53:26Z
restatement,PRGO,PERRIGO Co plc  (PRGO)  (CIK 0001585364),8-K,2026-03-23,0001585364-26-000028:perrigo-2026facilityxame.htm,2026-04-27T22:53:26Z
restatement,JAN,"Janus Living, Inc.  (JAN)  (CIK 0002100805)",8-K,2026-03-23,0001104659-26-033294:tm2533329d16_8k.htm,2026-04-27T22:53:26Z
non_reliance,SER,"Serina Therapeutics, Inc.  (SER)  (CIK 0001708599)",8-K,2026-03-23,0001708599-26-000010:ex101_serina-pipesecuritie.htm,2026-04-27T22:53:26Z
non_reliance,CNXC,Concentrix Corp  (CNXC)  (CIK 0001803599),8-K,2026-03-23,0001803599-26-000080:exhibit1010320268-k.htm,2026-04-27T22:53:26Z
non_reliance,DLTR,"DOLLAR TREE, INC.  (DLTR)  (CIK 0000935703)",8-K,2026-03-23,0000935703-26-000027:ex101creditagreementfinalv.htm,2026-04-27T22:53:26Z
going_concern,,"Volato Group, Inc.  (SOAR, SOARW)  (CIK 0001853070)",8-K,2026-03-23,0001628280-26-020276:a2026-03x20xreceiptofconti.htm,2026-04-27T22:53:26Z
going_concern,SBDS,"Solo Brands, Inc.  (SBDS)  (CIK 0001870600)",8-K,2026-03-23,0001870600-26-000012:solobrandsannounces2026fin.htm,2026-04-27T22:53:26Z
audit_opinion,PRSI,PORTSMOUTH SQUARE INC  (PRSI)  (CIK 0000079661),8-K,2026-03-23,0001493152-26-012206:form8-k.htm,2026-04-27T22:53:26Z
audit_opinion,INTG,INTERGROUP CORP  (INTG)  (CIK 0000069422),8-K,2026-03-23,0001493152-26-012210:form8-k.htm,2026-04-27T22:53:26Z
adverse_opinion,,"Volato Group, Inc.  (SOAR, SOARW)  (CIK 0001853070)",8-K,2026-03-23,0001628280-26-020276:a2026-03x20xreceiptofconti.htm,2026-04-27T22:53:26Z
valuation_allowance,,"Merlin, Inc.  (BACQ, MRLN, BACQR, BACQU)  (CIK 0002028707)",8-K,2026-03-20,0001213900-26-032329:ea028257401ex99-1.htm,2026-04-27T22:53:26Z
valuation_allowance,CEG,Constellation Energy Corp  (CEG)  (CIK 0001868275),8-K,2026-03-20,0001868275-26-000037:cpn_12312025financialsfo.htm,2026-04-27T22:53:26Z
substantial_doubt,HGTXU,HUGOTON ROYALTY TRUST  (HGTXU)  (CIK 0000862022),8-K,2026-03-20,0001193125-26-117087:hgtxu-ex99_1.htm,2026-04-27T22:53:26Z
substantial_doubt,,"Tamboran Resources Corp  (TBN, TBNRL)  (CIK 0001997652)",8-K,2026-03-20,0001628280-26-020215:trc-20260320.htm,2026-04-27T22:53:26Z
restatement,PMNT,Perfect Moment Ltd.  (PMNT)  (CIK 0001849221),8-K,2026-03-20,0001493152-26-012008:ex4-1.htm,2026-04-27T22:53:26Z
non_reliance,BHAV,BHAV Acquisition Corp  (BHAV)  (CIK 0002097288),8-K,2026-03-20,0001213900-26-032452:ea028251801ex10-5.htm,2026-04-27T22:53:26Z
non_reliance,SEI,"Solaris Energy Infrastructure, Inc.  (SEI)  (CIK 0001697500)",8-K,2026-03-20,0001193125-26-117930:d69360dex102.htm,2026-04-27T22:53:26Z
going_concern,CTNT,CHEETAH NET SUPPLY CHAIN SERVICE INC.  (CTNT)  (CIK 0001951667),8-K,2026-03-20,0001104659-26-032718:tm269395d1_ex99-1.htm,2026-04-27T22:53:26Z
going_concern,HGTXU,HUGOTON ROYALTY TRUST  (HGTXU)  (CIK 0000862022),8-K,2026-03-20,0001193125-26-117087:hgtxu-ex99_1.htm,2026-04-27T22:53:26Z
going_concern,,"Merlin, Inc.  (BACQ, MRLN, BACQR, BACQU)  (CIK 0002028707)",8-K,2026-03-20,0001213900-26-032329:ea028257401ex23-1.htm,2026-04-27T22:53:26Z
audit_opinion,ULH,"UNIVERSAL LOGISTICS HOLDINGS, INC.  (ULH)  (CIK 0001308208)",8-K,2026-03-20,0001193125-26-117665:ulh-20260316.htm,2026-04-27T22:53:26Z
audit_opinion,CFND,C1 Fund Inc.  (CFND)  (CIK 0002044327),8-K,2026-03-20,0001104659-26-032659:tm269405d1_8k.htm,2026-04-27T22:53:26Z
audit_opinion,,Overland Advantage  (CIK 0001965934),8-K,2026-03-20,0001193125-26-117288:ck0001965934-20260319.htm,2026-04-27T22:53:26Z
audit_opinion,SEZL,Sezzle Inc.  (SEZL)  (CIK 0001662991),8-K,2026-03-20,0001662991-26-000036:sezl-20260316.htm,2026-04-27T22:53:26Z
adverse_opinion,,Overland Advantage  (CIK 0001965934),8-K,2026-03-20,0001193125-26-117288:ck0001965934-ex16_1.htm,2026-04-27T22:53:26Z
adverse_opinion,,Overland Advantage  (CIK 0001965934),8-K,2026-03-20,0001193125-26-117288:ck0001965934-20260319.htm,2026-04-27T22:53:26Z
adverse_opinion,CFND,C1 Fund Inc.  (CFND)  (CIK 0002044327),8-K,2026-03-20,0001104659-26-032659:tm269405d1_8k.htm,2026-04-27T22:53:26Z
adverse_opinion,SEZL,Sezzle Inc.  (SEZL)  (CIK 0001662991),8-K,2026-03-20,0001662991-26-000036:sezl-20260316.htm,2026-04-27T22:53:26Z
valuation_allowance,DXLG,"DESTINATION XL GROUP, INC.  (DXLG)  (CIK 0000813298)",8-K,2026-03-19,0001193125-26-115168:dxlg-ex99_1.htm,2026-04-27T22:53:26Z
valuation_allowance,TITN,Titan Machinery Inc.  (TITN)  (CIK 0001409171),8-K,2026-03-19,0001628280-26-019629:titn8-kfy26q4releaseex991.htm,2026-04-27T22:53:26Z
valuation_allowance,RICK,"RCI HOSPITALITY HOLDINGS, INC.  (RICK)  (CIK 0000935419)",8-K,2026-03-19,0001628280-26-019809:ex991_pressreleasefor09302.htm,2026-04-27T22:53:26Z
valuation_allowance,SBDS,"Solo Brands, Inc.  (SBDS)  (CIK 0001870600)",8-K,2026-03-19,0001870600-26-000008:solobrands-q42025er.htm,2026-04-27T22:53:26Z
substantial_doubt,WHD,"Cactus, Inc.  (WHD)  (CIK 0001699136)",8-K/A,2026-03-19,0001628280-26-019875:exhibit991.htm,2026-04-27T22:53:26Z
substantial_doubt,LGN,Legence Corp.  (LGN)  (CIK 0002052568),8-K/A,2026-03-19,0001193125-26-114802:d122671dex991.htm,2026-04-27T22:53:26Z
restatement,DEVS,DevvStream Corp.  (DEVS)  (CIK 0001854480),8-K,2026-03-19,0001140361-26-010324:ef20068315_ex10-1.htm,2026-04-27T22:53:26Z
non_reliance,,Carvana Receivables Depositor LLC  (CIK 0001770373),8-K,2026-03-19,0001770373-26-000017:crvna2026-p1xex1010collate.htm,2026-04-27T22:53:26Z
non_reliance,LNT,ALLIANT ENERGY CORP  (LNT)  (CIK 0000352541),8-K,2026-03-19,0001193125-26-116244:d131241dex11.htm,2026-04-27T22:53:26Z
audit_opinion,,Kioni Holdings Ltd  (CIK 0002011134),8-K,2026-03-19,0002011134-26-000003:kioni260319-8k.htm,2026-04-27T22:53:26Z
audit_opinion,,VISTA CREDIT STRATEGIC LENDING CORP.  (CIK 0001919369),8-K,2026-03-19,0001193125-26-115490:ck0001919369-20260313.htm,2026-04-27T22:53:26Z
audit_opinion,INFU,"InfuSystem Holdings, Inc  (INFU)  (CIK 0001337013)",8-K,2026-03-19,0001628280-26-019649:infu-20260313.htm,2026-04-27T22:53:26Z
audit_opinion,RR,RICHTECH ROBOTICS INC.  (RR)  (CIK 0001963685),8-K,2026-03-19,0001213900-26-031889:ea0282662-8k_richtech.htm,2026-04-27T22:53:26Z
adverse_opinion,,VISTA CREDIT STRATEGIC LENDING CORP.  (CIK 0001919369),8-K,2026-03-19,0001193125-26-115490:ck0001919369-20260313.htm,2026-04-27T22:53:26Z
adverse_opinion,ULH,"UNIVERSAL LOGISTICS HOLDINGS, INC.  (ULH)  (CIK 0001308208)",8-K,2026-03-19,0001193125-26-116016:ulh-20260313.htm,2026-04-27T22:53:26Z
adverse_opinion,,Kioni Holdings Ltd  (CIK 0002011134),8-K,2026-03-19,0002011134-26-000003:kioni260319-8k.htm,2026-04-27T22:53:26Z
adverse_opinion,INFU,"InfuSystem Holdings, Inc  (INFU)  (CIK 0001337013)",8-K,2026-03-19,0001628280-26-019649:infu-20260313.htm,2026-04-27T22:53:26Z
adverse_opinion,,"Better Home & Finance Holding Co  (BETR, BETRW)  (CIK 0001835856)",8-K,2026-03-19,0001628280-26-019820:betr-20260316.htm,2026-04-27T22:53:26Z
adverse_opinion,RR,RICHTECH ROBOTICS INC.  (RR)  (CIK 0001963685),8-K,2026-03-19,0001213900-26-031889:ea0282662-8k_richtech.htm,2026-04-27T22:53:26Z
valuation_allowance,,"Sachem Capital Corp.  (SACH, SCCD, SCCE, SCCF, SCCG, SACH-PA)  (CIK 0001682220)",8-K,2026-03-18,0001682220-26-000018:sach-8kxex991.htm,2026-04-27T22:53:26Z
substantial_doubt,,"Stardust Power Inc.  (SDST, SDSTW)  (CIK 0001831979)",8-K,2026-03-18,0001493152-26-010634:ex99-1.htm,2026-04-27T22:53:26Z
substantial_doubt,TNXP,Tonix Pharmaceuticals Holding Corp.  (TNXP)  (CIK 0001430306),8-K,2026-03-18,0001999371-26-006169:tonix-8k_031826.htm,2026-04-27T22:53:26Z
substantial_doubt,NSPR,"InspireMD, Inc.  (NSPR)  (CIK 0001433607)",8-K,2026-03-18,0001493152-26-010791:ex99-1.htm,2026-04-27T22:53:26Z
restatement,AIB,"BlockchAIn Digital Infrastructure, Inc.  (AIB)  (CIK 0002070542)",8-K,2026-03-18,0001213900-26-030956:ea028152001ex99-5.htm,2026-04-27T22:53:26Z
restatement,ACNB,ACNB CORP  (ACNB)  (CIK 0000715579),8-K,2026-03-18,0001628280-26-019066:formofacnbbankvariablecomp.htm,2026-04-27T22:53:26Z
restatement,FCN,"FTI CONSULTING, INC  (FCN)  (CIK 0000887936)",8-K,2026-03-18,0001193125-26-114160:fcn-ex10_1.htm,2026-04-27T22:53:26Z
restatement,UUUU,ENERGY FUELS INC  (UUUU)  (CIK 0001385849),8-K,2026-03-18,0001062993-26-001527:form8k.htm,2026-04-27T22:53:26Z
restatement,,John Deere Receivables LLC  (CIK 0001762590),8-K,2026-03-18,0001104659-26-030423:tmb-20260318xex5d2.htm,2026-04-27T22:53:26Z
restatement,PFSI,"PennyMac Financial Services, Inc.  (PFSI)  (CIK 0001745916)",8-K,2026-03-18,0001104659-26-031062:tm269200d1_8k.htm,2026-04-27T22:53:26Z
non_reliance,EXLS,"ExlService Holdings, Inc.  (EXLS)  (CIK 0001297989)",8-K,2026-03-18,0001104659-26-030831:tm269205d1_ex10-1.htm,2026-04-27T22:53:26Z
non_reliance,PSX,Phillips 66  (PSX)  (CIK 0001534701),8-K,2026-03-18,0001193125-26-114070:d20718dex101.htm,2026-04-27T22:53:26Z
going_concern,,"Stardust Power Inc.  (SDST, SDSTW)  (CIK 0001831979)",8-K,2026-03-18,0001493152-26-010634:ex99-1.htm,2026-04-27T22:53:26Z
audit_opinion,GDRX,"GoodRx Holdings, Inc.  (GDRX)  (CIK 0001809519)",8-K,2026-03-18,0001809519-26-000059:gdrx-20260314.htm,2026-04-27T22:53:26Z
audit_opinion,RYN,RAYONIER INC  (RYN)  (CIK 0000052827),8-K,2026-03-18,0000052827-26-000047:ryn-20260312.htm,2026-04-27T22:53:26Z
audit_opinion,ECG,"Everus Construction Group, Inc.  (ECG)  (CIK 0002015845)",8-K/A,2026-03-18,0002015845-26-000012:ecg-20260114.htm,2026-04-27T22:53:26Z
audit_opinion,TNXP,Tonix Pharmaceuticals Holding Corp.  (TNXP)  (CIK 0001430306),8-K,2026-03-18,0001999371-26-006169:tonix-8k_031826.htm,2026-04-27T22:53:26Z
adverse_opinion,GDRX,"GoodRx Holdings, Inc.  (GDRX)  (CIK 0001809519)",8-K,2026-03-18,0001809519-26-000059:gdrx-20260314.htm,2026-04-27T22:53:26Z
adverse_opinion,RYN,RAYONIER INC  (RYN)  (CIK 0000052827),8-K,2026-03-18,0000052827-26-000047:ryn-20260312.htm,2026-04-27T22:53:26Z
adverse_opinion,ECG,"Everus Construction Group, Inc.  (ECG)  (CIK 0002015845)",8-K/A,2026-03-18,0002015845-26-000012:ecg-20260114.htm,2026-04-27T22:53:26Z
adverse_opinion,TNXP,Tonix Pharmaceuticals Holding Corp.  (TNXP)  (CIK 0001430306),8-K,2026-03-18,0001999371-26-006169:tonix-8k_031826.htm,2026-04-27T22:53:26Z
substantial_doubt,INR,"INFINITY NATURAL RESOURCES, INC.  (INR)  (CIK 0002029118)",8-K/A,2026-03-17,0001193125-26-109459:d106339dex991.htm,2026-04-27T22:53:26Z
substantial_doubt,INR,"INFINITY NATURAL RESOURCES, INC.  (INR)  (CIK 0002029118)",8-K/A,2026-03-17,0001193125-26-109459:d106339dex992.htm,2026-04-27T22:53:26Z
restatement,EZRA,"Reliance Global Group, Inc.  (EZRA)  (CIK 0001812727)",8-K,2026-03-17,0001493152-26-010622:form8-k.htm,2026-04-27T22:53:26Z
restatement,TASK,"TaskUs, Inc.  (TASK)  (CIK 0001829864)",8-K,2026-03-17,0001193125-26-111007:d15654dex101.htm,2026-04-27T22:53:26Z
restatement,NFE,New Fortress Energy Inc.  (NFE)  (CIK 0001749723),8-K,2026-03-17,0001749723-26-000008:nfe-20260315.htm,2026-04-27T22:53:26Z
non_reliance,NFE,New Fortress Energy Inc.  (NFE)  (CIK 0001749723),8-K,2026-03-17,0001749723-26-000008:nfe-20260315.htm,2026-04-27T22:53:26Z
non_reliance,RKLB,Rocket Lab Corp  (RKLB)  (CIK 0001819994),8-K,2026-03-17,0001628280-26-018789:exhibit11-8xk.htm,2026-04-27T22:53:26Z
going_concern,ARTL,"ARTELO BIOSCIENCES, INC.  (ARTL)  (CIK 0001621221)",8-K,2026-03-17,0001640334-26-000461:artl_ex991.htm,2026-04-27T22:53:26Z
audit_opinion,,"Priority Technology Holdings, Inc.  (PRTH, PRTHU)  (CIK 0001653558)",8-K,2026-03-17,0001653558-26-000070:prth-20260311.htm,2026-04-27T22:53:26Z
audit_opinion,KRT,Karat Packaging Inc.  (KRT)  (CIK 0001758021),8-K,2026-03-17,0001758021-26-000012:krt-20260313.htm,2026-04-27T22:53:26Z
adverse_opinion,STEM,"STEM, INC.  (STEM)  (CIK 0001758766)",8-K,2026-03-17,0001758766-26-000031:stem-20260312.htm,2026-04-27T22:53:26Z
adverse_opinion,,"Priority Technology Holdings, Inc.  (PRTH, PRTHU)  (CIK 0001653558)",8-K,2026-03-17,0001653558-26-000070:prth-20260311.htm,2026-04-27T22:53:26Z
adverse_opinion,KRT,Karat Packaging Inc.  (KRT)  (CIK 0001758021),8-K,2026-03-17,0001758021-26-000012:krt-20260313.htm,2026-04-27T22:53:26Z
valuation_allowance,BFC,Bank First Corp  (BFC)  (CIK 0001746109),8-K/A,2026-03-16,0001104659-26-028511:tm268766d1_ex99-2.htm,2026-04-27T22:53:26Z
substantial_doubt,OTLK,"Outlook Therapeutics, Inc.  (OTLK)  (CIK 0001649989)",8-K,2026-03-16,0001104659-26-028103:tm268874d1_ex99-1.htm,2026-04-27T22:53:26Z
restatement,FLNC,"Fluence Energy, Inc.  (FLNC)  (CIK 0001868941)",8-K,2026-03-16,0001868941-26-000008:flnc-20260312.htm,2026-04-27T22:53:26Z
restatement,ALSN,Allison Transmission Holdings Inc  (ALSN)  (CIK 0001411207),8-K/A,2026-03-16,0001193125-26-106549:d114759dex231.htm,2026-04-27T22:53:26Z
non_reliance,SSM,Sono Group N.V.  (SSM)  (CIK 0001840416),8-K,2026-03-16,0001171843-26-001589:exh_102.htm,2026-04-27T22:53:26Z
non_reliance,NHI,NATIONAL HEALTH INVESTORS INC  (NHI)  (CIK 0000877860),8-K,2026-03-16,0001193125-26-108666:d114456dex991.htm,2026-04-27T22:53:26Z
going_concern,OTLK,"Outlook Therapeutics, Inc.  (OTLK)  (CIK 0001649989)",8-K,2026-03-16,0001104659-26-028103:tm268874d1_ex99-1.htm,2026-04-27T22:53:26Z
going_concern,CUE,"Cue Biopharma, Inc.  (CUE)  (CIK 0001645460)",8-K,2026-03-16,0001193125-26-108292:cue-ex99_1.htm,2026-04-27T22:53:26Z
audit_opinion,AMTX,"AEMETIS, INC  (AMTX)  (CIK 0000738214)",8-K,2026-03-16,0001437749-26-008426:amtx20260312_8k.htm,2026-04-27T22:53:26Z
adverse_opinion,AMTX,"AEMETIS, INC  (AMTX)  (CIK 0000738214)",8-K,2026-03-16,0001437749-26-008426:amtx20260312_8k.htm,2026-04-27T22:53:26Z
substantial_doubt,QNST,"QUINSTREET, INC  (QNST)  (CIK 0001117297)",8-K/A,2026-03-13,0001193125-26-105702:qnst-ex99_1.htm,2026-04-27T22:53:26Z
substantial_doubt,QCLS,"Q/C TECHNOLOGIES, INC.  (QCLS)  (CIK 0001321834)",8-K,2026-03-13,0001493152-26-010070:form8-k.htm,2026-04-27T22:53:26Z
substantial_doubt,AZTR,"Azitra, Inc.  (AZTR)  (CIK 0001701478)",8-K,2026-03-13,0001493152-26-010108:ex99-1.htm,2026-04-27T22:53:26Z
restatement,WMK,WEIS MARKETS INC  (WMK)  (CIK 0000105418),8-K,2026-03-13,0000105418-26-000028:wmk-20260312xex99d1.htm,2026-04-27T22:53:26Z
restatement,SNWV,"SANUWAVE Health, Inc.  (SNWV)  (CIK 0001417663)",8-K,2026-03-13,0001628280-26-017735:snwv-20260313.htm,2026-04-27T22:53:26Z
non_reliance,SNWV,"SANUWAVE Health, Inc.  (SNWV)  (CIK 0001417663)",8-K,2026-03-13,0001628280-26-017735:snwv-20260313.htm,2026-04-27T22:53:26Z
non_reliance,,"Chiron Real Estate Inc.  (XRN, GMRE, XRN-PA, XRN-PB)  (CIK 0001533615)",8-K,2026-03-13,0001104659-26-027195:tm268627d1_ex99-1.htm,2026-04-27T22:53:26Z
going_concern,QNST,"QUINSTREET, INC  (QNST)  (CIK 0001117297)",8-K/A,2026-03-13,0001193125-26-105702:qnst-ex99_1.htm,2026-04-27T22:53:26Z
going_concern,QCLS,"Q/C TECHNOLOGIES, INC.  (QCLS)  (CIK 0001321834)",8-K,2026-03-13,0001493152-26-010070:form8-k.htm,2026-04-27T22:53:26Z
going_concern,AZTR,"Azitra, Inc.  (AZTR)  (CIK 0001701478)",8-K,2026-03-13,0001493152-26-010108:ex99-1.htm,2026-04-27T22:53:26Z
going_concern,OPITQ,OFFICE PROPERTIES INCOME TRUST  (OPITQ)  (CIK 0001456772),8-K,2026-03-13,0001104659-26-027749:tm268341d1_ex99-1.htm,2026-04-27T22:53:26Z
audit_opinion,AZTR,"Azitra, Inc.  (AZTR)  (CIK 0001701478)",8-K,2026-03-13,0001493152-26-010108:ex99-1.htm,2026-04-27T22:53:26Z
audit_opinion,UPLD,"Upland Software, Inc.  (UPLD)  (CIK 0001505155)",8-K,2026-03-13,0001505155-26-000009:upld-20260309.htm,2026-04-27T22:53:26Z
audit_opinion,BRCB,"Black Rock Coffee Bar, Inc.  (BRCB)  (CIK 0002068577)",8-K,2026-03-13,0001628280-26-017737:brcb-20260312.htm,2026-04-27T22:53:26Z
audit_opinion,QCLS,"Q/C TECHNOLOGIES, INC.  (QCLS)  (CIK 0001321834)",8-K,2026-03-13,0001493152-26-010070:form8-k.htm,2026-04-27T22:53:26Z
audit_opinion,AMPY,Amplify Energy Corp.  (AMPY)  (CIK 0001533924),8-K/A,2026-03-13,0001104659-26-027245:tm268668d1_8ka.htm,2026-04-27T22:53:26Z
adverse_opinion,AMPY,Amplify Energy Corp.  (AMPY)  (CIK 0001533924),8-K/A,2026-03-13,0001104659-26-027245:tm268668d1_8ka.htm,2026-04-27T22:53:26Z
adverse_opinion,UPLD,"Upland Software, Inc.  (UPLD)  (CIK 0001505155)",8-K,2026-03-13,0001505155-26-000009:upld-20260309.htm,2026-04-27T22:53:26Z
adverse_opinion,BRCB,"Black Rock Coffee Bar, Inc.  (BRCB)  (CIK 0002068577)",8-K,2026-03-13,0001628280-26-017737:brcb-20260312.htm,2026-04-27T22:53:26Z
adverse_opinion,QCLS,"Q/C TECHNOLOGIES, INC.  (QCLS)  (CIK 0001321834)",8-K,2026-03-13,0001493152-26-010070:form8-k.htm,2026-04-27T22:53:26Z
valuation_allowance,FNKO,"Funko, Inc.  (FNKO)  (CIK 0001704711)",8-K,2026-03-12,0001704711-26-000018:q42025earningspresentati.htm,2026-04-27T22:53:26Z
valuation_allowance,CRMT,AMERICAS CARMART INC  (CRMT)  (CIK 0000799850),8-K,2026-03-12,0001171843-26-001507:exh_991.htm,2026-04-27T22:53:26Z
valuation_allowance,FNKO,"Funko, Inc.  (FNKO)  (CIK 0001704711)",8-K,2026-03-12,0001704711-26-000018:ex-99131226.htm,2026-04-27T22:53:26Z
valuation_allowance,,"United Homes Group, Inc.  (UHG, UHGWW)  (CIK 0001830188)",8-K,2026-03-12,0001830188-26-000006:uhg-fy2025xex99x1.htm,2026-04-27T22:53:26Z
substantial_doubt,CRCW,Crypto Co  (CRCW)  (CIK 0001688126),8-K,2026-03-12,0001493152-26-009847:form8-k.htm,2026-04-27T22:53:26Z
substantial_doubt,USAR,"USA Rare Earth, Inc.  (USAR)  (CIK 0001970622)",8-K,2026-03-12,0001213900-26-026632:ea028094201ex99-1.htm,2026-04-27T22:53:26Z
restatement,IMMR,IMMERSION CORP  (IMMR)  (CIK 0001058811),8-K,2026-03-12,0001193125-26-103330:immr-20260312.htm,2026-04-27T22:53:26Z
restatement,GNE,Genie Energy Ltd.  (GNE)  (CIK 0001528356),8-K,2026-03-12,0001437749-26-007981:gne20260312_8k.htm,2026-04-27T22:53:26Z
restatement,JYNT,JOINT Corp  (JYNT)  (CIK 0001612630),8-K,2026-03-12,0001612630-26-000018:jyntq42025resultsdeckfin.htm,2026-04-27T22:53:26Z
restatement,JYNT,JOINT Corp  (JYNT)  (CIK 0001612630),8-K,2026-03-12,0001612630-26-000018:a26-03x12jyntq4x25release.htm,2026-04-27T22:53:26Z
non_reliance,GNE,Genie Energy Ltd.  (GNE)  (CIK 0001528356),8-K,2026-03-12,0001437749-26-007981:gne20260312_8k.htm,2026-04-27T22:53:26Z
non_reliance,ORLY,O REILLY AUTOMOTIVE INC  (ORLY)  (CIK 0000898173),8-K,2026-03-12,0001104659-26-027054:tm265973d5_ex5-2.htm,2026-04-27T22:53:26Z
non_reliance,,Carvana Receivables Depositor LLC  (CIK 0001770373),8-K,2026-03-12,0001770373-26-000013:crvna2026-p1xex1010formofc.htm,2026-04-27T22:53:26Z
non_reliance,CRM,"Salesforce, Inc.  (CRM)  (CIK 0001108524)",8-K,2026-03-12,0001193125-26-104282:d887348dex101.htm,2026-04-27T22:53:26Z
going_concern,,"BuzzFeed, Inc.  (BZFD, BZFDW)  (CIK 0001828972)",8-K,2026-03-12,0001828972-26-000025:exhibit991q42025.htm,2026-04-27T22:53:26Z
going_concern,LSF,"Laird Superfood, Inc.  (LSF)  (CIK 0001650696)",8-K,2026-03-12,0001437749-26-007994:ex_931572.htm,2026-04-27T22:53:26Z
audit_opinion,,ALEXANDER TECH CORP  (CIK 0001347491),8-K,2026-03-12,0001347491-26-000003:form8k.htm,2026-04-27T22:53:26Z
audit_opinion,CRCW,Crypto Co  (CRCW)  (CIK 0001688126),8-K,2026-03-12,0001493152-26-009847:form8-k.htm,2026-04-27T22:53:26Z
audit_opinion,,"Angel Oak Mortgage REIT, Inc.  (AOMD, AOMN, AOMR)  (CIK 0001766478)",8-K,2026-03-12,0001766478-26-000005:aomr-20260309.htm,2026-04-27T22:53:26Z
audit_opinion,FLYE,"Fly-E Group, Inc.  (FLYE)  (CIK 0001975940)",8-K,2026-03-12,0001213900-26-027059:ea0280736-8k_fly.htm,2026-04-27T22:53:26Z
adverse_opinion,,ALEXANDER TECH CORP  (CIK 0001347491),8-K,2026-03-12,0001347491-26-000003:form8k.htm,2026-04-27T22:53:26Z
adverse_opinion,CRCW,Crypto Co  (CRCW)  (CIK 0001688126),8-K,2026-03-12,0001493152-26-009847:form8-k.htm,2026-04-27T22:53:26Z
adverse_opinion,,"Angel Oak Mortgage REIT, Inc.  (AOMD, AOMN, AOMR)  (CIK 0001766478)",8-K,2026-03-12,0001766478-26-000005:aomr-20260309.htm,2026-04-27T22:53:26Z
adverse_opinion,FLYE,"Fly-E Group, Inc.  (FLYE)  (CIK 0001975940)",8-K,2026-03-12,0001213900-26-027059:ea0280736-8k_fly.htm,2026-04-27T22:53:26Z
valuation_allowance,TLYS,"TILLY'S, INC.  (TLYS)  (CIK 0001524025)",8-K,2026-03-11,0001628280-26-016801:q4fy2025earningsrelease.htm,2026-04-27T22:53:26Z
valuation_allowance,DSP,Viant Technology Inc.  (DSP)  (CIK 0001828791),8-K,2026-03-11,0001828791-26-000018:dsp-20260311xexx991.htm,2026-04-27T22:53:26Z
valuation_allowance,TG,TREDEGAR CORP  (TG)  (CIK 0000850429),8-K,2026-03-11,0001628280-26-016666:tg-20251231xearningsrelease.htm,2026-04-27T22:53:26Z
valuation_allowance,FTK,FLOTEK INDUSTRIES INC/CN/  (FTK)  (CIK 0000928054),8-K,2026-03-11,0000928054-26-000018:ex991-q42025.htm,2026-04-27T22:53:26Z
substantial_doubt,,"GalaxyEdge Acquisition Corp  (GLED, GLED-UN)  (CIK 0002091484)",8-K,2026-03-11,0001829126-26-002201:galaxyedge_ex99-1.htm,2026-04-27T22:53:26Z
substantial_doubt,KGS,"Kodiak Gas Services, Inc.  (KGS)  (CIK 0001767042)",8-K,2026-03-11,0001193125-26-101175:d84764dex992.htm,2026-04-27T22:53:26Z
substantial_doubt,,"System1, Inc.  (SST, SSTPW)  (CIK 0001805833)",8-K,2026-03-11,0001805833-26-000012:q42025-ex991pressrelease.htm,2026-04-27T22:53:26Z
restatement,DRVN,Driven Brands Holdings Inc.  (DRVN)  (CIK 0001804745),8-K,2026-03-11,0001804745-26-000023:a41driven-amendmentno1to.htm,2026-04-27T22:53:26Z
restatement,BLBD,Blue Bird Corp  (BLBD)  (CIK 0001589526),8-K,2026-03-11,0001589526-26-000013:blbd-20260311.htm,2026-04-27T22:53:26Z
restatement,RLAY,"Relay Therapeutics, Inc.  (RLAY)  (CIK 0001812364)",8-K,2026-03-11,0001193125-26-102178:rlay-20260306.htm,2026-04-27T22:53:26Z
going_concern,,"GalaxyEdge Acquisition Corp  (GLED, GLED-UN)  (CIK 0002091484)",8-K,2026-03-11,0001829126-26-002201:galaxyedge_ex99-1.htm,2026-04-27T22:53:26Z
audit_opinion,DIOD,DIODES INC /DEL/  (DIOD)  (CIK 0000029002),8-K,2026-03-11,0001193125-26-102267:diod-20260305.htm,2026-04-27T22:53:26Z
adverse_opinion,DIOD,DIODES INC /DEL/  (DIOD)  (CIK 0000029002),8-K,2026-03-11,0001193125-26-102267:diod-20260305.htm,2026-04-27T22:53:26Z
valuation_allowance,TACT,TRANSACT TECHNOLOGIES INC  (TACT)  (CIK 0001017303),8-K,2026-03-10,0001214659-26-003070:ex99_1.htm,2026-04-27T22:53:26Z
valuation_allowance,CR,Crane Co  (CR)  (CIK 0001944013),8-K/A,2026-03-10,0001944013-26-000114:precisionsensorsandinstr.htm,2026-04-27T22:53:26Z
valuation_allowance,CVGI,"Commercial Vehicle Group, Inc.  (CVGI)  (CIK 0001290900)",8-K,2026-03-10,0001628280-26-016513:cvgq42025earningsrelease.htm,2026-04-27T22:53:26Z
substantial_doubt,CR,Crane Co  (CR)  (CIK 0001944013),8-K/A,2026-03-10,0001944013-26-000114:precisionsensorsandinstr.htm,2026-04-27T22:53:26Z
substantial_doubt,DY,DYCOM INDUSTRIES INC  (DY)  (CIK 0000067215),8-K/A,2026-03-10,0001193125-26-099470:d72789dex991.htm,2026-04-27T22:53:26Z
restatement,INSE,"Inspired Entertainment, Inc.  (INSE)  (CIK 0001615063)",8-K,2026-03-10,0001493152-26-009439:ex99-1.htm,2026-04-27T22:53:26Z
restatement,ZEC,Grayscale Zcash Trust (ZEC)  (ZCSH)  (CIK 0001720265),8-K,2026-03-10,0001193125-26-100136:zcsh-ex4_1.htm,2026-04-27T22:53:26Z
non_reliance,,"Amcor plc  (AMCR, AMCCD)  (CIK 0001748790)",8-K,2026-03-10,0001104659-26-025811:tm268286d1_ex5-4.htm,2026-04-27T22:53:26Z
non_reliance,CLX,CLOROX CO /DE/  (CLX)  (CIK 0000021076),8-K,2026-03-10,0001206774-26-000133:clx4605211-ex102.htm,2026-04-27T22:53:26Z
non_reliance,CLX,CLOROX CO /DE/  (CLX)  (CIK 0000021076),8-K,2026-03-10,0001206774-26-000133:clx4605211-ex101.htm,2026-04-27T22:53:26Z
audit_opinion,STQN,STRATEGIC ACQUISITIONS INC /NV/  (STQN)  (CIK 0000847942),8-K,2026-03-10,0001493152-26-009525:form8-k.htm,2026-04-27T22:53:26Z
valuation_allowance,RAIL,"FreightCar America, Inc.  (RAIL)  (CIK 0001320854)",8-K,2026-03-09,0001193125-26-098650:rail-ex99_1.htm,2026-04-27T22:53:26Z
valuation_allowance,KRO,KRONOS WORLDWIDE INC  (KRO)  (CIK 0001257640),8-K,2026-03-09,0001257640-26-000008:kro-20260309xex99d1.htm,2026-04-27T22:53:26Z
valuation_allowance,NL,NL INDUSTRIES INC  (NL)  (CIK 0000072162),8-K,2026-03-09,0000072162-26-000009:nl-20260309xex99d1.htm,2026-04-27T22:53:26Z
valuation_allowance,DAWN,"Day One Biopharmaceuticals, Inc.  (DAWN)  (CIK 0001845337)",8-K/A,2026-03-09,0001193125-26-098851:dawn-ex99_4.htm,2026-04-27T22:53:26Z
substantial_doubt,,PRESIDIO PRODUCTION Co  (CIK 0002083125),8-K,2026-03-09,0001213900-26-025222:ea027961701ex99-10.htm,2026-04-27T22:53:26Z
