kind,ticker,name,form,filed,accession,captured_at
workforce_reduction,HCAT,"Health Catalyst, Inc.  (HCAT)  (CIK 0001636422)",8-K,2026-04-27,0001636422-26-000045:hcat-20260424.htm,2026-04-27T22:51:35Z
workforce_reduction,VZ,VERIZON COMMUNICATIONS INC  (VZ)  (CIK 0000732712),8-K,2026-04-27,0000732712-26-000019:vz-20260427.htm,2026-04-27T22:51:35Z
layoffs,UHT,UNIVERSAL HEALTH REALTY INCOME TRUST  (UHT)  (CIK 0000798783),8-K,2026-04-27,0001193125-26-182162:uht-ex99_1.htm,2026-04-27T22:51:35Z
layoffs,ELSE,ELECTRO SENSORS INC  (ELSE)  (CIK 0000351789),8-K/A,2026-04-27,0000897101-26-000148:a04242026_ex2-1.htm,2026-04-27T22:51:35Z
layoffs,,"XOMA Royalty Corp  (XOMA, XOMAO, XOMAP)  (CIK 0000791908)",8-K,2026-04-27,0001193125-26-179085:d139894dex21.htm,2026-04-27T22:51:35Z
layoffs,,"LIGAND PHARMACEUTICALS INC  (LGND, LGNDZ, LGNXZ, LGNYZ, LGNZZ)  (CIK 0000886163)",8-K,2026-04-27,0001193125-26-179529:d143046dex21.htm,2026-04-27T22:51:35Z
facility_closure,RMBS,RAMBUS INC  (RMBS)  (CIK 0000917273),8-K,2026-04-27,0001193125-26-182076:rmbs-ex99_1.htm,2026-04-27T22:51:35Z
reduction_in_force,PEBO,PEOPLES BANCORP INC  (PEBO)  (CIK 0000318300),8-K,2026-04-24,0000318300-26-000145:exhibit21.htm,2026-04-27T22:51:35Z
layoffs,HLX,HELIX ENERGY SOLUTIONS GROUP INC  (HLX)  (CIK 0000866829),8-K,2026-04-24,0001140361-26-016767:ef20071301_ex2-1.htm,2026-04-27T22:51:35Z
facility_closure,,"MOOG INC.  (MOG-A, MOG-B)  (CIK 0000067887)",8-K,2026-04-24,0001628280-26-027030:ex991-42426.htm,2026-04-27T22:51:35Z
workforce_reduction,DOW,DOW INC.  (DOW)  (CIK 0001751788),8-K,2026-04-23,0001751788-26-000131:exhibit991enrschedules1q26.htm,2026-04-27T22:51:35Z
workforce_reduction,,"Rexford Industrial Realty, Inc.  (REXR, REXR-PB, REXR-PC)  (CIK 0001571283)",8-K,2026-04-23,0001571283-26-000017:rexrex991q1-2026.htm,2026-04-27T22:51:35Z
workforce_reduction,,"Rexford Industrial Realty, Inc.  (REXR, REXR-PB, REXR-PC)  (CIK 0001571283)",8-K,2026-04-23,0001571283-26-000017:rexrex992q1-2026.htm,2026-04-27T22:51:35Z
workforce_reduction,,"Athena Technology Acquisition Corp. II  (ATEK, ATEKU, ATEKW)  (CIK 0001882198)",8-K,2026-04-23,0001213900-26-047101:ea028748701ex10-1.htm,2026-04-27T22:51:35Z
restructuring,,"ConnectOne Bancorp, Inc.  (CNOB, CNOBP)  (CIK 0000712771)",8-K,2026-04-23,0001437749-26-013080:ex_924680.htm,2026-04-27T22:51:35Z
restructuring,,"VALLEY NATIONAL BANCORP  (VLY, VLYPN, VLYPO, VLYPP)  (CIK 0000714310)",8-K,2026-04-23,0000714310-26-000020:a1q26earningspresentatio.htm,2026-04-27T22:51:35Z
restructuring,,"VALLEY NATIONAL BANCORP  (VLY, VLYPN, VLYPO, VLYPP)  (CIK 0000714310)",8-K,2026-04-23,0000714310-26-000020:exhibit991earningsrelease0.htm,2026-04-27T22:51:35Z
restructuring,UVSP,UNIVEST FINANCIAL Corp  (UVSP)  (CIK 0000102212),8-K,2026-04-23,0000102212-26-000022:exhibit991earningsrelease3.htm,2026-04-27T22:51:35Z
restructuring,MXL,"MAXLINEAR, INC  (MXL)  (CIK 0001288469)",8-K,2026-04-23,0001288469-26-000027:a03312026exhibit1001.htm,2026-04-27T22:51:35Z
layoffs,AXP,AMERICAN EXPRESS CO  (AXP)  (CIK 0000004962),8-K,2026-04-23,0000004962-26-000188:axp-20260423.htm,2026-04-27T22:51:35Z
layoffs,AXP,AMERICAN EXPRESS CO  (AXP)  (CIK 0000004962),8-K,2026-04-23,0000004962-26-000188:q126exhibit991.htm,2026-04-27T22:51:35Z
layoffs,,"Athena Technology Acquisition Corp. II  (ATEK, ATEKU, ATEKW)  (CIK 0001882198)",8-K,2026-04-23,0001213900-26-047101:ea028748701ex10-1.htm,2026-04-27T22:51:35Z
workforce_reduction,LUV,SOUTHWEST AIRLINES CO  (LUV)  (CIK 0000092380),8-K,2026-04-22,0000092380-26-000044:er-3312026xerdoc.htm,2026-04-27T22:51:35Z
workforce_reduction,CCI,CROWN CASTLE INC.  (CCI)  (CIK 0001051470),8-K,2026-04-22,0001051470-26-000046:q12026earningsrelease.htm,2026-04-27T22:51:35Z
restructuring,URI,"UNITED RENTALS, INC.  (URI)  (CIK 0001067701)",8-K,2026-04-22,0001067701-26-000018:uri-3312026xex991.htm,2026-04-27T22:51:35Z
reduction_in_force,CBFV,"CB Financial Services, Inc.  (CBFV)  (CIK 0001605301)",8-K,2026-04-22,0001605301-26-000018:a20260331ex9911stqtrearnin.htm,2026-04-27T22:51:35Z
layoffs,,"Iron Horse Acquisition II Corp.  (IRHO, IRHOR, IRHOU)  (CIK 0002051985)",8-K,2026-04-22,0001213900-26-046611:ea028718501ex2-1.htm,2026-04-27T22:51:35Z
facility_closure,AMRX,"Amneal Pharmaceuticals, Inc.  (AMRX)  (CIK 0001723128)",8-K,2026-04-22,0001193125-26-168231:d126526dex991.htm,2026-04-27T22:51:35Z
workforce_reduction,MVIS,"MICROVISION, INC.  (MVIS)  (CIK 0000065770)",8-K/A,2026-04-21,0001493152-26-018360:ex99-1.htm,2026-04-27T22:51:35Z
restructuring,,"Synchrony Financial  (SYF, SYF-PA, SYF-PB)  (CIK 0001601712)",8-K,2026-04-21,0001601712-26-000013:a1q26earningspresentatio.htm,2026-04-27T22:51:35Z
reduction_in_force,,"SOUNDHOUND AI, INC.  (SOUN, SOUNW)  (CIK 0001840856)",8-K,2026-04-21,0001213900-26-045987:ea028711701ex2-1.htm,2026-04-27T22:51:35Z
layoffs,BRC,BRADY CORP  (BRC)  (CIK 0000746598),8-K,2026-04-21,0000746598-26-000014:exhibit21equitypurchaseagr.htm,2026-04-27T22:51:35Z
layoffs,,"SOUNDHOUND AI, INC.  (SOUN, SOUNW)  (CIK 0001840856)",8-K,2026-04-21,0001213900-26-045987:ea028711701ex2-1.htm,2026-04-27T22:51:35Z
layoffs,PCOK,"Pacific Oak Strategic Opportunity REIT, Inc.  (PCOK)  (CIK 0001452936)",8-K,2026-04-21,0001452936-26-000021:pacificoak-q42025reportx.htm,2026-04-27T22:51:35Z
workforce_reduction,BCYC,BICYCLE THERAPEUTICS PLC  (BCYC)  (CIK 0001761612),8-K,2026-04-20,0001104659-26-045198:tm2612166d1_ex99-1.htm,2026-04-27T22:51:35Z
reduction_in_force,,"Archimedes Tech SPAC Partners II Co.  (ATII, ATIIU, ATIIW)  (CIK 0002028516)",8-K,2026-04-20,0001437749-26-012856:ex_947688.htm,2026-04-27T22:51:35Z
layoffs,SILA,"Sila Realty Trust, Inc.  (SILA)  (CIK 0001567925)",8-K,2026-04-20,0001140361-26-015496:ef20070982_ex2-1.htm,2026-04-27T22:51:35Z
facility_closure,,"Archimedes Tech SPAC Partners II Co.  (ATII, ATIIU, ATIIW)  (CIK 0002028516)",8-K,2026-04-20,0001437749-26-012856:ex_947688.htm,2026-04-27T22:51:35Z
reduction_in_force,PLRX,"PLIANT THERAPEUTICS, INC.  (PLRX)  (CIK 0001746473)",8-K,2026-04-17,0001746473-26-000050:plrx-20260414.htm,2026-04-27T22:51:35Z
layoffs,,"QVC Group, Inc.  (QVCGA, QVCGB, QVCGP)  (CIK 0001355096)",8-K,2026-04-17,0001104659-26-044521:tm2611635d1_ex99-2.htm,2026-04-27T22:51:35Z
workforce_reduction,CDNA,"CareDx, Inc.  (CDNA)  (CIK 0001217234)",8-K,2026-04-16,0001104659-26-043970:tm2611749d1_ex2-1.htm,2026-04-27T22:51:35Z
restructuring,MDXG,"MIMEDX GROUP, INC.  (MDXG)  (CIK 0001376339)",8-K,2026-04-16,0001376339-26-000021:ex-991restructuringpress.htm,2026-04-27T22:51:35Z
workforce_reduction,ABUS,Arbutus Biopharma Corp  (ABUS)  (CIK 0001447028),8-K,2026-04-15,0001171843-26-002458:exh_991.htm,2026-04-27T22:51:35Z
layoffs,LDOS,"Leidos Holdings, Inc.  (LDOS)  (CIK 0001336920)",8-K,2026-04-15,0001193125-26-155884:d148240dex21.htm,2026-04-27T22:51:35Z
layoffs,,"SPIRE INC  (SR, SRJN)  (CIK 0001126956)",8-K,2026-04-15,0001193125-26-155936:sr-ex10_1.htm,2026-04-27T22:51:35Z
workforce_reduction,SPOK,"Spok Holdings, Inc  (SPOK)  (CIK 0001289945)",8-K,2026-04-14,0001104659-26-043198:tm2611823d1_ex99-1.htm,2026-04-27T22:51:35Z
workforce_reduction,DOW,DOW INC.  (DOW)  (CIK 0001751788),8-K,2026-04-14,0001193125-26-153769:d103960dex991.htm,2026-04-27T22:51:35Z
workforce_reduction,KMX,CARMAX INC  (KMX)  (CIK 0001170010),8-K,2026-04-14,0001170010-26-000017:q4fy26earningsrelease.htm,2026-04-27T22:51:35Z
restructuring,CRWV,"CoreWeave, Inc.  (CRWV)  (CIK 0001769628)",8-K,2026-04-14,0001769628-26-000164:ex41.htm,2026-04-27T22:51:35Z
layoffs,SAFX,"XCF Global, Inc.  (SAFX)  (CIK 0002019793)",8-K,2026-04-14,0001493152-26-016438:ex2-1.htm,2026-04-27T22:51:35Z
layoffs,DEVS,DevvStream Corp.  (DEVS)  (CIK 0001854480),8-K,2026-04-14,0001140361-26-014502:ef20070306_ex2-1.htm,2026-04-27T22:51:35Z
layoffs,AVNS,"AVANOS MEDICAL, INC.  (AVNS)  (CIK 0001606498)",8-K,2026-04-14,0001606498-26-000046:avnsform8k_04132026xex21.htm,2026-04-27T22:51:35Z
restructuring,CCO,"Clear Channel Outdoor Holdings, Inc.  (CCO)  (CIK 0001334978)",8-K,2026-04-13,0001213900-26-042767:ea028569201ex10-1.htm,2026-04-27T22:51:35Z
layoffs,LEG,LEGGETT & PLATT INC  (LEG)  (CIK 0000058492),8-K,2026-04-13,0001193125-26-151966:d38467dex21.htm,2026-04-27T22:51:35Z
layoffs,SGI,SOMNIGROUP INTERNATIONAL INC.  (SGI)  (CIK 0001206264),8-K,2026-04-13,0001206264-26-000048:exhibit21-agreementandplan.htm,2026-04-27T22:51:35Z
facility_closure,CCO,"Clear Channel Outdoor Holdings, Inc.  (CCO)  (CIK 0001334978)",8-K,2026-04-13,0001213900-26-042767:ea028569201ex10-1.htm,2026-04-27T22:51:35Z
workforce_reduction,RVP,RETRACTABLE TECHNOLOGIES INC  (RVP)  (CIK 0000946563),8-K,2026-04-10,0001104659-26-041588:tm2611506d1_ex99.htm,2026-04-27T22:51:35Z
restructuring,DK,"Delek US Holdings, Inc.  (DK)  (CIK 0001694426)",8-K,2026-04-10,0001193125-26-151245:d94216dex101.htm,2026-04-27T22:51:35Z
workforce_reduction,CARS,Cars.com Inc.  (CARS)  (CIK 0001683606),8-K,2026-04-09,0001193125-26-149752:cars-20260406.htm,2026-04-27T22:51:35Z
workforce_reduction,ASRT,"Assertio Holdings, Inc.  (ASRT)  (CIK 0001808665)",8-K/A,2026-04-09,0001104659-26-041569:tm2611405d4_ex2-1.htm,2026-04-27T22:51:35Z
workforce_reduction,ASRT,"Assertio Holdings, Inc.  (ASRT)  (CIK 0001808665)",8-K,2026-04-09,0001104659-26-041236:tm2611405d1_ex2-1.htm,2026-04-27T22:51:35Z
layoffs,WSR,Whitestone REIT  (WSR)  (CIK 0001175535),8-K,2026-04-09,0001193125-26-148793:d898183dex21.htm,2026-04-27T22:51:35Z
layoffs,,"Constellation Acquisition Corp I  (CSTAF, CSTUF, CSTWF)  (CIK 0001834032)",8-K,2026-04-09,0001213900-26-042083:ea028571401ex2-1.htm,2026-04-27T22:51:35Z
layoffs,ASRT,"Assertio Holdings, Inc.  (ASRT)  (CIK 0001808665)",8-K,2026-04-09,0001104659-26-041236:tm2611405d1_ex10-1.htm,2026-04-27T22:51:35Z
layoffs,ASRT,"Assertio Holdings, Inc.  (ASRT)  (CIK 0001808665)",8-K/A,2026-04-09,0001104659-26-041569:tm2611405d4_ex10-1.htm,2026-04-27T22:51:35Z
reduction_in_force,RGP,"RESOURCES CONNECTION, INC.  (RGP)  (CIK 0001084765)",8-K,2026-04-08,0001084765-26-000027:rgpq3fy26pressrelease.htm,2026-04-27T22:51:35Z
reduction_in_force,GPRO,"GoPro, Inc.  (GPRO)  (CIK 0001500435)",8-K,2026-04-07,0001628280-26-024066:gpro-20260407.htm,2026-04-27T22:51:35Z
reduction_in_force,AZTA,"Azenta, Inc.  (AZTA)  (CIK 0000933974)",8-K,2026-04-07,0001437749-26-011542:ex_942627.htm,2026-04-27T22:51:35Z
workforce_reduction,GEOS,GEOSPACE TECHNOLOGIES CORP  (GEOS)  (CIK 0001001115),8-K,2026-04-06,0001437749-26-011402:geos20260406_8k.htm,2026-04-27T22:51:35Z
workforce_reduction,STIM,"Neuronetics, Inc.  (STIM)  (CIK 0001227636)",8-K,2026-04-06,0001193125-26-143876:d107138d8k.htm,2026-04-27T22:51:35Z
reduction_in_force,GEOS,GEOSPACE TECHNOLOGIES CORP  (GEOS)  (CIK 0001001115),8-K,2026-04-06,0001437749-26-011402:geos20260406_8k.htm,2026-04-27T22:51:35Z
layoffs,,"MCCORMICK & CO INC  (MKC, MKC-V)  (CIK 0000063754)",8-K/A,2026-04-06,0001999371-26-007671:ex2-1.htm,2026-04-27T22:51:35Z
layoffs,SLNO,SOLENO THERAPEUTICS INC  (SLNO)  (CIK 0001484565),8-K,2026-04-06,0001193125-26-142911:d142985dex21.htm,2026-04-27T22:51:35Z
layoffs,NBIX,NEUROCRINE BIOSCIENCES INC  (NBIX)  (CIK 0000914475),8-K,2026-04-06,0001193125-26-142904:d110123dex21.htm,2026-04-27T22:51:35Z
workforce_reduction,BTMD,biote Corp.  (BTMD)  (CIK 0001819253),8-K,2026-04-03,0001193125-26-142147:d126766dex991.htm,2026-04-27T22:51:35Z
plant_closure,AUPH,Aurinia Pharmaceuticals Inc.  (AUPH)  (CIK 0001600620),8-K,2026-04-03,0001600620-26-000035:exhibit21.htm,2026-04-27T22:51:35Z
layoffs,FORA,Forian Inc.  (FORA)  (CIK 0001829280),8-K,2026-04-03,0001140361-26-013124:ef20069813_ex2-1.htm,2026-04-27T22:51:35Z
restructuring,NXST,"NEXSTAR MEDIA GROUP, INC.  (NXST)  (CIK 0001142417)",8-K,2026-04-02,0001193125-26-139729:nxst-ex4_1.htm,2026-04-27T22:51:35Z
plant_closure,ANGO,ANGIODYNAMICS INC  (ANGO)  (CIK 0001275187),8-K,2026-04-02,0001140361-26-012891:ef20069681_ex99-1.htm,2026-04-27T22:51:35Z
layoffs,AGIG,"ABUNDIA GLOBAL IMPACT GROUP, INC.  (AGIG)  (CIK 0001156041)",8-K,2026-04-02,0001493152-26-014820:ex10-1.htm,2026-04-27T22:51:35Z
reduction_in_force,BITF,Keel Infrastructure Corp.  (BITF)  (CIK 0001812477),8-K,2026-04-01,0001213900-26-038080:ea028450001ex10-6.htm,2026-04-27T22:51:35Z
layoffs,ZYME,Zymeworks Inc.  (ZYME)  (CIK 0001937653),8-K,2026-04-01,0001193125-26-135610:d142598dex991.htm,2026-04-27T22:51:35Z
layoffs,CWBHF,"Charlotte's Web Holdings, Inc.  (CWBHF)  (CIK 0001750155)",8-K,2026-04-01,0001750155-26-000036:exhibit101-subscriptionagr.htm,2026-04-27T22:51:35Z
layoffs,CYCN,"Cyclerion Therapeutics, Inc.  (CYCN)  (CIK 0001755237)",8-K,2026-04-01,0001193125-26-137909:d128275dex21.htm,2026-04-27T22:51:35Z
workforce_reduction,BCAB,"BioAtla, Inc.  (BCAB)  (CIK 0001826892)",8-K,2026-03-31,0001193125-26-134501:bcab-ex99_1.htm,2026-04-27T22:51:35Z
restructuring,,"BRC Group Holdings, Inc.  (RILY, RILYG, RILYK, RILYL, RILYN, RILYP, RILYT, RILYZ",8-K,2026-03-31,0001464790-26-000022:rily-20251231xex991.htm,2026-04-27T22:51:35Z
reduction_in_force,BCAB,"BioAtla, Inc.  (BCAB)  (CIK 0001826892)",8-K,2026-03-31,0001193125-26-134501:bcab-ex99_1.htm,2026-04-27T22:51:35Z
layoffs,BIRD,"Allbirds, Inc.  (BIRD)  (CIK 0001653909)",8-K,2026-03-31,0001628280-26-022181:assetpurchaseagreementuplo.htm,2026-04-27T22:51:35Z
layoffs,LONA,"LeonaBio, Inc.  (LONA)  (CIK 0001620463)",8-K/A,2026-03-31,0001193125-26-134097:lona-ex2_1.htm,2026-04-27T22:51:35Z
layoffs,CNTA,Centessa Pharmaceuticals plc  (CNTA)  (CIK 0001847903),8-K,2026-03-31,0001193125-26-134656:d145970dex21.htm,2026-04-27T22:51:35Z
workforce_reduction,CVV,CVD EQUIPMENT CORP  (CVV)  (CIK 0000766792),8-K,2026-03-30,0001493152-26-013566:ex99-1.htm,2026-04-27T22:51:35Z
restructuring,NXST,"NEXSTAR MEDIA GROUP, INC.  (NXST)  (CIK 0001142417)",8-K,2026-03-30,0001193125-26-129955:nxst-ex4_1.htm,2026-04-27T22:51:35Z
restructuring,NXST,"NEXSTAR MEDIA GROUP, INC.  (NXST)  (CIK 0001142417)",8-K,2026-03-30,0001193125-26-129955:nxst-ex10_1.htm,2026-04-27T22:51:35Z
reduction_in_force,LVLU,"Lulu's Fashion Lounge Holdings, Inc.  (LVLU)  (CIK 0001780201)",8-K,2026-03-30,0001104659-26-036850:lvlu-20260330xex99d1.htm,2026-04-27T22:51:35Z
plant_closure,KZR,"Kezar Life Sciences, Inc.  (KZR)  (CIK 0001645666)",8-K,2026-03-30,0001193125-26-130486:d106892dex21.htm,2026-04-27T22:51:35Z
layoffs,BMNR,"BITMINE IMMERSION TECHNOLOGIES, INC.  (BMNR)  (CIK 0001829311)",8-K,2026-03-30,0001493152-26-013609:ex10-1.htm,2026-04-27T22:51:35Z
layoffs,,"Compass Diversified Holdings  (CODI, CODI-PA, CODI-PB, CODI-PC)  (CIK 0001345126",8-K,2026-03-30,0001345126-26-000030:ex21sternoagreementandplan.htm,2026-04-27T22:51:35Z
restructuring,DKL,"Delek Logistics Partners, LP  (DKL)  (CIK 0001552797)",8-K,2026-03-27,0001193125-26-129319:d134164dex101.htm,2026-04-27T22:51:35Z
layoffs,PULM,"Pulmatrix, Inc.  (PULM)  (CIK 0001574235)",8-K,2026-03-27,0001493152-26-013266:ex2-1.htm,2026-04-27T22:51:35Z
workforce_reduction,,"FiscalNote Holdings, Inc.  (NOTE, NOTE-WT)  (CIK 0001823466)",8-K,2026-03-26,0001193125-26-124523:d31744dex991.htm,2026-04-27T22:51:35Z
reduction_in_force,NSYS,NORTECH SYSTEMS INC  (NSYS)  (CIK 0000722313),8-K,2026-03-26,0001493152-26-012975:ex99-1.htm,2026-04-27T22:51:35Z
plant_closure,FUL,FULLER H B CO  (FUL)  (CIK 0000039368),8-K,2026-03-26,0001437749-26-009854:ex_937289.htm,2026-04-27T22:51:35Z
layoffs,LONA,"LeonaBio, Inc.  (LONA)  (CIK 0001620463)",8-K,2026-03-26,0001193125-26-126579:lona-ex99_1.htm,2026-04-27T22:51:35Z
layoffs,LONA,"LeonaBio, Inc.  (LONA)  (CIK 0001620463)",8-K,2026-03-26,0001193125-26-126579:lona-ex99_2.htm,2026-04-27T22:51:35Z
layoffs,OLPX,"OLAPLEX HOLDINGS, INC.  (OLPX)  (CIK 0001868726)",8-K,2026-03-26,0001193125-26-126362:d119132dex21.htm,2026-04-27T22:51:35Z
facility_closure,NSYS,NORTECH SYSTEMS INC  (NSYS)  (CIK 0000722313),8-K,2026-03-26,0001493152-26-012975:ex99-1.htm,2026-04-27T22:51:35Z
restructuring,CTSO,Cytosorbents Corp  (CTSO)  (CIK 0001175151),8-K,2026-03-25,0000929638-26-001150:exhibit99-1.htm,2026-04-27T22:51:35Z
restructuring,CAVA,"CAVA GROUP, INC.  (CAVA)  (CIK 0001639438)",8-K,2026-03-25,0001628280-26-020983:exhibit101cava-amendmentno.htm,2026-04-27T22:51:35Z
reduction_in_force,VREOF,Vireo Growth Inc.  (VREOF)  (CIK 0001771706),8-K,2026-03-25,0001104659-26-034509:tm269781d1_ex2-1.htm,2026-04-27T22:51:35Z
reduction_in_force,VREOF,Vireo Growth Inc.  (VREOF)  (CIK 0001771706),8-K,2026-03-25,0001104659-26-034509:tm269781d1_ex2-3.htm,2026-04-27T22:51:35Z
layoffs,VREOF,Vireo Growth Inc.  (VREOF)  (CIK 0001771706),8-K,2026-03-25,0001104659-26-034509:tm269781d1_ex2-3.htm,2026-04-27T22:51:35Z
layoffs,VREOF,Vireo Growth Inc.  (VREOF)  (CIK 0001771706),8-K,2026-03-25,0001104659-26-034509:tm269781d1_ex2-1.htm,2026-04-27T22:51:35Z
layoffs,CTNT,CHEETAH NET SUPPLY CHAIN SERVICE INC.  (CTNT)  (CIK 0001951667),8-K,2026-03-25,0001104659-26-034519:tm269716d1_ex10-1.htm,2026-04-27T22:51:35Z
facility_closure,ENS,EnerSys  (ENS)  (CIK 0001289308),8-K,2026-03-25,0001289308-26-000009:exhibit991-closureoftjmxma.htm,2026-04-27T22:51:35Z
workforce_reduction,SFD,SMITHFIELD FOODS INC  (SFD)  (CIK 0000091388),8-K,2026-03-24,0000091388-26-000013:q42025pressrelease.htm,2026-04-27T22:51:35Z
workforce_reduction,GUTS,"FRACTYL HEALTH, INC.  (GUTS)  (CIK 0001572616)",8-K,2026-03-24,0001193125-26-121780:guts-ex99_1.htm,2026-04-27T22:51:35Z
workforce_reduction,DG,DOLLAR GENERAL CORP  (DG)  (CIK 0000029534),8-K,2026-03-24,0001104659-26-033643:tm269511d1_ex10-2.htm,2026-04-27T22:51:35Z
workforce_reduction,DG,DOLLAR GENERAL CORP  (DG)  (CIK 0000029534),8-K,2026-03-24,0001104659-26-033643:tm269511d1_ex10-1.htm,2026-04-27T22:51:35Z
plant_closure,SFD,SMITHFIELD FOODS INC  (SFD)  (CIK 0000091388),8-K,2026-03-24,0000091388-26-000013:q42025pressrelease.htm,2026-04-27T22:51:35Z
layoffs,DNUT,"Krispy Kreme, Inc.  (DNUT)  (CIK 0001857154)",8-K,2026-03-24,0001857154-26-000017:ex101kkdc-projecttrianglex.htm,2026-04-27T22:51:35Z
layoffs,FNGR,"FingerMotion, Inc.  (FNGR)  (CIK 0001602409)",8-K,2026-03-24,0001520138-26-000083:fngr-20260318_8kex10z1.htm,2026-04-27T22:51:35Z
workforce_reduction,ABUS,Arbutus Biopharma Corp  (ABUS)  (CIK 0001447028),8-K,2026-03-23,0001171843-26-001838:exh_991.htm,2026-04-27T22:51:35Z
reduction_in_force,SBDS,"Solo Brands, Inc.  (SBDS)  (CIK 0001870600)",8-K,2026-03-23,0001870600-26-000012:solobrandsannounces2026fin.htm,2026-04-27T22:51:35Z
layoffs,,"SunPower Inc.  (SPWR, SPWRW)  (CIK 0001838987)",8-K,2026-03-23,0001213900-26-032711:ea028295601ex99-1.htm,2026-04-27T22:51:35Z
layoffs,ONDS,Ondas Inc.  (ONDS)  (CIK 0001646188),8-K,2026-03-23,0001213900-26-032684:ea028292301ex2-1.htm,2026-04-27T22:51:35Z
plant_closure,CMT,CORE MOLDING TECHNOLOGIES INC  (CMT)  (CIK 0001026655),8-K,2026-03-20,0001026655-26-000016:rothmarch2026final.htm,2026-04-27T22:51:35Z
layoffs,ZYXIQ,ZYNEX INC  (ZYXIQ)  (CIK 0000846475),8-K,2026-03-20,0001104659-26-032723:zyxi-20260319xex2d2.htm,2026-04-27T22:51:35Z
facility_closure,CMT,CORE MOLDING TECHNOLOGIES INC  (CMT)  (CIK 0001026655),8-K,2026-03-20,0001026655-26-000016:rothmarch2026final.htm,2026-04-27T22:51:35Z
workforce_reduction,,"FiscalNote Holdings, Inc.  (NOTE, NOTE-WT)  (CIK 0001823466)",8-K,2026-03-19,0001193125-26-116009:note-ex99_1.htm,2026-04-27T22:51:35Z
workforce_reduction,FDX,FEDEX CORP  (FDX)  (CIK 0001048911),8-K,2026-03-19,0001048911-26-000010:fdx-earningsreleasefy2026q3.htm,2026-04-27T22:51:35Z
workforce_reduction,GEMI,"Gemini Space Station, Inc.  (GEMI)  (CIK 0002055592)",8-K,2026-03-19,0002055592-26-000023:gemiq425shareholderlette.htm,2026-04-27T22:51:35Z
reduction_in_force,SBDS,"Solo Brands, Inc.  (SBDS)  (CIK 0001870600)",8-K,2026-03-19,0001870600-26-000008:solobrands-q42025er.htm,2026-04-27T22:51:35Z
layoffs,DVLT,Datavault AI Inc.  (DVLT)  (CIK 0001682149),8-K,2026-03-19,0001104659-26-031770:tm269288d1_ex2-1.htm,2026-04-27T22:51:35Z
facility_closure,NC,NACCO INDUSTRIES INC  (NC)  (CIK 0000789933),8-K,2026-03-19,0000789933-26-000080:naccoupdatedinvestorpres.htm,2026-04-27T22:51:35Z
reduction_in_force,WSM,WILLIAMS SONOMA INC  (WSM)  (CIK 0000719955),8-K,2026-03-18,0000719955-26-000030:exhibit991fy2025q4earnings.htm,2026-04-27T22:51:35Z
workforce_reduction,BCYC,BICYCLE THERAPEUTICS PLC  (BCYC)  (CIK 0001761612),8-K,2026-03-17,0001104659-26-028954:tm268887d1_ex99-1.htm,2026-04-27T22:51:35Z
workforce_reduction,IZEA,"IZEA Worldwide, Inc.  (IZEA)  (CIK 0001495231)",8-K,2026-03-17,0001495231-26-000008:exhibit991pressreleaseq420.htm,2026-04-27T22:51:35Z
workforce_reduction,GOSS,"Gossamer Bio, Inc.  (GOSS)  (CIK 0001728117)",8-K,2026-03-17,0001728117-26-000018:goss-20260317xexx991.htm,2026-04-27T22:51:35Z
restructuring,ANTX,"AN2 Therapeutics, Inc.  (ANTX)  (CIK 0001880438)",8-K,2026-03-17,0001193125-26-110681:antx-ex99_1.htm,2026-04-27T22:51:35Z
reduction_in_force,GOSS,"Gossamer Bio, Inc.  (GOSS)  (CIK 0001728117)",8-K,2026-03-17,0001728117-26-000018:goss-20260317xexx991.htm,2026-04-27T22:51:35Z
restructuring,TLS,TELOS CORP  (TLS)  (CIK 0000320121),8-K,2026-03-16,0000320121-26-000008:q42025december312025financ.htm,2026-04-27T22:51:35Z
restructuring,KYNB,"KYNTRA BIO, INC.  (KYNB)  (CIK 0000921299)",8-K,2026-03-16,0001193125-26-108324:kynb-ex99_1.htm,2026-04-27T22:51:35Z
reduction_in_force,CYPH,CYPHERPUNK TECHNOLOGIES INC.  (CYPH)  (CIK 0001509745),8-K,2026-03-16,0001104659-26-028558:tm268792d1_ex99-1.htm,2026-04-27T22:51:35Z
layoffs,ATXG,ADDENTAX GROUP CORP.  (ATXG)  (CIK 0001650101),8-K/A,2026-03-16,0001493152-26-010154:ex10-1.htm,2026-04-27T22:51:35Z
layoffs,KMFG,KEEMO Fashion Group Ltd  (KMFG)  (CIK 0001935033),8-K/A,2026-03-16,0001493152-26-010146:ex10-1.htm,2026-04-27T22:51:35Z
facility_closure,SMTC,SEMTECH CORP  (SMTC)  (CIK 0000088941),8-K,2026-03-16,0000088941-26-000003:smtc-01252026x8k991.htm,2026-04-27T22:51:35Z
reduction_in_force,PRDO,PERDOCEO EDUCATION Corp  (PRDO)  (CIK 0001046568),8-K,2026-03-13,0001193125-26-106346:prdo-ex10_1.htm,2026-04-27T22:51:35Z
plant_closure,,"Trinseo PLC  (TSE, TSEOF)  (CIK 0001519061)",8-K,2026-03-13,0001104659-26-027521:tse-20260313xex99d2.htm,2026-04-27T22:51:35Z
