kind,ticker,name,form,filed,accession,captured_at
substantial_doubt,,PRESIDIO PRODUCTION Co  (CIK 0002083125),8-K,2026-03-09,0001213900-26-025222:ea027961701ex99-7.htm,2026-04-27T22:53:26Z
restatement,,PRESIDIO PRODUCTION Co  (CIK 0002083125),8-K,2026-03-09,0001213900-26-025222:ea027961701ex10-8.htm,2026-04-27T22:53:26Z
non_reliance,ULH,"UNIVERSAL LOGISTICS HOLDINGS, INC.  (ULH)  (CIK 0001308208)",8-K,2026-03-09,0001193125-26-098600:ulh-20260303.htm,2026-04-27T22:53:26Z
non_reliance,,"Calisa Acquisition Corp  (ALIS, ALISR, ALISU)  (CIK 0002026767)",8-K,2026-03-09,0001493152-26-009317:ex2-1.htm,2026-04-27T22:53:26Z
non_reliance,,"SLM Corp  (SLM, SLMBP)  (CIK 0001032033)",8-K,2026-03-09,0001032033-26-000015:slm03092026ex101.htm,2026-04-27T22:53:26Z
non_reliance,,"Dave Inc./DE  (DAVE, DAVEW)  (CIK 0001841408)",8-K,2026-03-09,0001193125-26-098802:d108294dex101.htm,2026-04-27T22:53:26Z
non_reliance,CRGY,Crescent Energy Co  (CRGY)  (CIK 0001866175),8-K,2026-03-09,0001628280-26-016002:exhibit101-closing8xkmarch.htm,2026-04-27T22:53:26Z
non_reliance,,"Talkspace, Inc.  (TALK, TALKW)  (CIK 0001803901)",8-K,2026-03-09,0000950157-26-000267:ex2-1.htm,2026-04-27T22:53:26Z
going_concern,,PRESIDIO PRODUCTION Co  (CIK 0002083125),8-K,2026-03-09,0001213900-26-025222:ea027961701ex99-10.htm,2026-04-27T22:53:26Z
going_concern,,PRESIDIO PRODUCTION Co  (CIK 0002083125),8-K,2026-03-09,0001213900-26-025222:ea027961701ex99-5.htm,2026-04-27T22:53:26Z
audit_opinion,LXU,"LSB INDUSTRIES, INC.  (LXU)  (CIK 0000060714)",8-K,2026-03-09,0001193125-26-098634:lxu-20260304.htm,2026-04-27T22:53:26Z
adverse_opinion,LXU,"LSB INDUSTRIES, INC.  (LXU)  (CIK 0000060714)",8-K,2026-03-09,0001193125-26-098634:lxu-20260304.htm,2026-04-27T22:53:26Z
valuation_allowance,GCO,GENESCO INC  (GCO)  (CIK 0000018498),8-K,2026-03-06,0001193125-26-094963:gco-ex99_1.htm,2026-04-27T22:53:26Z
valuation_allowance,,"Cottonwood Communities, Inc.  (CIK 0001692951)",8-K/A,2026-03-06,0001692951-26-000040:a2024realsourcefs.htm,2026-04-27T22:53:26Z
valuation_allowance,COHN,Cohen & Co Inc.  (COHN)  (CIK 0001270436),8-K,2026-03-06,0001104659-26-024430:tm267862d1_ex99-1.htm,2026-04-27T22:53:26Z
valuation_allowance,,"Cottonwood Communities, Inc.  (CIK 0001692951)",8-K/A,2026-03-06,0001692951-26-000040:realsourcepropertiesinc930.htm,2026-04-27T22:53:26Z
valuation_allowance,HURC,HURCO COMPANIES INC  (HURC)  (CIK 0000315374),8-K,2026-03-06,0001104659-26-024429:hurc-20260306xex99d1.htm,2026-04-27T22:53:26Z
substantial_doubt,,"Cottonwood Communities, Inc.  (CIK 0001692951)",8-K/A,2026-03-06,0001692951-26-000040:a2024rspropmgmtfs.htm,2026-04-27T22:53:26Z
substantial_doubt,,"Cottonwood Communities, Inc.  (CIK 0001692951)",8-K/A,2026-03-06,0001692951-26-000040:a2024realsourcemgmtfs.htm,2026-04-27T22:53:26Z
substantial_doubt,,"Cottonwood Communities, Inc.  (CIK 0001692951)",8-K/A,2026-03-06,0001692951-26-000040:a2024realsourcepropadvis.htm,2026-04-27T22:53:26Z
substantial_doubt,,"Cottonwood Communities, Inc.  (CIK 0001692951)",8-K/A,2026-03-06,0001692951-26-000040:a2024realsourcefs.htm,2026-04-27T22:53:26Z
substantial_doubt,AUUD,AUDDIA INC.  (AUUD)  (CIK 0001554818),8-K,2026-03-06,0001683168-26-001589:auddia_ex9901.htm,2026-04-27T22:53:26Z
substantial_doubt,,"APEX Tech Acquisition Inc.  (TRAD, TRAD-UN)  (CIK 0002085485)",8-K,2026-03-06,0001477932-26-001204:appex_ex991.htm,2026-04-27T22:53:26Z
substantial_doubt,,"Cottonwood Communities, Inc.  (CIK 0001692951)",8-K/A,2026-03-06,0001692951-26-000040:a2024rspiopfs.htm,2026-04-27T22:53:26Z
restatement,,"Prospect Floating Rate & Alternative Income Fund, Inc.  (CIK 0001521945)",8-K,2026-03-06,0001521945-26-000031:pfloat-20260306.htm,2026-04-27T22:53:26Z
restatement,PMNT,Perfect Moment Ltd.  (PMNT)  (CIK 0001849221),8-K,2026-03-06,0001493152-26-009173:ex4-1.htm,2026-04-27T22:53:26Z
restatement,,"Prospect Floating Rate & Alternative Income Fund, Inc.  (CIK 0001521945)",8-K,2026-03-06,0001521945-26-000031:exhibit31-pfloatxfiftharti.htm,2026-04-27T22:53:26Z
non_reliance,,"Duke Energy CORP  (DUK, DUKB, DUK-PA)  (CIK 0001326160)",8-K,2026-03-06,0001104659-26-024729:tm268071d1_ex10-2.htm,2026-04-27T22:53:26Z
non_reliance,,BOSTON PROPERTIES LTD PARTNERSHIP  (CIK 0001043121),8-K,2026-03-06,0001193125-26-096974:d96551dex12.htm,2026-04-27T22:53:26Z
non_reliance,,"Duke Energy CORP  (DUK, DUKB, DUK-PA)  (CIK 0001326160)",8-K,2026-03-06,0001104659-26-024729:tm268071d1_ex10-1.htm,2026-04-27T22:53:26Z
non_reliance,HON,HONEYWELL INTERNATIONAL INC  (HON)  (CIK 0000773840),8-K,2026-03-06,0001193125-26-095179:d71810dex101.htm,2026-04-27T22:53:26Z
non_reliance,HON,HONEYWELL INTERNATIONAL INC  (HON)  (CIK 0000773840),8-K,2026-03-06,0001193125-26-095179:d71810dex993.htm,2026-04-27T22:53:26Z
going_concern,AUUD,AUDDIA INC.  (AUUD)  (CIK 0001554818),8-K,2026-03-06,0001683168-26-001589:auddia_ex9901.htm,2026-04-27T22:53:26Z
going_concern,,"APEX Tech Acquisition Inc.  (TRAD, TRAD-UN)  (CIK 0002085485)",8-K,2026-03-06,0001477932-26-001204:appex_ex991.htm,2026-04-27T22:53:26Z
going_concern,,"Cottonwood Communities, Inc.  (CIK 0001692951)",8-K/A,2026-03-06,0001692951-26-000040:a2024rspropmgmtfs.htm,2026-04-27T22:53:26Z
going_concern,,"Cottonwood Communities, Inc.  (CIK 0001692951)",8-K/A,2026-03-06,0001692951-26-000040:a2024realsourcemgmtfs.htm,2026-04-27T22:53:26Z
going_concern,,"Cottonwood Communities, Inc.  (CIK 0001692951)",8-K/A,2026-03-06,0001692951-26-000040:a2024realsourcepropadvis.htm,2026-04-27T22:53:26Z
going_concern,,"Cottonwood Communities, Inc.  (CIK 0001692951)",8-K/A,2026-03-06,0001692951-26-000040:a2024realsourcefs.htm,2026-04-27T22:53:26Z
audit_opinion,,"Joby Aviation, Inc.  (JOBY, JOBY-WT)  (CIK 0001819848)",8-K,2026-03-06,0001819848-26-000165:joby-20260302.htm,2026-04-27T22:53:26Z
audit_opinion,VMI,VALMONT INDUSTRIES INC  (VMI)  (CIK 0000102729),8-K,2026-03-06,0001104659-26-024717:tm267996d1_8k.htm,2026-04-27T22:53:26Z
adverse_opinion,,"Joby Aviation, Inc.  (JOBY, JOBY-WT)  (CIK 0001819848)",8-K,2026-03-06,0001819848-26-000165:joby-20260302.htm,2026-04-27T22:53:26Z
adverse_opinion,VMI,VALMONT INDUSTRIES INC  (VMI)  (CIK 0000102729),8-K,2026-03-06,0001104659-26-024717:tm267996d1_8k.htm,2026-04-27T22:53:26Z
valuation_allowance,CLAR,Clarus Corp  (CLAR)  (CIK 0000913277),8-K,2026-03-05,0001104659-26-024134:tm268094d1_ex99-1.htm,2026-04-27T22:53:26Z
valuation_allowance,LOGC,ContextLogic Holdings Inc.  (LOGC)  (CIK 0002064307),8-K/A,2026-03-05,0001140361-26-008088:ef20067093_ex99-4.htm,2026-04-27T22:53:26Z
valuation_allowance,ACFN,"ACORN ENERGY, INC.  (ACFN)  (CIK 0000880984)",8-K,2026-03-05,0001493152-26-008939:ex99-1.htm,2026-04-27T22:53:26Z
valuation_allowance,CLAR,Clarus Corp  (CLAR)  (CIK 0000913277),8-K,2026-03-05,0001104659-26-024134:tm268094d1_ex99-2.htm,2026-04-27T22:53:26Z
valuation_allowance,DSGR,"Distribution Solutions Group, Inc.  (DSGR)  (CIK 0000703604)",8-K,2026-03-05,0000703604-26-000007:a2025q4pressrelease.htm,2026-04-27T22:53:26Z
valuation_allowance,MEI,METHODE ELECTRONICS INC  (MEI)  (CIK 0000065270),8-K,2026-03-05,0000065270-26-000005:mei-ex99_1.htm,2026-04-27T22:53:26Z
valuation_allowance,TEAD,Teads Holding Co.  (TEAD)  (CIK 0001454938),8-K,2026-03-05,0001454938-26-000007:q42025er-exhibit991.htm,2026-04-27T22:53:26Z
substantial_doubt,,"DEEP FISSION, INC.  (CIK 0001918102)",8-K,2026-03-05,0001104659-26-023876:tm267549d1_8k.htm,2026-04-27T22:53:26Z
substantial_doubt,,Invest Acquisition Corp  (CIK 0001857410),8-K,2026-03-05,0001829126-26-001937:investcorpalacq_8k.htm,2026-04-27T22:53:26Z
substantial_doubt,TMRC,Texas Mineral Resources Corp.  (TMRC)  (CIK 0001445942),8-K,2026-03-05,0001999371-26-005116:ex99-1.htm,2026-04-27T22:53:26Z
substantial_doubt,USAR,"USA Rare Earth, Inc.  (USAR)  (CIK 0001970622)",8-K,2026-03-05,0001213900-26-023868:ea028011201ex99-1.htm,2026-04-27T22:53:26Z
restatement,,"GREIF, INC  (GEF, GEF-B)  (CIK 0000043920)",8-K,2026-03-05,0001628280-26-015049:gef2026creditagreementex10.htm,2026-04-27T22:53:26Z
restatement,,PIMCO Asset-Based Lending Co LLC  (CIK 0002073537),8-K,2026-03-05,0001193125-26-094186:d61154d8k.htm,2026-04-27T22:53:26Z
non_reliance,EPAM,"EPAM Systems, Inc.  (EPAM)  (CIK 0001352010)",8-K,2026-03-05,0001352010-26-000019:ex101-epamasconfirmation03.htm,2026-04-27T22:53:26Z
going_concern,TMRC,Texas Mineral Resources Corp.  (TMRC)  (CIK 0001445942),8-K,2026-03-05,0001999371-26-005116:ex99-1.htm,2026-04-27T22:53:26Z
going_concern,USAR,"USA Rare Earth, Inc.  (USAR)  (CIK 0001970622)",8-K,2026-03-05,0001213900-26-023868:ea028011201ex99-1.htm,2026-04-27T22:53:26Z
audit_opinion,UGRO,"urban-gro, Inc.  (UGRO)  (CIK 0001706524)",8-K,2026-03-05,0001213900-26-024200:ea027992002-8k_urban.htm,2026-04-27T22:53:26Z
audit_opinion,PAXH,PREAXIA HEALTH CARE PAYMENT SYSTEMS INC.  (PAXH)  (CIK 0001350156),8-K/A,2026-03-05,0001079973-26-000276:paxh_8k.htm,2026-04-27T22:53:26Z
audit_opinion,,"DEEP FISSION, INC.  (CIK 0001918102)",8-K,2026-03-05,0001104659-26-023876:tm267549d1_8k.htm,2026-04-27T22:53:26Z
audit_opinion,,Invest Acquisition Corp  (CIK 0001857410),8-K,2026-03-05,0001829126-26-001937:investcorpalacq_8k.htm,2026-04-27T22:53:26Z
adverse_opinion,PAXH,PREAXIA HEALTH CARE PAYMENT SYSTEMS INC.  (PAXH)  (CIK 0001350156),8-K/A,2026-03-05,0001079973-26-000276:paxh_8k.htm,2026-04-27T22:53:26Z
adverse_opinion,FSLY,"Fastly, Inc.  (FSLY)  (CIK 0001517413)",8-K,2026-03-05,0001517413-26-000089:fsly-20260304.htm,2026-04-27T22:53:26Z
adverse_opinion,,"DEEP FISSION, INC.  (CIK 0001918102)",8-K,2026-03-05,0001104659-26-023876:tm267549d1_8k.htm,2026-04-27T22:53:26Z
adverse_opinion,,"AH Realty Trust, Inc.  (AHH, AHH-PA, AHRT-PA)  (CIK 0001569187)",8-K/A,2026-03-05,0001569187-26-000035:ahh-20260305.htm,2026-04-27T22:53:26Z
adverse_opinion,,Invest Acquisition Corp  (CIK 0001857410),8-K,2026-03-05,0001829126-26-001937:investcorpalacq_8k.htm,2026-04-27T22:53:26Z
valuation_allowance,NCSM,"NCS Multistage Holdings, Inc.  (NCSM)  (CIK 0001692427)",8-K,2026-03-04,0001437749-26-006915:ex_881226.htm,2026-04-27T22:53:26Z
valuation_allowance,BBWI,"Bath & Body Works, Inc.  (BBWI)  (CIK 0000701985)",8-K,2026-03-04,0000701985-26-000005:ex991bbwi-20254qearningsre.htm,2026-04-27T22:53:26Z
valuation_allowance,HAIN,HAIN CELESTIAL GROUP INC  (HAIN)  (CIK 0000910406),8-K,2026-03-04,0001193125-26-091458:hain-ex99_2.htm,2026-04-27T22:53:26Z
valuation_allowance,,"Babcock & Wilcox Enterprises, Inc.  (BW, BWNB, BW-PA)  (CIK 0001630805)",8-K,2026-03-04,0001104659-26-023138:tm267910d1_ex99-3.htm,2026-04-27T22:53:26Z
substantial_doubt,AGGI,"Allied Energy, Inc.  (AGGI)  (CIK 0001109262)",8-K,2026-03-04,0001683168-26-001486:aggi_8k.htm,2026-04-27T22:53:26Z
restatement,CPS,Cooper-Standard Holdings Inc.  (CPS)  (CIK 0001320461),8-K,2026-03-04,0001320461-26-000057:ex42-fifthamendmentxredlin.htm,2026-04-27T22:53:26Z
non_reliance,HTO,H2O AMERICA  (HTO)  (CIK 0000766829),8-K,2026-03-04,0001104659-26-023470:tm267546d3_ex10-2.htm,2026-04-27T22:53:26Z
non_reliance,HTO,H2O AMERICA  (HTO)  (CIK 0000766829),8-K,2026-03-04,0001104659-26-023470:tm267546d3_ex10-1.htm,2026-04-27T22:53:26Z
non_reliance,,"VINEBROOK HOMES TRUST, INC.  (CIK 0001755755)",8-K,2026-03-04,0001437749-26-006914:ex_928098.htm,2026-04-27T22:53:26Z
non_reliance,LNT,ALLIANT ENERGY CORP  (LNT)  (CIK 0000352541),8-K,2026-03-04,0000352541-26-000009:lnt030220268-kex101.htm,2026-04-27T22:53:26Z
going_concern,,"AIR T INC  (AIRT, AIRTP)  (CIK 0000353184)",8-K/A,2026-03-04,0000353184-26-000024:rexexpressfinancialstate.htm,2026-04-27T22:53:26Z
going_concern,ABCP,AmBase Corp  (ABCP)  (CIK 0000020639),8-K,2026-03-04,0001140361-26-007783:ef20067111_8k.htm,2026-04-27T22:53:26Z
audit_opinion,,"WhiteHorse Finance, Inc.  (WHF, WHFCL)  (CIK 0001552198)",8-K,2026-03-04,0001104659-26-023450:whf-20260226x8k.htm,2026-04-27T22:53:26Z
audit_opinion,AGGI,"Allied Energy, Inc.  (AGGI)  (CIK 0001109262)",8-K,2026-03-04,0001683168-26-001486:aggi_8k.htm,2026-04-27T22:53:26Z
adverse_opinion,,"WhiteHorse Finance, Inc.  (WHF, WHFCL)  (CIK 0001552198)",8-K,2026-03-04,0001104659-26-023450:whf-20260226x8k.htm,2026-04-27T22:53:26Z
adverse_opinion,AGGI,"Allied Energy, Inc.  (AGGI)  (CIK 0001109262)",8-K,2026-03-04,0001683168-26-001486:aggi_8k.htm,2026-04-27T22:53:26Z
valuation_allowance,BOX,BOX INC  (BOX)  (CIK 0001372612),8-K,2026-03-03,0001193125-26-088171:box-ex99_1.htm,2026-04-27T22:53:26Z
substantial_doubt,KPTI,Karyopharm Therapeutics Inc.  (KPTI)  (CIK 0001503802),8-K,2026-03-03,0001503802-26-000006:kpti-20260227.htm,2026-04-27T22:53:26Z
restatement,CENX,CENTURY ALUMINUM CO  (CENX)  (CIK 0000949157),8-K,2026-03-03,0001628280-26-013781:cenx-20260302.htm,2026-04-27T22:53:26Z
restatement,BXSL,Blackstone Secured Lending Fund  (BXSL)  (CIK 0001736035),8-K,2026-03-03,0001213900-26-023034:ea027956801ex5-2_blackstone.htm,2026-04-27T22:53:26Z
restatement,,"MOBIX LABS, INC  (MOBX, MOBXW)  (CIK 0001855467)",8-K,2026-03-03,0001493152-26-008592:form8-k.htm,2026-04-27T22:53:26Z
non_reliance,ABVC,"ABVC BIOPHARMA, INC.  (ABVC)  (CIK 0001173313)",8-K,2026-03-03,0001213900-26-023054:ea0279143-8k_abvc.htm,2026-04-27T22:53:26Z
non_reliance,CENX,CENTURY ALUMINUM CO  (CENX)  (CIK 0000949157),8-K,2026-03-03,0001628280-26-013781:cenx-20260302.htm,2026-04-27T22:53:26Z
non_reliance,PINS,"PINTEREST, INC.  (PINS)  (CIK 0001506293)",8-K,2026-03-03,0001193125-26-086731:d22903dex102.htm,2026-04-27T22:53:26Z
non_reliance,TREX,TREX CO INC  (TREX)  (CIK 0001069878),8-K,2026-03-03,0001193125-26-086881:trex-ex10_1.htm,2026-04-27T22:53:26Z
non_reliance,UCTT,"Ultra Clean Holdings, Inc.  (UCTT)  (CIK 0001275014)",8-K,2026-03-03,0000950103-26-003139:dp242585_ex1001.htm,2026-04-27T22:53:26Z
non_reliance,TXNM,TXNM ENERGY INC  (TXNM)  (CIK 0001108426),8-K,2026-03-03,0001108426-26-000010:a03032026txnmex101.htm,2026-04-27T22:53:26Z
audit_opinion,CRNX,"Crinetics Pharmaceuticals, Inc.  (CRNX)  (CIK 0001658247)",8-K,2026-03-03,0001658247-26-000017:crnx-20260227.htm,2026-04-27T22:53:26Z
audit_opinion,IMAA,IMA Tech  (IMAA)  (CIK 0001980295),8-K,2026-03-03,0001980295-26-000020:imaa_8k.htm,2026-04-27T22:53:26Z
audit_opinion,GCT,GigaCloud Technology Inc  (GCT)  (CIK 0001857816),8-K,2026-03-03,0001857816-26-000021:gct-20260302.htm,2026-04-27T22:53:26Z
adverse_opinion,CRNX,"Crinetics Pharmaceuticals, Inc.  (CRNX)  (CIK 0001658247)",8-K,2026-03-03,0001658247-26-000017:crnx-20260227.htm,2026-04-27T22:53:26Z
adverse_opinion,GCT,GigaCloud Technology Inc  (GCT)  (CIK 0001857816),8-K,2026-03-03,0001857816-26-000021:gct-20260302.htm,2026-04-27T22:53:26Z
valuation_allowance,NRG,"NRG ENERGY, INC.  (NRG)  (CIK 0001013871)",8-K,2026-03-02,0001104659-26-022295:tm267426d2_ex99-5.htm,2026-04-27T22:53:26Z
valuation_allowance,TREE,"LendingTree, Inc.  (TREE)  (CIK 0001434621)",8-K,2026-03-02,0001628280-26-013273:tree-123125xer.htm,2026-04-27T22:53:26Z
valuation_allowance,BKR,Baker Hughes Co  (BKR)  (CIK 0001701605),8-K,2026-03-02,0001193125-26-085437:d57122dex991.htm,2026-04-27T22:53:26Z
valuation_allowance,,"Dave Inc./DE  (DAVE, DAVEW)  (CIK 0001841408)",8-K,2026-03-02,0001841408-26-000003:dave-ex99_1.htm,2026-04-27T22:53:26Z
valuation_allowance,SGRY,"Surgery Partners, Inc.  (SGRY)  (CIK 0001638833)",8-K,2026-03-02,0001638833-26-000006:exhibit991q42025earningsre.htm,2026-04-27T22:53:26Z
substantial_doubt,HTO,H2O AMERICA  (HTO)  (CIK 0000766829),8-K,2026-03-02,0001104659-26-022239:tm267546d2_ex99-2.htm,2026-04-27T22:53:26Z
substantial_doubt,QSJC,"TANCHENG GROUP CO., LTD.  (QSJC)  (CIK 0001753391)",8-K,2026-03-02,0001683168-26-001381:tancheng_8k.htm,2026-04-27T22:53:26Z
substantial_doubt,BCAB,"BioAtla, Inc.  (BCAB)  (CIK 0001826892)",8-K,2026-03-02,0001539497-26-000812:exh99_1.htm,2026-04-27T22:53:26Z
substantial_doubt,NRG,"NRG ENERGY, INC.  (NRG)  (CIK 0001013871)",8-K,2026-03-02,0001104659-26-022295:tm267426d2_ex99-5.htm,2026-04-27T22:53:26Z
substantial_doubt,BCAB,"BioAtla, Inc.  (BCAB)  (CIK 0001826892)",8-K,2026-03-02,0001539497-26-000812:n5620_8k.htm,2026-04-27T22:53:26Z
restatement,QTRX,Quanterix Corp  (QTRX)  (CIK 0001503274),8-K,2026-03-02,0001503274-26-000011:ex991-qtrxx20251231.htm,2026-04-27T22:53:26Z
restatement,,"Core Scientific, Inc./tx  (CORZ, CORZR, CORZW, CORZZ)  (CIK 0001839341)",8-K,2026-03-02,0001628280-26-013214:core-20260302.htm,2026-04-27T22:53:26Z
non_reliance,,"Core Scientific, Inc./tx  (CORZ, CORZR, CORZW, CORZZ)  (CIK 0001839341)",8-K,2026-03-02,0001628280-26-013214:core-20260302.htm,2026-04-27T22:53:26Z
non_reliance,GTBP,"GT Biopharma, Inc.  (GTBP)  (CIK 0000109657)",8-K,2026-03-02,0001493152-26-008442:form8-k.htm,2026-04-27T22:53:26Z
non_reliance,GLPI,"Gaming & Leisure Properties, Inc.  (GLPI)  (CIK 0001575965)",8-K,2026-03-02,0001193125-26-085750:d26385dex52.htm,2026-04-27T22:53:26Z
non_reliance,,"Life360, Inc.  (LIF, LIFX)  (CIK 0001581760)",8-K,2026-03-02,0001581760-26-000017:a360q425resultspresentat.htm,2026-04-27T22:53:26Z
going_concern,,"Eagle Nuclear Energy Corp.  (NUCL, NUCLW)  (CIK 0002089283)",8-K,2026-03-02,0001104659-26-022330:tm267670d1_ex99-1.htm,2026-04-27T22:53:26Z
going_concern,,"Eagle Nuclear Energy Corp.  (NUCL, NUCLW)  (CIK 0002089283)",8-K,2026-03-02,0001104659-26-022330:tm267670d1_ex99-2.htm,2026-04-27T22:53:26Z
going_concern,,"DBV Technologies S.A.  (DBVT, DBVTF)  (CIK 0001613780)",8-K,2026-03-02,0001193125-26-084251:d110966dex991.htm,2026-04-27T22:53:26Z
audit_opinion,QSJC,"TANCHENG GROUP CO., LTD.  (QSJC)  (CIK 0001753391)",8-K,2026-03-02,0001683168-26-001381:tancheng_8k.htm,2026-04-27T22:53:26Z
valuation_allowance,TMDX,"TransMedics Group, Inc.  (TMDX)  (CIK 0001756262)",8-K,2026-02-27,0001193125-26-079392:d80286dex991.htm,2026-04-27T22:53:26Z
valuation_allowance,TXNM,TXNM ENERGY INC  (TXNM)  (CIK 0001108426),8-K,2026-02-27,0001108426-26-000004:exhibit99102272026earnings.htm,2026-04-27T22:53:26Z
valuation_allowance,CALY,Callaway Golf Co  (CALY)  (CIK 0000837465),8-K,2026-02-27,0000837465-26-000011:ex-991recastsegmentandnonx.htm,2026-04-27T22:53:26Z
valuation_allowance,DUOL,"Duolingo, Inc.  (DUOL)  (CIK 0001562088)",8-K/A,2026-02-27,0001628280-26-012513:q4fy25duolingo12-31x25shar.htm,2026-04-27T22:53:26Z
valuation_allowance,TMDX,"TransMedics Group, Inc.  (TMDX)  (CIK 0001756262)",8-K,2026-02-27,0001193125-26-079392:d80286d8k.htm,2026-04-27T22:53:26Z
substantial_doubt,,"Bolt Projects Holdings, Inc.  (BSLK, BSLKW)  (CIK 0001841125)",8-K,2026-02-27,0001841125-26-000009:bslk-20260225.htm,2026-04-27T22:53:26Z
restatement,MPWR,MONOLITHIC POWER SYSTEMS INC  (MPWR)  (CIK 0001280452),8-K,2026-02-27,0001437749-26-006112:mpwr20260225_8k.htm,2026-04-27T22:53:26Z
restatement,,"EON Resources Inc.  (EONR, EONR-WT)  (CIK 0001842556)",8-K,2026-02-27,0001213900-26-021741:f8k022426_eonresorces.htm,2026-04-27T22:53:26Z
restatement,ELWT,"Elauwit Connection, Inc.  (ELWT)  (CIK 0002063863)",8-K,2026-02-27,0001104659-26-021078:tm267477d1_ex99-1.htm,2026-04-27T22:53:26Z
restatement,ELWT,"Elauwit Connection, Inc.  (ELWT)  (CIK 0002063863)",8-K,2026-02-27,0001104659-26-021078:tm267477d1_8k.htm,2026-04-27T22:53:26Z
non_reliance,ELWT,"Elauwit Connection, Inc.  (ELWT)  (CIK 0002063863)",8-K,2026-02-27,0001104659-26-021078:tm267477d1_8k.htm,2026-04-27T22:53:26Z
non_reliance,,"EON Resources Inc.  (EONR, EONR-WT)  (CIK 0001842556)",8-K,2026-02-27,0001213900-26-021741:f8k022426_eonresorces.htm,2026-04-27T22:53:26Z
non_reliance,RCL,ROYAL CARIBBEAN CRUISES LTD  (RCL)  (CIK 0000884887),8-K,2026-02-27,0001104659-26-021624:tm267192d1_ex5-2.htm,2026-04-27T22:53:26Z
non_reliance,MPWR,MONOLITHIC POWER SYSTEMS INC  (MPWR)  (CIK 0001280452),8-K,2026-02-27,0001437749-26-006112:mpwr20260225_8k.htm,2026-04-27T22:53:26Z
non_reliance,TNDM,TANDEM DIABETES CARE INC  (TNDM)  (CIK 0001438133),8-K,2026-02-27,0001140361-26-007142:ef20066689_ex10-1.htm,2026-04-27T22:53:26Z
non_reliance,FVR,"FrontView REIT, Inc.  (FVR)  (CIK 0001988494)",8-K,2026-02-27,0001193125-26-083249:fvr-ex1_2.htm,2026-04-27T22:53:26Z
audit_opinion,GKOR,Golkor Inc.  (GKOR)  (CIK 0001474558),8-K,2026-02-27,0001683168-26-001342:golkor_8k.htm,2026-04-27T22:53:26Z
audit_opinion,LARK,LANDMARK BANCORP INC  (LARK)  (CIK 0001141688),8-K,2026-02-27,0001493152-26-008367:form8-k.htm,2026-04-27T22:53:26Z
adverse_opinion,GKOR,Golkor Inc.  (GKOR)  (CIK 0001474558),8-K,2026-02-27,0001683168-26-001342:golkor_8k.htm,2026-04-27T22:53:26Z
adverse_opinion,,"Bolt Projects Holdings, Inc.  (BSLK, BSLKW)  (CIK 0001841125)",8-K,2026-02-27,0001841125-26-000009:bslk-20260225.htm,2026-04-27T22:53:26Z
adverse_opinion,LARK,LANDMARK BANCORP INC  (LARK)  (CIK 0001141688),8-K,2026-02-27,0001493152-26-008367:form8-k.htm,2026-04-27T22:53:26Z
valuation_allowance,PBYI,"PUMA BIOTECHNOLOGY, INC.  (PBYI)  (CIK 0001401667)",8-K,2026-02-26,0001437749-26-005869:ex_916496.htm,2026-04-27T22:53:26Z
valuation_allowance,,"SEMPRA  (SRE, SREA)  (CIK 0001032208)",8-K,2026-02-26,0001032208-26-000008:ex99_1x20251231xearningsta.htm,2026-04-27T22:53:26Z
valuation_allowance,,"Ready Capital Corp  (RC, RCB, RCC, RCD, RC-PC, RC-PE)  (CIK 0001527590)",8-K,2026-02-26,0001628280-26-012348:readycapital-exhibit991.htm,2026-04-27T22:53:26Z
valuation_allowance,ECVT,Ecovyst Inc.  (ECVT)  (CIK 0001708035),8-K,2026-02-26,0001708035-26-000047:ex991-ecvt4q25earningsrele.htm,2026-04-27T22:53:26Z
valuation_allowance,HGTY,"Hagerty, Inc.  (HGTY)  (CIK 0001840776)",8-K,2026-02-26,0001840776-26-000010:q425investordeckfinal.htm,2026-04-27T22:53:26Z
valuation_allowance,TWI,TITAN INTERNATIONAL INC  (TWI)  (CIK 0000899751),8-K,2026-02-26,0000899751-26-000009:q425earningsreleaseex99.htm,2026-04-27T22:53:26Z
valuation_allowance,BCO,BRINKS CO  (BCO)  (CIK 0000078890),8-K,2026-02-26,0000078890-26-000008:ex991q42025.htm,2026-04-27T22:53:26Z
valuation_allowance,DUOL,"Duolingo, Inc.  (DUOL)  (CIK 0001562088)",8-K,2026-02-26,0001628280-26-012246:q4fy25duolingo12-31x25shar.htm,2026-04-27T22:53:26Z
valuation_allowance,CTKB,"Cytek Biosciences, Inc.  (CTKB)  (CIK 0001831915)",8-K,2026-02-26,0001193125-26-076768:d106442dex991.htm,2026-04-27T22:53:26Z
valuation_allowance,HGTY,"Hagerty, Inc.  (HGTY)  (CIK 0001840776)",8-K,2026-02-26,0001840776-26-000010:pressreleaseq42025.htm,2026-04-27T22:53:26Z
valuation_allowance,BCO,BRINKS CO  (BCO)  (CIK 0000078890),8-K,2026-02-26,0000078890-26-000008:exhibit992.htm,2026-04-27T22:53:26Z
valuation_allowance,PRGO,PERRIGO Co plc  (PRGO)  (CIK 0001585364),8-K,2026-02-26,0001585364-26-000006:cy25q4ex991pressrelease-sh.htm,2026-04-27T22:53:26Z
valuation_allowance,PAR,PAR TECHNOLOGY CORP  (PAR)  (CIK 0000708821),8-K,2026-02-26,0000708821-26-000024:aex991earningsreleasexq420.htm,2026-04-27T22:53:26Z
valuation_allowance,,"Ready Capital Corp  (RC, RCB, RCC, RCD, RC-PC, RC-PE)  (CIK 0001527590)",8-K,2026-02-26,0001628280-26-012348:readycapital-supplementa.htm,2026-04-27T22:53:26Z
substantial_doubt,EOSE,"Eos Energy Enterprises, Inc.  (EOSE)  (CIK 0001805077)",8-K,2026-02-26,0001628280-26-011958:eoseq4fy25earningsreleas.htm,2026-04-27T22:53:26Z
substantial_doubt,HLEO,Helio Corp /FL/  (HLEO)  (CIK 0001953988),8-K,2026-02-26,0001213900-26-020758:ea02262026-8k_helio.htm,2026-04-27T22:53:26Z
substantial_doubt,WKHS,Workhorse Group Inc.  (WKHS)  (CIK 0001425287),8-K/A,2026-02-26,0001213900-26-020513:ea027828901ex99-1.htm,2026-04-27T22:53:26Z
restatement,SHAK,Shake Shack Inc.  (SHAK)  (CIK 0001620533),8-K,2026-02-26,0001620533-26-000013:a4q25shareholderletter.htm,2026-04-27T22:53:26Z
restatement,CRON,Cronos Group Inc.  (CRON)  (CIK 0001656472),8-K,2026-02-26,0001656472-26-000015:pressreleaseq42025kformat.htm,2026-04-27T22:53:26Z
restatement,SHAK,Shake Shack Inc.  (SHAK)  (CIK 0001620533),8-K,2026-02-26,0001620533-26-000013:shak-20260226_exhibit991.htm,2026-04-27T22:53:26Z
restatement,WKHS,Workhorse Group Inc.  (WKHS)  (CIK 0001425287),8-K/A,2026-02-26,0001213900-26-020513:ea027828901ex23-1.htm,2026-04-27T22:53:26Z
restatement,MAC,MACERICH CO  (MAC)  (CIK 0000912242),8-K,2026-02-26,0001193125-26-077466:d112967dex102.htm,2026-04-27T22:53:26Z
non_reliance,ITRI,"ITRON, INC.  (ITRI)  (CIK 0000780571)",8-K,2026-02-26,0001193125-26-076749:d925789dex101.htm,2026-04-27T22:53:26Z
non_reliance,BSX,BOSTON SCIENTIFIC CORP  (BSX)  (CIK 0000885725),8-K,2026-02-26,0000885725-26-000017:exhibit103-termloancredita.htm,2026-04-27T22:53:26Z
going_concern,WKHS,Workhorse Group Inc.  (WKHS)  (CIK 0001425287),8-K/A,2026-02-26,0001213900-26-020513:ea027828901ex99-1.htm,2026-04-27T22:53:26Z
going_concern,WKHS,Workhorse Group Inc.  (WKHS)  (CIK 0001425287),8-K/A,2026-02-26,0001213900-26-020513:ea027828901ex99-3.htm,2026-04-27T22:53:26Z
going_concern,,"Averin Capital Acquisition Corp.  (ACAA, ACAAU)  (CIK 0002096900)",8-K,2026-02-26,0001213900-26-020798:ea027792101ex99-1_averin.htm,2026-04-27T22:53:26Z
going_concern,EOSE,"Eos Energy Enterprises, Inc.  (EOSE)  (CIK 0001805077)",8-K,2026-02-26,0001628280-26-011958:eoseq4fy25earningsreleas.htm,2026-04-27T22:53:26Z
audit_opinion,NRIS,"Norris Industries, Inc.  (NRIS)  (CIK 0001603793)",8-K,2026-02-26,0001493152-26-008101:form8-k.htm,2026-04-27T22:53:26Z
audit_opinion,PAXH,PREAXIA HEALTH CARE PAYMENT SYSTEMS INC.  (PAXH)  (CIK 0001350156),8-K,2026-02-26,0001079973-26-000257:paxh_8k.htm,2026-04-27T22:53:26Z
audit_opinion,DHX,"DHI GROUP, INC.  (DHX)  (CIK 0001393883)",8-K,2026-02-26,0001393883-26-000049:dhx-20260224.htm,2026-04-27T22:53:26Z
audit_opinion,HLEO,Helio Corp /FL/  (HLEO)  (CIK 0001953988),8-K,2026-02-26,0001213900-26-020758:ea02262026-8k_helio.htm,2026-04-27T22:53:26Z
adverse_opinion,PAXH,PREAXIA HEALTH CARE PAYMENT SYSTEMS INC.  (PAXH)  (CIK 0001350156),8-K,2026-02-26,0001079973-26-000257:paxh_8k.htm,2026-04-27T22:53:26Z
adverse_opinion,DHX,"DHI GROUP, INC.  (DHX)  (CIK 0001393883)",8-K,2026-02-26,0001393883-26-000049:dhx-20260224.htm,2026-04-27T22:53:26Z
adverse_opinion,HLEO,Helio Corp /FL/  (HLEO)  (CIK 0001953988),8-K,2026-02-26,0001213900-26-020758:ea02262026-8k_helio.htm,2026-04-27T22:53:26Z
